"Aquisição de Medicamentos ao abrigo dos Acordos Quadro 2017/6, 2017/67, 2018/55, 2018/64, 2019/40, 2019/61, 2020/18, 2020/2, 2020/50 no âmbito da agregação centralizada 2021";Ao abrigo de acordo-quadro (art.º 259.º);Aquisição de bens móveis;33600000-6;Principal;Produtos farmacêuticos;263450.88 € ;"Hospital do Espírito Santo de Évora, E. P. E. (508085888)";"JANSSEN CILAG FARMACEUTICA, LDA. (500189412)";"263.450,88 €";26-04-2021;22-04-2021;280 dias;Portugal;Artigo 259.º do Código dos Contratos Públicos;;;;;;;2969238;"CP 2017/6 - Acordo Quadro para fornecimento de Medicamentos do Foro Oncológico e Imunomoduladores, às Instituições e Serviços do Serviço Nacional de Saúde";true;https://community.vortal.biz/PRODPublic/Tendering/OpportunityDetail/Index?noticeUID=PT1.NTC.1449601;false;;;Código dos Contratos Públicos ( DL 111-B/2017 );false;false;
Aquisição de Stents;Ao abrigo de acordo-quadro (art.º 259.º);Aquisição de bens móveis;33111710-1;Principal;Material para angiografia;263100.0 € ;"Hospital do Espírito Santo de Évora, E. P. E. (508085888)";MEDTRONIC PORTUGAL LDA                             (504223933);"263.100,00 €";25-03-2014;13-02-2014;365 dias;"Portugal, Évora, Évora";Artigo 259.º do Código dos Contratos Públicos;;;;;;;602205;"CONCURSO PÚBLICO PARA A CELEBRAÇÃO DE CONTRATOS PÚBLICOS DE APROVISIONAMENTO PARA A ÁREA DA SAÚDE, COM VISTA AO FORNECIMENTO SISTEMAS DE STENTS CORONÁRIOS ÀS INSTITUIÇÕES E SERVIÇOS DO SERVIÇO NACIONAL DE SAÚDE";false;;false;;;Código dos Contratos Públicos (DL 18/2008);false;false;
Aquisição de medicamentos do foro oncológico e imunomodulares - CPA 2021/6;Ao abrigo de acordo-quadro (art.º 259.º);Aquisição de bens móveis;33690000-3;Principal;Medicamentos vários;262140.0 € ;"Hospital do Espírito Santo de Évora, E. P. E. (508085888)";JANSSEN CILAG FARMACEUTICA LDA (500189412);"262.140,00 €";17-06-2023;14-12-2022;365 dias;"Portugal, Évora, Évora";Artigo 259.º do Código dos Contratos Públicos;;;;;;;5032541;CP 2021/6 - Medicamentos do foro oncológico e imunomoduladores;false;;false;;;Código dos Contratos Públicos ( DL 111-B/2017 );false;false;
Aquisição de reagentes de microbiologia;Concurso público;Aquisição de bens móveis;33696200-7;Principal;Reagentes para análises ao sangue;261247.14 € ;"Hospital do Espírito Santo de Évora, E. P. E. (508085888)";"CSP SAUDE - CENTRO DE SERVICOS PARTILHADOS, SA. (508440246), BAPTISTA MARQUES DIAGNOSTICA E REAGENTES LDA (501439110), BIOMERIEUX PORTUGAL, LDA. (501524177)";"261.247,14 €";08-09-2017;27-06-2017;180 dias;"Portugal, Évora, Évora";"Artigo 20.º, n.º 1, alínea b) do Código dos Contratos Públicos";;;;;;;Não aplicável.;Não aplicável.;false;;false;;;Código dos Contratos Públicos (DL 18/2008);false;false;
"Aquisição de Medicamentos do Foro Oncológico e Imunomodulares, ao abrigo do CPA 2021/6";Ao abrigo de acordo-quadro (art.º 259.º);Aquisição de bens móveis;33690000-3;Principal;Medicamentos vários;260586.62 € ;"Hospital do Espírito Santo de Évora, E. P. E. (508085888)";"TAKEDA FARMACÊUTICOS PORTUGAL, Lda. (502801204)";"260.586,62 €";26-02-2024;31-01-2024;365 dias;"Portugal, Évora, Évora";Artigo 259.º do Código dos Contratos Públicos;;;;;;;5032541;CP 2021/6 - Medicamentos do foro oncológico e imunomoduladores;false;;false;;;"Código dos Contratos Públicos (DL111-B/2017) e Lei n.º 30/2021, de 21.05";false;false;
Aquisição de medicamentos;Ajuste Direto Regime Geral;Aquisição de bens móveis;33690000-3;Principal;Medicamentos vários;260538.92 € ;"Hospital do Espírito Santo de Évora, E. P. E. (508085888)";"PFIZER BIOFARMACEUTICA, SOCIEDADE UNIPESSOAL, LDA (513300376)";"260.538,92 €";16-10-2017;04-07-2017;180 dias;"Portugal, Évora, Évora";"Artigo 24.º, n.º 1, alínea e) do Código dos Contratos Públicos";;;;;;;Não aplicável.;Não aplicável.;false;;false;;;Código dos Contratos Públicos (DL 18/2008);false;false;
"Aquisição de Stents, CPA 2013/34";Ao abrigo de acordo-quadro (art.º 259.º);Aquisição de bens móveis;33111710-1;Principal;Material para angiografia;259250.0 € ;"Hospital do Espírito Santo de Évora, E. P. E. (508085888)";"MEDTRONIC PORTUGAL LDA                             (504223933), LUSOPALEX LDA                                      (503531588)";"259.250,00 €";02-04-2014;21-03-2014;270 dias;"Portugal, Évora, Évora";"Artigo 20.º, n.º 1, alínea b) do Código dos Contratos Públicos";;;;;;;602205;"CONCURSO PÚBLICO PARA A CELEBRAÇÃO DE CONTRATOS PÚBLICOS DE APROVISIONAMENTO PARA A ÁREA DA SAÚDE, COM VISTA AO FORNECIMENTO SISTEMAS DE STENTS CORONÁRIOS ÀS INSTITUIÇÕES E SERVIÇOS DO SERVIÇO NACIONAL DE SAÚDE";false;;false;;;Código dos Contratos Públicos (DL 18/2008);false;false;
Aquisição de medicamentos: Correctivos de Volémia;Ao abrigo de acordo-quadro (art.º 259.º);Aquisição de bens móveis;33690000-3;Principal;Medicamentos vários;258294.25 € ;"Hospital do Espírito Santo de Évora, E. P. E. (508085888)";"BAXTER MEDICO FARMACEUTICA LDA (503347345), LABESFAL SA (501169580), OVERPHARMA LDA (505792362), B BRAUN MEDICAL LDA (501506543)";"258.294,25 €";07-06-2016;05-05-2016;240 dias;"Portugal, Évora, Évora";"Artigo 20.º, n.º 1, alínea b) do Código dos Contratos Públicos";;;;;;;1331181;Acordo Quadro para fornecimento de corretivos da volémia e outras soluções estéreis às Instituições e Serviços do Serviço Nacional de Saúde;false;;false;;;Código dos Contratos Públicos (DL 18/2008);false;false;
Aquisição de medicamentos vários - exclusivos;Ajuste Direto Regime Geral;Aquisição de bens móveis;33690000-3;Principal;Medicamentos vários;257958.48 € ;"Hospital do Espírito Santo de Évora, E. P. E. (508085888)";"FRESENIUS MEDICAL CARE SA                          (503070220), MERCK SHARP DOHME                                  (500191360), BRISTOL-MYERS SQUIB FARMAC PORTUGUESA SA (500048193), OVERPHARMA - PRODUTOS MEDICOS E FARM.              (505792362), ROCHE FARMACÊUTICA QUIMICA, LDA.                   (500233810)";"257.958,48 €";04-05-2017;09-01-2017;350 dias;Portugal;"Artigo 24.º, n.º 1, alínea e) do Código dos Contratos Públicos";;;;;;;Não aplicável.;Não aplicável.;false;;false;;;Código dos Contratos Públicos (DL 18/2008);false;false;
Aquisição medicamentos de várias áreas terapêuticas;Ao abrigo de acordo-quadro (art.º 259.º);Aquisição de bens móveis;33600000-6;Principal;Produtos farmacêuticos;257581.79 € ;"Hospital do Espírito Santo de Évora, EPE (508085888)";"Janssen Cilag Farmacêutica, Lda (500189412)";"257.581,79 €";25-05-2020;05-02-2020;330 dias;Portugal;Artigo 259.º do Código dos Contratos Públicos;;;;;;;2556987;"CP 2017/65 - Acordo Quadro para fornecimento de Medicamentos de Várias áreas Terapêuticas, às Instituições e Serviços do Serviço Nacional de Saúde";false;;false;;;Código dos Contratos Públicos ( DL 111-B/2017 );false;false;
Aquisição de medicamentos do foro oncológico;Ao abrigo de acordo-quadro (art.º 259.º);Aquisição de bens móveis;33652000-5;Principal;Antineoplásicos e imunomoduladores;257116.03 € ;"Hospital do Espírito Santo de Évora, E. P. E. (508085888)";ROCHE FARMACEUTICA QUIMICA LDA (500233810);"257.116,03 €";28-06-2018;02-04-2018;270 dias;"Portugal, Évora, Évora";Artigo 259.º do Código dos Contratos Públicos;;;;;;;1771819;CP 2015/6 - Acordo quadro para o fornecimento de Medicamentos do Foro Oncológico;false;;false;;;Código dos Contratos Públicos ( DL 111-B/2017 );false;false;
Aquisição de sistemas de cardioversor desfibrilhador;Ao abrigo de acordo-quadro (art.º 259.º);Aquisição de bens móveis;33182000-9;Principal;Material de assistência à função cardíaca;257000.0 € ;"Hospital do Espírito Santo de Évora, E. P. E. (508085888)";"MEDTRONIC PORTUGAL, LDA. (504223933)";"257.000,00 €";29-05-2020;30-12-2019;365 dias;"Portugal, Évora, Évora";Artigo 259.º do Código dos Contratos Públicos;;;;;;;3394183;2018/32 - Acordo Quadro para fornecimento de Sistemas de Cardioversores Desfibrilhadores Implantáveis;false;;false;;;Código dos Contratos Públicos ( DL 111-B/2017 );false;false;
Aquisição de corretivos da volémia;Ao abrigo de acordo-quadro (art.º 259.º);Aquisição de bens móveis;33600000-6;Principal;Produtos farmacêuticos;256653.94 € ;"Hospital do Espírito Santo de Évora, E. P. E. (508085888)";"Fresenius Kabi Pharma, Lda. (504293753), B BRAUN MEDICAL, LDA (501506543)";"256.653,94 €";05-04-2018;14-03-2018;300 dias;"Portugal, Évora, Évora";Artigo 259.º do Código dos Contratos Públicos;;;;;;;2528675;CP 2017/3 - Acordo Quadro para fornecimento de corretivos da volémia e outras soluções estéreis ;false;;false;;;Código dos Contratos Públicos (DL 18/2008);false;false;
"CCS-UMC-00096_2022-CONCURSO PÚBLICO PARA  PRESTAÇÃO DE SERVIÇOS DE VIGILÂNCIA E SEGURANÇA HUMANA PARA O HOSPITAL  DO ESPÍRITO SANTO - ÉVORA, EPE";Concurso público;Aquisição de serviços;79710000-4;Principal;Serviços de segurança;255903.58 € ;"Hospital do Espírito Santo de Évora, E. P. E. (508085888)";"COPS – Companhia Operacional de Segurança, Unipessoal, Lda, (508569974)";"255.903,58 €";01-09-2022;01-07-2022;242 dias;"Portugal, Évora, Évora";"Artigo 20.º, n.º 1, alínea a) do Código dos Contratos Públicos";;;;;;;Não aplicável.;Não aplicável.;true;https://community.vortal.biz/PRODPublic/Tendering/OpportunityDetail/Index?noticeUID=PT1.NTC.1844448;false;;;"Código dos Contratos Públicos (DL111-B/2017) e Lei n.º 30/2021, de 21.05";false;false;
190031/21 - Seguros de Acidentes de Trabalhos RCTFP + CIT;Concurso público;Aquisição de serviços;66512100-3;Principal;Serviços de seguros de acidentes;255774.82 € ;"Hospital do Espírito Santo de Évora, E. P. E. (508085888)";"Lusitania, Companhia de seguros, S.A. (501689168)";"255.774,82 €";02-03-2021;30-12-2020;365 dias;"Portugal, Évora, Évora";"Artigo 20.º, n.º 1, alínea a) do Código dos Contratos Públicos";;;;;;;Não aplicável.;Não aplicável.;false;https://community.vortal.biz/PRODPublic/Tendering/OpportunityDetail/Index?noticeUID=PT1.NTC.1291593;false;;;Código dos Contratos Públicos ( DL 111-B/2017 );false;false;
Aquisição de Medicamentos usados nas afecções oculares e otorrinolaringológicas;Ao abrigo de acordo-quadro (art.º 259.º);Aquisição de bens móveis;33600000-6;Principal;Produtos farmacêuticos;255542.4 € ;"Hospital do Espírito Santo de Évora, E. P. E. (508085888)";"NOVARTIS FARMA-PROD.FARMACÊUTICOS,SA. (500063524)";"255.542,40 €";12-01-2022;22-12-2021;365 dias;Portugal;Artigo 259.º do Código dos Contratos Públicos;;;;;;;5229023;CP 2021/49 - Medicamentos usados nas afeções oculares e otorrinolaringológicas;false;https://community.vortal.biz/PRODPublic/Tendering/OpportunityDetail/Index?noticeUID=PT1.NTC.1710894;false;;;"Código dos Contratos Públicos (DL111-B/2017) e Lei n.º 30/2021, de 21.05";false;false;
Aquisição de Ventiladores em contexto COVID19;Ajuste Direto Regime Geral;Aquisição de bens móveis;33100000-1;Principal;Equipamento médico;255250.0 € ;"Hospital do Espírito Santo de Évora, E. P. E. (508085888)";"Clinifar - Produtos Clínicos e Farmacêuticos, S.A. (503281115)";"255.250,00 €";05-05-2020;20-03-2020;8 dias;"Portugal, Évora, Évora";"Artigo 2º, n.º 1 do DL . nº 10-A/2020, de 13.03";;;;;;;Não aplicável.;Não aplicável.;false;;false;;;"Decreto-Lei n.º 10-A/2020, de 13.03";true;false;
Aquisição de Medicamentos: Bevacizumab + Etanercept;Ajuste Direto Regime Geral;Aquisição de bens móveis;33690000-3;Principal;Medicamentos vários;253782.68 € ;"Hospital do Espírito Santo de Évora, E. P. E. (508085888)";"LAB. PFIZER, LDA. (500162166)";"253.782,68 €";14-09-2023;06-12-2022;365 dias;"Portugal, Évora, Évora";"Artigo 24.º, n.º 1, alínea e), subalínea iii) do Código dos Contratos Públicos";;;;;;;Não aplicável.;Não aplicável.;false;;false;;;Código dos Contratos Públicos ( DL 111-B/2017 );true;false;
"Aquisição ao abrigo dos AQs 2017/6 e 2020/2, para as instituições do SNS";Ao abrigo de acordo-quadro (art.º 259.º);Aquisição de bens móveis;33100000-1;Principal;Equipamento médico;253416.65 € ;"Hospital do Espírito Santo de Évora, EPE (508085888)";"BIOGEN PORTUGAL SOCIEDADE FARMACEUTICA, UNIPESSOAL LDA (506415740)";"253.416,65 €";24-03-2021;24-02-2021;320 dias;Portugal;Artigo 259.º do Código dos Contratos Públicos;;;;;;;2969238;"CP 2017/6 - Acordo Quadro para fornecimento de Medicamentos do Foro Oncológico e Imunomoduladores, às Instituições e Serviços do Serviço Nacional de Saúde";true;https://community.vortal.biz/PRODPublic/Tendering/OpportunityDetail/Index?noticeUID=PT1.NTC.1378875;false;;;Código dos Contratos Públicos ( DL 111-B/2017 );false;false;
Aquisição de medicamentos de várias áreas terapêuticas;Ao abrigo de acordo-quadro (art.º 259.º);Aquisição de bens móveis;33690000-3;Principal;Medicamentos vários;252781.16 € ;"Hospital do Espírito Santo de Évora, E. P. E. (508085888)";"Janssen Cilag Farmacêutica, Lda (500189412)";"252.781,16 €";05-01-2021;10-12-2020;365 dias;"Portugal, Évora, Évora";Artigo 259.º do Código dos Contratos Públicos;;;;;;;2556987;"CP 2017/65 - Acordo Quadro para fornecimento de Medicamentos de Várias áreas Terapêuticas, às Instituições e Serviços do Serviço Nacional de Saúde";false;;false;;;Código dos Contratos Públicos ( DL 111-B/2017 );false;false;
"Aquisição ao abrigo do(s) acordo(s)-quadro 2021/49, 2021/6, 304/2023 e 491/2023 para as Instituições do SNS";Ao abrigo de acordo-quadro (art.º 259.º);Aquisição de bens móveis;33600000-6;Principal;Produtos farmacêuticos;252508.02 € ;"Hospital do Espírito Santo de Évora, EPE (508085888)";PIERRE FABRE MEDICAMENT PORTUGAL (500230366);"252.508,02 €";05-03-2024;29-02-2024;337 dias;"Portugal, Évora, Évora";Artigo 259.º do Código dos Contratos Públicos;;;;;;;6677696;491/2023 - Concurso público internacional para formação do acordo quadro de medicamentos do foro oncológico e imunomoduladores;true;https://community.vortal.biz/PRODPublic/Tendering/OpportunityDetail/Index?noticeUID=PT1.NTC.2740456;false;;;"Código dos Contratos Públicos (DL111-B/2017) e Lei n.º 30/2021, de 21.05";false;false;
"P259-2020-145 - AUTORIZAÇÃO PARA INÍCIO DE PROCEDIMENTO – CONVITE AO ABRIGO DO(S) ACORDO(S) QUADRO 2019/61, 2017/6 E 2019/40 , PARA AS INSTITUIÇÕES DO SNS";Ao abrigo de acordo-quadro (art.º 259.º);Aquisição de bens móveis;33600000-6;Principal;Produtos farmacêuticos;252277.7 € ;"Hospital do Espírito Santo de Évora, EPE (508085888)";"ROCHE FARMACÊUTICA QUIMICA, LDA. (500233810)";"252.277,70 €";21-12-2020;02-12-2020;30 dias;Portugal;Artigo 259.º do Código dos Contratos Públicos;;;;;;;2969238;"CP 2017/6 - Acordo Quadro para fornecimento de Medicamentos do Foro Oncológico e Imunomoduladores, às Instituições e Serviços do Serviço Nacional de Saúde";true;https://community.vortal.biz/PRODPublic/Tendering/OpportunityDetail/Index?noticeUID=PT1.NTC.1289223;false;;;Código dos Contratos Públicos ( DL 111-B/2017 );false;false;
"Convite ao abrigo do acordo-quadro 2021/33 – Cardioversores Desfibrilhadores Implantáveis e Pacemakers, para suprir necessidades na área da saúde";Ao abrigo de acordo-quadro (art.º 259.º);Aquisição de bens móveis;33100000-1;Principal;Equipamento médico;252240.0 € ;"Hospital do Espírito Santo de Évora, E. P. E. (508085888)";ABBOTT MEDICAL PORT. DIST. PROD.MED. (EX. ST.JUDE) (504180746);"252.240,00 €";27-06-2023;01-03-2023;366 dias;"Portugal, Évora, Évora";Artigo 259.º do Código dos Contratos Públicos;;;;;;;5354504;CP 2021/33 Acordo Quadro para fornecimento de Cardioversores Desfibrilhadores Implantáveis e Pacemakers na área da Saúde;true;https://community.vortal.biz/PRODPublic/Tendering/OpportunityDetail/Index?noticeUID=PT1.NTC.2202362;false;;;"Código dos Contratos Públicos (DL111-B/2017) e Lei n.º 30/2021, de 21.05";false;false;
"Aquisição de Medicamento: Ibrutinib, ao abrigo do CPA 2021/61";Ao abrigo de acordo-quadro (art.º 259.º);Aquisição de bens móveis;33690000-3;Principal;Medicamentos vários;250524.0 € ;"Hospital do Espírito Santo de Évora, E. P. E. (508085888)";"JANSSEN CILAG FARMACEUTICA, LDA. (500189412)";"250.524,00 €";23-11-2023;08-11-2023;365 dias;"Portugal, Évora, Évora";Artigo 259.º do Código dos Contratos Públicos;;;;;;;5666621;CP 2021/61 - Medicamentos diversos;false;;false;;;Código dos Contratos Públicos (DL 18/2008);false;false;
"Medicamentos anti-infeciosos, exceto antivíricos e antifúngicos.";Ao abrigo de acordo-quadro (art.º 259.º);Aquisição de bens móveis;33690000-3;Principal;Medicamentos vários;248807.45 € ;"Hospital do Espírito Santo de Évora, E.P.E. (508085888)";"COMBINO PHARM PORTUGAL LDA                         (508622263), GLAXOSMITHKLINE-PROD FARMAC LD                     (500139962), ACTAVIS AS                                         (980334934), HIKMA FARMACEUTICA                                 (502266791), FRESENIUS KABI PHARMA PORTUGAL                     (504293753), LAB PFIZER LDA                                     (500162166), LABORATORIOS NORMON SA                             (505654156), MERCK SHARP & DOME LDA                             (500191360), ROCHE FARMACEUTICA QUIMICA LDA                     (500233810), FARMOZ - SOC TECNICO MEDICINAL SA                  (501505334), OVERPHARMA LDA                                     (505792362), SANDOZ FARMACEUTICA LDA                            (506985261), SIDEFARMA LDA                                      (500717419), LABESFAL SA                                        (501169580), GENERIS - FARMACEUTICA SA                          (508107997), B BRAUN MEDICAL LDA                                (501506543)";"248.807,45 €";18-06-2013;05-04-2013;270 dias;"Portugal, Évora, Évora";Artigo 259.º do Código dos Contratos Públicos;;;;;;;457668;"CONCURSO PÚBLICO PARA A CELEBRAÇÃO DE CONTRATOS PÚBLICOS DE APROVISIONAMENTO PARA A ÁREA DA SAÚDE, COM VISTA AO FORNECIMENTO DE MEDICAMENTOS ANTI-INFECIOSOS: EXCETO ANTIVÍRICOS E ANTUFÚNGICOS, ÀS INSTITUIÇÕES E SERVIÇOS DO SERVIÇO NACIONAL DE SAÚDE";;;false;;;Código dos Contratos Públicos (DL 18/2008);false;false;
120022/33 - PTA;Concurso público;Aquisição de bens móveis;33100000-1;Principal;Equipamento médico;248729.0 € ;"Hospital do Espírito Santo de Évora, E. P. E. (508085888)";Zimmer Biomet (500254990);"248.729,00 €";08-11-2023;08-02-2023;1095 dias;"Portugal, Évora, Évora";"Artigo 20.º, n.º 1, alínea a) do Código dos Contratos Públicos";;;;;;;Não aplicável.;Não aplicável.;false;https://community.vortal.biz/PRODPublic/Tendering/OpportunityDetail/Index?noticeUID=PT1.NTC.2130204;false;;;"Código dos Contratos Públicos (DL111-B/2017) e Lei n.º 30/2021, de 21.05";false;false;
Aquisição ao abrigo do AQ 2020/34 para as instituições do SNS;Ao abrigo de acordo-quadro (art.º 259.º);Aquisição de bens móveis;33600000-6;Principal;Produtos farmacêuticos;247500.0 € ;"Hospital do Espírito Santo de Évora, EPE (508085888)";TERUMO EUROPE ESPAÑA (980472024);"247.500,00 €";20-06-2023;08-03-2023;366 dias;"Portugal, Évora, Évora";Artigo 259.º do Código dos Contratos Públicos;;;;;;;4966311;CP 2020/34 - Acordo Quadro para fornecimento de Stents Coronários às  instituições e serviços de SNS;true;https://community.vortal.biz/PRODPublic/Tendering/OpportunityDetail/Index?noticeUID=PT1.NTC.2200384;false;;;"Código dos Contratos Públicos (DL111-B/2017) e Lei n.º 30/2021, de 21.05";false;false;
"Convite ao abrigo do(s) acordo(s)-quadro 2020/18, 2021/12, 2021/49 2021/55, 2021/6, 2021/61 e 2022/40 para suprir necessidades na área da saúde";Ao abrigo de acordo-quadro (art.º 259.º);Aquisição de bens móveis;33600000-6;Principal;Produtos farmacêuticos;246843.79 € ;"Hospital do Espírito Santo de Évora, E. P. E. (508085888)";"NOVARTIS FARMA-PRODUT.FARMACEUTICOS, SA (500063524)";"246.843,79 €";09-08-2022;07-07-2022;243 dias;"Portugal, Évora, Évora";Artigo 259.º do Código dos Contratos Públicos;;;;;;;5032541;CP 2021/6 - Medicamentos do foro oncológico e imunomoduladores;true;https://community.vortal.biz/PRODPublic/Tendering/OpportunityDetail/Index?noticeUID=PT1.NTC.1925080;false;;;"Código dos Contratos Públicos (DL111-B/2017) e Lei n.º 30/2021, de 21.05";false;false;
Aquisição de Medicamentos do Aparelho Respiratório;Ao abrigo de acordo-quadro (art.º 259.º);Aquisição de bens móveis;33600000-6;Principal;Produtos farmacêuticos;246775.2 € ;"Hospital do Espírito Santo de Évora, E. P. E. (508085888)";"NOVARTIS FARMA-PRODUT.FARMACEUTICOS, SA (500063524)";"246.775,20 €";06-01-2022;22-12-2021;365 dias;Portugal;Artigo 259.º do Código dos Contratos Públicos;;;;;;;3583388;CP 2018/12;false;https://community.vortal.biz/PRODPublic/Tendering/OpportunityDetail/Index?noticeUID=PT1.NTC.1686698;false;;;"Código dos Contratos Públicos (DL111-B/2017) e Lei n.º 30/2021, de 21.05";false;false;
844/2024 - Convite à apresentação de propostas ao abrigo do(s) acordo(s)-quadro 2023/438 - Derivados do plasma humano para aquisição de medicamentos derivados do plasma ;Ao abrigo de acordo-quadro (art.º 259.º);Aquisição de bens móveis;33600000-6;Principal;Produtos farmacêuticos;246320.0 € ;"Hospital do Espírito Santo de Évora, EPE (508085888)";GRIFOLS PORTUGAL - PRODUTOS FARMACÊUTICOS E HOSPITALARES LDA (502041285);"246.320,00 €";14-08-2024;06-03-2024;304 dias;"Portugal, Évora, Évora";Artigo 259.º do Código dos Contratos Públicos;;;;;;;6506197;438/2023 - Acordo-quadro para fornecimento de derivados do plasma humano;true;https://community.vortal.biz/PRODPublic/Tendering/OpportunityDetail/Index?noticeUID=PT1.NTC.2749947;false;;;"Código dos Contratos Públicos (DL111-B/2017) e Lei n.º 30/2021, de 21.05";false;false;
"Convite ao abrigo do(s) acordo(s)-quadro 2019/55, 2021/6 , 2021/61, 2022/40 para suprir necessidades na área da saúde";Ao abrigo de acordo-quadro (art.º 259.º);Aquisição de bens móveis;33600000-6;Principal;Produtos farmacêuticos;245536.72 € ;"Hospital do Espírito Santo de Évora, E. P. E. (508085888)";"ROCHE FARMACÊUTICA QUIMICA, LDA. (500233810)";"245.536,72 €";18-06-2023;11-01-2023;366 dias;"Portugal, Évora, Évora";Artigo 259.º do Código dos Contratos Públicos;;;;;;;5032541;CP 2021/6 - Medicamentos do foro oncológico e imunomoduladores;true;https://community.vortal.biz/PRODPublic/Tendering/OpportunityDetail/Index?noticeUID=PT1.NTC.2155687;false;;;"Código dos Contratos Públicos (DL111-B/2017) e Lei n.º 30/2021, de 21.05";false;false;
Seguro de Acidentes de Trabalho para os Colaboradores em Regime de Trabalho em Funções Publicas e em Contrato Individual de Trabalho;Concurso público;Aquisição de serviços;66512100-3;Principal;Serviços de seguros de acidentes;245277.84 € ;"Hospital do Espírito Santo de Évora, E. P. E. (508085888)";Generali (513300260);"245.277,84 €";02-05-2018;28-12-2017;365 dias;"Portugal, Évora, Évora";"Artigo 20.º, n.º 1, alínea b) do Código dos Contratos Públicos";;;;;;;Não aplicável.;Não aplicável.;false;;false;;;Código dos Contratos Públicos (DL 18/2008);false;false;
Aquisição de medicamentos do foro oncológico e imunomodulares;Ao abrigo de acordo-quadro (art.º 259.º);Aquisição de bens móveis;33600000-6;Principal;Produtos farmacêuticos;244912.0 € ;"Hospital do Espírito Santo de Évora, EPE (508085888)";"ASTELLAS FARMA, LDA.  (502540249)";"244.912,00 €";30-05-2022;28-04-2022;304 dias;"Portugal, Évora, Évora";Artigo 259.º do Código dos Contratos Públicos;;;;;;;5032541;CP 2021/6 - Medicamentos do foro oncológico e imunomoduladores;false;https://community.vortal.biz/PRODPublic/Tendering/OpportunityDetail/Index?noticeUID=PT1.NTC.1826211;false;;;"Código dos Contratos Públicos (DL111-B/2017) e Lei n.º 30/2021, de 21.05";false;false;
Aquisição de dispositivos médicos de ortopedia;Concurso público;Aquisição de bens móveis;33183000-6;Principal;Material de assistência ortopédica;244605.0 € ;"Hospital do Espírito Santo de Évora, E. P. E. (508085888)";"STRYKER PORTUGAL PRODUTOS MEDICOS, LDA (504594214)";"244.605,00 €";27-12-2017;31-10-2017;90 dias;"Portugal, Évora, Évora";"Artigo 20.º, n.º 1, alínea b) do Código dos Contratos Públicos";;;;;;;Não aplicável.;Não aplicável.;false;;false;;;Código dos Contratos Públicos (DL 18/2008);false;false;
Aquisição de medicamentos antirretrovíricos para o tratamento por VIH;Ao abrigo de acordo-quadro (art.º 259.º);Aquisição de bens móveis;33600000-6;Principal;Produtos farmacêuticos;241562.4 € ;"Hospital do Espírito Santo de Évora, EPE (508085888)";"MERCK SHARP & DOHME,LDA (500191360)";"241.562,40 €";30-12-2021;22-12-2021;365 dias;Portugal;Artigo 259.º do Código dos Contratos Públicos;;;;;;;4028557;CP 2019/40 - Medicamentos antirretrovíricos para o tratamento da infeção por VIH;false;https://community.vortal.biz/PRODPublic/Tendering/OpportunityDetail/Index?noticeUID=PT1.NTC.1680096;false;;;"Código dos Contratos Públicos (DL111-B/2017) e Lei n.º 30/2021, de 21.05";false;false;
190024/19 Prestação de Serviços para Sessões de Hemodialise;Concurso público;Aquisição de serviços;85111900-9;Principal;Serviços de diálise hospitalar;241380.0 € ;"Hospital do Espírito Santo de Évora, E. P. E. (508085888)";Fresenius Medical Care	 (503070220);"241.380,00 €";06-03-2019;26-02-2019;330 dias;"Portugal, Évora, Évora";"Artigo 20.º, n.º 1, alínea a) do Código dos Contratos Públicos";;;;;;;Não aplicável.;Não aplicável.;false;;false;;;Código dos Contratos Públicos ( DL 111-B/2017 );false;false;
