Aquisição de medicamentos diversos;Ao abrigo de acordo-quadro (art.º 259.º);Aquisição de bens móveis;33690000-3;Principal;Medicamentos vários;419999.58 € ;"Hospital do Espírito Santo de Évora, EPE (508085888)";NOVARTIS FARMA-PROD FARMACEUT (500063524);"419.999,58 €";16-04-2019;26-03-2019;280 dias;Portugal;Artigo 259.º do Código dos Contratos Públicos;;;;;;;3430281;CP 2018/55;false;;false;;;Código dos Contratos Públicos ( DL 111-B/2017 );false;false;
Aquisição de Medicamentos Diversos - CPA 2021/61;Ao abrigo de acordo-quadro (art.º 259.º);Aquisição de bens móveis;33690000-3;Principal;Medicamentos vários;417540.0 € ;"Hospital do Espírito Santo de Évora, E. P. E. (508085888)";"Janssen-Cilag Farmacêutica, Lda. (500189412)";"417.540,00 €";17-06-2023;21-12-2022;365 dias;"Portugal, Évora, Évora";Artigo 259.º do Código dos Contratos Públicos;;;;;;;5666621;CP 2021/61 - Medicamentos diversos;false;;false;;;Código dos Contratos Públicos ( DL 111-B/2017 );false;false;
"Convite à apresentação de propostas ao abrigo do(s) acordo(s)-quadro 2020/61; 2021/12o; 2021/55; 2021/6; 2021/61; 2022/40 ; 2022/55; 2023/304; 2023/481; 2023/491, para aquisição de medicamentos.";Ao abrigo de acordo-quadro (art.º 259.º);Aquisição de bens móveis;33600000-6;Principal;Produtos farmacêuticos;416938.19 € ;"Hospital do Espírito Santo de Évora, EPE (508085888)";Astellas (502540249);"416.938,19 €";05-03-2024;29-02-2024;337 dias;"Portugal, Évora, Évora";Artigo 259.º do Código dos Contratos Públicos;;;;;;;6677696;491/2023 - Concurso público internacional para formação do acordo quadro de medicamentos do foro oncológico e imunomoduladores;true;https://community.vortal.biz/PRODPublic/Tendering/OpportunityDetail/Index?noticeUID=PT1.NTC.2740851;false;;;"Código dos Contratos Públicos (DL111-B/2017) e Lei n.º 30/2021, de 21.05";false;false;
"Convite ao abrigo do(s) acordo(s)-quadro 2021/6, 2021/61 e 2022/55 para suprir necessidades na área da saúde";Ao abrigo de acordo-quadro (art.º 259.º);Aquisição de bens móveis;33600000-6;Principal;Produtos farmacêuticos;416262.3 € ;"Hospital do Espírito Santo de Évora, E. P. E. (508085888)";"ASTRAZENECA-PRODUTOS FARMACÊUTICOS,LDA. (502942240)";"416.262,30 €";19-06-2023;08-03-2023;366 dias;"Portugal, Évora, Évora";Artigo 259.º do Código dos Contratos Públicos;;;;;;;5032541;CP 2021/6 - Medicamentos do foro oncológico e imunomoduladores;true;https://community.vortal.biz/PRODPublic/Tendering/OpportunityDetail/Index?noticeUID=PT1.NTC.2232184;false;;;"Código dos Contratos Públicos (DL111-B/2017) e Lei n.º 30/2021, de 21.05";false;false;
Aquisição de medicamentos oncológicos;Ao abrigo de acordo-quadro (art.º 259.º);Aquisição de bens móveis;33652100-6;Principal;Antineoplásicos;413804.93 € ;"Hospital do Espírito Santo de Évora, E. P. E. (508085888)";MERCK SA (500650870);"413.804,93 €";27-08-2015;23-07-2015;160 dias;"Portugal, Évora, Évora";Artigo 259.º do Código dos Contratos Públicos;;;;;;;1224054;"CONCURSO PÚBLICO PARA A CELEBRAÇÃO DE CONTRATOS PÚBLICOS DE APROVISIONAMENTO PARA A ÁREA DA SAÚDE, COM VISTA AO FORNECIMENTO DE MEDICAMENTOS DO FORO ONCOLÓGICO II, ÀS INSTITUIÇÕES E SERVIÇOS DO SERVIÇO NACIONAL DE SAÚDE  ";false;;false;;;Código dos Contratos Públicos (DL 18/2008);false;false;
Aquisição Prestação Serviços Médicos em Ginecologia/Obstetrícia ;Ajuste Direto Regime Geral;Aquisição de serviços;79625000-1;Principal;Serviços de fornecimento de pessoal médico;413424.0 € ;"Hospital do Espírito Santo de Évora, E. P. E. (508085888)";"KNOWER PROJECTS, S.A (506111148)";"413.424,00 €";12-04-2023;24-08-2022;122 dias;"Portugal, Évora, Évora";"Artigo 24.º, n.º 1, alínea c) do Código dos Contratos Públicos";;;;;;;Não aplicável.;Não aplicável.;false;;false;;;Código dos Contratos Públicos ( DL 111-B/2017 );true;false;
Prestação de serviços médicos;Ao abrigo de acordo-quadro (art.º 259.º);Aquisição de serviços;85120000-6;Principal;Serviços de prática médica e serviços conexos;412318.92 € ;"Hospital do Espírito Santo de Évora, E. P. E. (508085888)";"RANDSTAD II - PRESTAÇÃO DE SERVIÇOS, LDA (503298999)";"412.318,92 €";07-06-2017;05-04-2017;300 dias;"Portugal, Évora, Évora";Artigo 259.º do Código dos Contratos Públicos;;;;;;;1490434;ACORDO QUADRO PARA PRESTAÇÃO DE SERVIÇOS MÉDICOS ÀS INSTITUIÇÕES E SERVIÇOS DO SERVIÇO NACIONAL DE SAÚDE;false;;false;;;Código dos Contratos Públicos (DL 18/2008);false;false;
"Aquisição de Medicamentos do Foro Oncológico e Imunomodulares, ao abrigo do CPA 2021/6";Ao abrigo de acordo-quadro (art.º 259.º);Aquisição de bens móveis;33690000-3;Principal;Medicamentos vários;410498.4 € ;"Hospital do Espírito Santo de Évora, E. P. E. (508085888)";MERCK SHARP DOHME (500191360);"410.498,40 €";26-02-2024;31-01-2024;365 dias;"Portugal, Évora, Évora";Artigo 259.º do Código dos Contratos Públicos;;;;;;;5032541;CP 2021/6 - Medicamentos do foro oncológico e imunomoduladores;false;;false;;;"Código dos Contratos Públicos (DL111-B/2017) e Lei n.º 30/2021, de 21.05";false;false;
180101/19 - Solução integrada de CPD de continuidade de negócio e Disaster Recovery;Concurso público;Aquisição de bens móveis;30211500-6;Principal;Unidade central de processamento (UCP) ou processadora;408999.7 € ;"Hospital do Espírito Santo de Évora, E. P. E. (508085888)";"GLINTT - HEALTHCARE SOLUTIONS, SA (502479418)";"408.999,70 €";02-03-2020;20-02-2020;120 dias;"Portugal, Évora, Évora";"Artigo 20.º, n.º 1, alínea a) do Código dos Contratos Públicos";;;;;;;Não aplicável.;Não aplicável.;false;;false;;;Código dos Contratos Públicos ( DL 111-B/2017 );false;false;
Aquisição de medicamentos do foro oncológico e imunomodulares II - CPA 2021/6;Ao abrigo de acordo-quadro (art.º 259.º);Aquisição de bens móveis;33690000-3;Principal;Medicamentos vários;408600.14 € ;"Hospital do Espírito Santo de Évora, E. P. E. (508085888)";"BIOGEN PORTUGAL, SOC FARMACÊUTICA, UNIPESSOAL (506415740)";"408.600,14 €";18-06-2023;14-12-2022;365 dias;"Portugal, Évora, Évora";Artigo 259.º do Código dos Contratos Públicos;;;;;;;5032541;CP 2021/6 - Medicamentos do foro oncológico e imunomoduladores;false;;false;;;Código dos Contratos Públicos ( DL 111-B/2017 );false;false;
Prestação de serviços de vigilância e segurança;Ao abrigo de acordo-quadro (art.º 259.º);Aquisição de serviços;79710000-4;Principal;Serviços de segurança;404043.94 € ;"Hospital do Espírito Santo de Évora, E. P. E. (508085888)";"COMANSEGUR-SEGURANÇA PRIVADA, S.A. (503586579)";"404.043,94 €";26-04-2018;01-03-2018;330 dias;"Portugal, Évora, Évora";Artigo 259.º do Código dos Contratos Públicos;;;;;;;613183;Acordo quadro para a prestação de serviços de vigilância e segurança;false;;false;;;Código dos Contratos Públicos (DL 18/2008);false;false;
Aquisição de Derivados do Plasma;Ao abrigo de acordo-quadro (art.º 259.º);Aquisição de bens móveis;33141520-1;Principal;Derivados do plasma;398575.6 € ;"Hospital do Espírito Santo de Évora, E. P. E. (508085888)";"BAXTER MEDICO FARMACEUTICA LDA (503347345), OCTAPHARMA - PROD FARMACEUTICO (502820780), CSL BEHRING, LDA (503047201)";"398.575,60 €";08-06-2015;28-01-2015;300 dias;"Portugal, Évora, Évora";Artigo 259.º do Código dos Contratos Públicos;;;;;;;1423488; ACORDO QUADRO PARA FORNECIMENTO DE DERIVADOS DO PLASMA HUMANO ÀS INSTITUIÇÕES E SERVIÇOS DO SERVIÇO NACIONAL DE SAÚDE CP 2015/9;false;;false;;;Código dos Contratos Públicos (DL 18/2008);false;false;
Aquisição de Eletricidade;Concurso público;Aquisição de bens móveis;09300000-2;Principal;"Electricidade, aquecimento, energia solar e nuclear";398509.74 € ;"Hospital do Espírito Santo de Évora, E. P. E. (508085888)";"Iberdrola Clientes Portugal, Unipessoal, Lda. (502124083)";"398.509,74 €";09-04-2024;07-03-2024;306 dias;"Portugal, Évora, Évora";"Artigo 20.º, n.º 1, alínea a) do Código dos Contratos Públicos";;;;;;;Não aplicável.;Não aplicável.;true;https://community.vortal.biz/PRODPublic/Tendering/OpportunityDetail/Index?noticeUID=PT1.NTC.2713971;false;;;"Código dos Contratos Públicos (DL111-B/2017) e Lei n.º 30/2021, de 21.05";false;false;
110001/19 - Reagentes Imunoquímica;Concurso público;Aquisição de bens móveis;33696500-0;Principal;Reagentes de laboratório;397549.1 € ;"Hospital do Espírito Santo de Évora, E. P. E. (508085888)";OCD - CLINICAL DIAGNOSTICAS PORTUGAL UNIPESSOAL LDA (513032665);"397.549,10 €";14-02-2019;01-02-2019;365 dias;"Portugal, Évora, Évora";"Artigo 20.º, n.º 1, alínea a) do Código dos Contratos Públicos";;;;;;;Não aplicável.;Não aplicável.;false;;false;;;Código dos Contratos Públicos ( DL 111-B/2017 );false;false;
190025/19 - PS MCDT's Radiologia;Concurso público;Aquisição de serviços;85100000-0;Principal;Serviços de saúde;393726.15 € ;"Hospital do Espírito Santo de Évora, E. P. E. (508085888)";"CRX Centro Radiodiagnóstico de Évora, Lda. (501706097), CDI - CLINICA DIAGNOSTICO POR IMAGEM (502830654)";"393.726,15 €";30-01-2019;24-01-2019;365 dias;"Portugal, Évora, Évora";"Artigo 20.º, n.º 1, alínea a) do Código dos Contratos Públicos";;;;;;;Não aplicável.;Não aplicável.;false;;false;;;Código dos Contratos Públicos ( DL 111-B/2017 );false;false;
Aquisição de reagentes para biologia molecular;Concurso público;Aquisição de bens móveis;33696200-7;Principal;Reagentes para análises ao sangue;392000.0 € ;"Hospital do Espírito Santo de Évora, EPE (508085888)";"Roche, Sistemas Diagnóstico (504282921)";"392.000,00 €";14-03-2014;21-02-2014;1095 dias;"Portugal, Évora, Évora";"Artigo 20.º, n.º 1, alínea b) do Código dos Contratos Públicos";;;;;;;Não aplicável.;Não aplicável.;false;;false;;;Código dos Contratos Públicos (DL 18/2008);false;false;
Aquisição de dispositivos médicos de oftalmologia;Concurso público;Aquisição de bens móveis;33190000-8;Principal;Dispositivos e produtos médicos variados;390783.38 € ;"Hospital do Espírito Santo de Évora, E. P. E. (508085888)";"OPHTEC PORTUGAL-EXCELENTITULO UNIP LDA (510255086), ORSOLUTIONS (513498664),  BAUSCH & LOMB S A (980218764), FILSAT (506708616)";"390.783,38 €";02-03-2016;28-01-2016;365 dias;"Portugal, Évora, Évora";"Artigo 20.º, n.º 1, alínea b) do Código dos Contratos Públicos";;;;;;;Não aplicável.;Não aplicável.;false;;false;;;Código dos Contratos Públicos (DL 18/2008);false;false;
Aquisição de medicamentos : Factores Recombinantes da Coagulação;Ao abrigo de acordo-quadro (art.º 259.º);Aquisição de bens móveis;33690000-3;Principal;Medicamentos vários;389743.15 € ;"Hospital do Espírito Santo de Évora, E. P. E. (508085888)";"PFIZER BIOFARMACEUTICA SOC UNIPESSOAL LDA (513300376), BAYER PORTUGAL S A (500043256)";"389.743,15 €";18-03-2016;02-03-2016;300 dias;"Portugal, Évora, Évora";Artigo 259.º do Código dos Contratos Públicos;;;;;;;606744;"CONCURSO PÚBLICO PARA A CELEBRAÇÃO DE CONTRATOS PÚBLICOS DE APROVISIONAMENTO PARA A ÁREA DA SAÚDE, COM VISTA AO FORNECIMENTO DE FATORES RECOMBINANTES DA COAGULAÇÃO, ÀS INSTITUIÇÕES E SERVIÇOS DO SERVIÇO NACIONAL DE SAÚDE";false;;false;;;Código dos Contratos Públicos (DL 18/2008);false;false;
"731/2023 - Convite à apresentação de propostas ao abrigo do(s) acordo(s)-quadro 2021/47, 2021/6, 2021/61, 2022/40, 2023/305, 2023/481 e 2023/492";Ao abrigo de acordo-quadro (art.º 259.º);Aquisição de bens móveis;33600000-6;Principal;Produtos farmacêuticos;388035.29 € ;"Hospital do Espírito Santo de Évora, EPE (508085888)";Merck Sharp e Dohme Lda. (500191360);"388.035,29 €";26-12-2023;26-12-2023;366 dias;"Portugal, Évora, Évora";Artigo 259.º do Código dos Contratos Públicos;;;;;;;5032541;CP 2021/6 - Medicamentos do foro oncológico e imunomoduladores;true;https://community.vortal.biz/PRODPublic/Tendering/OpportunityDetail/Index?noticeUID=PT1.NTC.2649864;false;;;"Código dos Contratos Públicos (DL111-B/2017) e Lei n.º 30/2021, de 21.05";false;false;
Aquisição de medicamentos do foro oncológico e imunomodulares I - CPA 2021/6;Ao abrigo de acordo-quadro (art.º 259.º);Aquisição de bens móveis;33690000-3;Principal;Medicamentos vários;385841.94 € ;"Hospital do Espírito Santo de Évora, E. P. E. (508085888)";MERCK  S.A. (500650870);"385.841,94 €";04-06-2023;28-12-2022;365 dias;"Portugal, Évora, Évora";Artigo 259.º do Código dos Contratos Públicos;;;;;;;5032541;CP 2021/6 - Medicamentos do foro oncológico e imunomoduladores;false;;false;;;Código dos Contratos Públicos ( DL 111-B/2017 );false;false;
PS Limpeza;Ajuste Direto Regime Geral;Aquisição de serviços;90910000-9;Principal;Serviços de limpeza;383551.2 € ;"Hospital do Espírito Santo de Évora, EPE (508085888)";"IBERLIM – SOCIEDADE TÉCNICA DE LIMPEZAS, S.A. (502117281)";"383.551,20 €";26-05-2020;25-03-2020;90 dias;Portugal;"Artigo 24.º, n.º 1, alínea c) do Código dos Contratos Públicos";;;;;;;Não aplicável.;Não aplicável.;false;https://community.vortal.biz/PRODPublic/Tendering/OpportunityDetail/Index?noticeUID=PT1.NTC.1130527;false;;;Código dos Contratos Públicos ( DL 111-B/2017 );true;false;
Aquisição de Medicamento: Efmoroctocog Alfa;Ajuste Direto Regime Geral;Aquisição de bens móveis;33690000-3;Principal;Medicamentos vários;380596.2 € ;"Hospital do Espírito Santo de Évora, E. P. E. (508085888)";"PROFARIN-DIST.FARMAC.IND.,LDA. (500223238)";"380.596,20 €";18-06-2023;02-01-2023;365 dias;"Portugal, Évora, Évora";"Artigo 24.º, n.º 1, alínea e), subalínea iii) do Código dos Contratos Públicos";;;;;;;Não aplicável.;Não aplicável.;false;;false;;;Código dos Contratos Públicos ( DL 111-B/2017 );true;false;
Aquisição de DM oftalmologia;Concurso público;Aquisição de bens móveis;33190000-8;Principal;Dispositivos e produtos médicos variados;445620.0 € ;"Hospital do Espírito Santo de Évora, E.P.E. (508085888)";"Bausch & Lomb (980218764), Alcon (501251685), Abbott Medical (980262364), Oftaltec (503197149), Filsat (506708616), Optifar (501609377)";"380.520,00 €";27-02-2014;13-01-2014;365 dias;"Portugal, Évora, Évora";"Artigo 20.º, n.º 1, alínea b) do Código dos Contratos Públicos";;;;;;;Não aplicável.;Não aplicável.;false;;false;;;Código dos Contratos Públicos (DL 18/2008);false;false;
"AD-2021-058-Ajuste direto para aquisição de E375 - ECULIZUMAB [300 MG; SOL INJ; FRS] para suprir necessidades na área da saúde";Ajuste Direto Regime Geral;Aquisição de bens móveis;33600000-6;Principal;Produtos farmacêuticos;380067.84 € ;"Hospital do Espírito Santo de Évora, E. P. E. (508085888)";ALEXION PHARMA SPAIN S.L. - SUCURSAL P (980553768);"380.067,84 €";08-03-2022;24-02-2022;365 dias;"Portugal, Évora, Évora";"Artigo 24.º, n.º 1, alínea e), subalínea ii) do Código dos Contratos Públicos";;;;;;;Não aplicável.;Não aplicável.;true;https://community.vortal.biz/PRODPublic/Tendering/OpportunityDetail/Index?noticeUID=PT1.NTC.1779431;false;;;"Código dos Contratos Públicos (DL111-B/2017) e Lei n.º 30/2021, de 21.05";false;false;
"AD-2020-162 - Ajuste Direto para a aquisição de bens para suprir necessidades, para as Instituições do SNS";Ajuste Direto Regime Geral;Aquisição de bens móveis;33600000-6;Principal;Produtos farmacêuticos;372911.28 € ;"Hospital do Espírito Santo de Évora, EPE (508085888)";ASTELLAS FARMA LDA (502540249);"372.911,28 €";09-04-2021;19-02-2021;320 dias;Portugal;"Artigo 24.º, n.º 1, alínea e), subalínea ii) do Código dos Contratos Públicos";;;;;;;Não aplicável.;Não aplicável.;true;https://community.vortal.biz/PRODPublic/Tendering/OpportunityDetail/Index?noticeUID=PT1.NTC.1387296;false;;;Código dos Contratos Públicos ( DL 111-B/2017 );false;false;
Obra de Ampliação Urgência Geral;Consulta Prévia;Empreitadas de obras públicas;45215140-0;Principal;Construção de instalações hospitalares;368900.0 € ;"Hospital do Espírito Santo de Évora, EPE (508085888)";"Algeco - Construções Pré-Fabricadas, S.A. (502721871)";"368.900,00 €";17-12-2020;16-10-2020;120 dias;Portugal;"Artigo 24.º, n.º 1, alínea c) do Código dos Contratos Públicos";;;;;;;Não aplicável.;Não aplicável.;false;https://community.vortal.biz/PRODPublic/Tendering/OpportunityDetail/Index?noticeUID=PT1.NTC.1213484;false;;;Código dos Contratos Públicos ( DL 111-B/2017 );false;false;
Aquisição de Medicamento: Efmoroctocog Alfa de Várias Dosagens;Ajuste Direto Regime Geral;Aquisição de bens móveis;33690000-3;Principal;Medicamentos vários;368399.6 € ;"Hospital do Espírito Santo de Évora, E. P. E. (508085888)";PROFARIN DISTRIBUIDORA DE PROD. FARM. INDUSTRIAIS (500223238);"368.399,60 €";15-02-2024;05-12-2023;365 dias;"Portugal, Évora, Évora";"Artigo 20.º, n.º 1, alínea d) do Código dos Contratos Públicos";;;;;;;Não aplicável.;Não aplicável.;false;;false;;;"Código dos Contratos Públicos (DL111-B/2017) e Lei n.º 30/2021, de 21.05";false;false;
Aquisição de Endoprótese Desertas;Ajuste Direto Regime Geral;Aquisição de bens móveis;33100000-1;Principal;Equipamento médico;366820.0 € ;"Hospital do Espírito Santo de Évora, E. P. E. (508085888)";LUSOPALEX (503531588);"366.820,00 €";20-07-2022;01-07-2022;915 dias;"Portugal, Évora, Évora";"Artigo 24.º, n.º 1, alínea b) do Código dos Contratos Públicos";;;;;;;Não aplicável.;Não aplicável.;false;;false;;;Código dos Contratos Públicos ( DL 111-B/2017 );true;false;
Prestação de Serviços de Vigilância e Segurança;Concurso público;Aquisição de serviços;79710000-4;Principal;Serviços de segurança;Inexistente;"Hospital do Espírito Santo de Évora, E.P.E. (508085888)";Comansegur - Segurança Privada SA (503586579);"363.900,00 €";03-02-2011;02-02-2011;365 dias;"Portugal, Évora, Évora";"Artigo 20.º, n.º 1, alínea b) do Código dos Contratos Públicos";;;;;;;Não aplicável.;Não aplicável.;;;false;;;Código dos Contratos Públicos (DL 18/2008);false;false;
Aquisição de medicamentos diversos;Ao abrigo de acordo-quadro (art.º 259.º);Aquisição de bens móveis;33690000-3;Principal;Medicamentos vários;360000.0 € ;"Unidade Local de Saúde do Alentejo Central, E.P.E (508085888)";"Novartis Farma - Produtos Farmacêuticos, S.A. (500063524)";"360.000,00 €";04-10-2024;26-06-2024;365 dias;"Portugal, Évora, Évora";Artigo 259.º do Código dos Contratos Públicos;;;;;;;7013489;491/2023 - Concurso público internacional para formação do acordo quadro de medicamentos do foro oncológico e imunomoduladores;false;https://community.vortal.biz/Public/contract-notice-view/PT1.NTC.2890655/;false;;;"Código dos Contratos Públicos (DL111-B/2017) e Lei n.º 30/2021, de 21.05";false;false;
Aquisição de medicamentos diversos - CPA 2021/55;Ao abrigo de acordo-quadro (art.º 259.º);Aquisição de bens móveis;33690000-3;Principal;Medicamentos vários;359775.0 € ;"Hospital do Espírito Santo de Évora, E. P. E. (508085888)";TAKEDA FARMACEUTICA PORTUGAL (502801204);"359.775,00 €";04-06-2023;25-01-2023;365 dias;"Portugal, Évora, Évora";Artigo 259.º do Código dos Contratos Públicos;;;;;;;5354516;CP 2021/55 - Medicamentos diversos;false;;false;;;Código dos Contratos Públicos ( DL 111-B/2017 );false;false;
MCDT's de Radiologia;Concurso público;Aquisição de serviços;85150000-5;Principal;Serviços de imagiologia médica;359688.35 € ;"Hospital do Espírito Santo de Évora, E. P. E. (508085888)";"CRX Centro Radiodiagnóstico de Évora, Lda. (501706097), CDI - CLINICA DIAGNOSTICO POR IMAGEM (502830654)";"359.688,35 €";01-03-2017;18-01-2017;310 dias;"Portugal, Évora, Évora";"Artigo 20.º, n.º 1, alínea b) do Código dos Contratos Públicos";;;;;;;Não aplicável.;Não aplicável.;false;;false;;;Código dos Contratos Públicos (DL 18/2008);false;false;
Aquisição de medicamentos do foro oncológico e imunomodulares;Ao abrigo de acordo-quadro (art.º 259.º);Aquisição de bens móveis;33600000-6;Principal;Produtos farmacêuticos;359449.46 € ;"Hospital do Espírito Santo de Évora, EPE (508085888)";"ASTRAZENECA-PRODUTOS FARMACÊUTICOS,LDA. (502942240)";"359.449,46 €";23-04-2021;03-03-2021;300 dias;Portugal;Artigo 259.º do Código dos Contratos Públicos;;;;;;;2969238;"CP 2017/6 - Acordo Quadro para fornecimento de Medicamentos do Foro Oncológico e Imunomoduladores, às Instituições e Serviços do Serviço Nacional de Saúde";false;https://community.vortal.biz/PRODPublic/Tendering/OpportunityDetail/Index?noticeUID=PT1.NTC.1311428;false;;;Código dos Contratos Públicos ( DL 111-B/2017 );false;false;
120019/22 - DM Oftalmologia;Concurso público;Aquisição de bens móveis;33190000-8;Principal;Dispositivos e produtos médicos variados;358188.8 € ;"Hospital do Espírito Santo de Évora, E. P. E. (508085888)";BAUSCH  LOMB (980218764);"358.188,80 €";23-04-2024;08-06-2022;1095 dias;"Portugal, Évora, Évora";"Artigo 20.º, n.º 1, alínea a) do Código dos Contratos Públicos";;;;;;;Não aplicável.;Não aplicável.;false;https://community.vortal.biz/PRODPublic/Tendering/OpportunityDetail/Index?noticeUID=PT1.NTC.1836971;false;;;"Código dos Contratos Públicos (DL111-B/2017) e Lei n.º 30/2021, de 21.05";false;false;
Aquisição de medicamento - Abemaciclib;Ajuste Direto Regime Geral;Aquisição de bens móveis;33690000-3;Principal;Medicamentos vários;356717.09 € ;"Hospital do Espírito Santo de Évora, EPE (508085888)";LILLY PORTUGAL - PRODUTOS FARMACEUTICOS (500165602);"356.717,09 €";27-12-2021;24-11-2021;365 dias;Portugal;"Artigo 24.º, n.º 1, alínea e), subalínea iii) do Código dos Contratos Públicos";;;;;;;Não aplicável.;Não aplicável.;false;https://community.vortal.biz/PRODPublic/Tendering/OpportunityDetail/Index?noticeUID=PT1.NTC.1718020;false;;;"Código dos Contratos Públicos (DL111-B/2017) e Lei n.º 30/2021, de 21.05";false;false;
Aquisição de Medicamentos Diversos;Ao abrigo de acordo-quadro (art.º 259.º);Aquisição de bens móveis;33690000-3;Principal;Medicamentos vários;356569.32 € ;"Hospital do Espírito Santo de Évora, E. P. E. (508085888)";"LILLY PORTUGAL - PRODUTOS FARMAEUTICOS LDA (500165602), SANOFI- PRODUTOS FARMACEUTICOS LDA (500134960), BAXTER MEDICO FARMACEUTICA LDA (503347345), AMGEN BIOFARMACEUTICA LDA (502942959), BRISTOL-MYERS SQUIB FARMAC PORTUGUESA SA (500048193), ASTRAZENECA PROD FARM LDA (502942240), SANDOZ FARMACEUTICA LDA (506985261), LABESFAL SA (501169580), UNILFARMA (500293023), FRESENIUS MEDICAL CARE LDA (503070220)";"356.569,32 €";30-08-2016;27-07-2016;150 dias;"Portugal, Évora, Évora";Artigo 259.º do Código dos Contratos Públicos;;;;;;;1513257;Acordo quadro para fornecimento de Medicamentos diversos II   às Instituições e Serviços do Serviço Nacional de Saúde  ;false;;false;;;Código dos Contratos Públicos (DL 18/2008);false;false;
Aquisição de medicamentos do sistema nervoso central;Ao abrigo de acordo-quadro (art.º 259.º);Aquisição de bens móveis;33600000-6;Principal;Produtos farmacêuticos;355320.0 € ;"Unidade Local de Saúde do Alentejo Central, E.P.E (508085888)";"LAB. PFIZER, LDA. (500162166)";"355.320,00 €";14-11-2024;06-11-2024;365 dias;"Portugal, Évora, Évora";Artigo 259.º do Código dos Contratos Públicos;;;;;;;7015917;436/2023 - Medicamentos para o sistema nervoso central;false;https://community.vortal.biz/Public/contract-notice-view/PT1.NTC.3013547/;false;;;"Código dos Contratos Públicos (DL111-B/2017) e Lei n.º 30/2021, de 21.05";false;false;
Aquisição de Serviços Médicos na Urgência;Ao abrigo de acordo-quadro (art.º 259.º);Aquisição de serviços;85121200-5;Principal;Serviços de medicina especializada;354806.4 € ;"Hospital do Espírito Santo de Évora, E. P. E. (508085888)";GS24 HEALTHCARE SOLUTIONS LDA                      (507824652);"354.806,40 €";02-04-2014;08-01-2014;365 dias;"Portugal, Évora, Évora";Artigo 259.º do Código dos Contratos Públicos;;;;;;;454020;"CONCURSO PÚBLICO PARA A CELEBRAÇÃO DE CONTRATOS PÚBLICOS DE APROVISIONAMENTO PARA A ÁREA DA SAÚDE, COM VISTA À PRESTAÇÃO DE SERVIÇOS MÉDICOS ÀS INSTITUIÇÕES E SERVIÇOS DO SERVIÇO NACIONAL DE SAÚDE";false;;false;;;Código dos Contratos Públicos (DL 18/2008);false;false;
190047/23 - PSM Pediatria;Concurso público;Aquisição de serviços;85121290-2;Principal;Serviços de pediatria ou urologia;353736.24 € ;"Hospital do Espírito Santo de Évora, EPE (508085888)";"Medipeople - Soluções de Saúde e Educação, Lda (508543436)";"353.736,24 €";04-06-2023;30-01-2023;365 dias;"Portugal, Évora, Évora";"Artigo 20.º, n.º 1, alínea a) do Código dos Contratos Públicos";;;;;;;Não aplicável.;Não aplicável.;false;https://community.vortal.biz/PRODPublic/Tendering/OpportunityDetail/Index?noticeUID=PT1.NTC.2128347;false;;;"Código dos Contratos Públicos (DL111-B/2017) e Lei n.º 30/2021, de 21.05";false;false;
Aquisição de medicamentos do foro oncológico e imunomodulares;Ao abrigo de acordo-quadro (art.º 259.º);Aquisição de bens móveis;33600000-6;Principal;Produtos farmacêuticos;351267.84 € ;"Hospital do Espírito Santo de Évora, EPE (508085888)";"JANSSEN CILAG FARMACEUTICA, LDA. (500189412)";"351.267,84 €";22-04-2021;13-01-2021;350 dias;Portugal;Artigo 259.º do Código dos Contratos Públicos;;;;;;;2969238;"CP 2017/6 - Acordo Quadro para fornecimento de Medicamentos do Foro Oncológico e Imunomoduladores, às Instituições e Serviços do Serviço Nacional de Saúde";false;https://community.vortal.biz/PRODPublic/Tendering/OpportunityDetail/Index?noticeUID=PT1.NTC.1311428;false;;;Código dos Contratos Públicos ( DL 111-B/2017 );false;false;
