"CONVITE À APRESENTAÇÃO DE PROPOSTA AO ABRIGO DO(S) ACORDO(S) QUADRO 2017/6 - MEDICAMENTOS DO FORO ONCOLÓGICO E IMUNOMODULADORES e 2016/18, 2017/61; 2017/6; 2018/7; 2018/12 e 2018/64, PARA AS INSTITUIÇ";Ao abrigo de acordo-quadro (art.º 259.º);Aquisição de bens móveis;33600000-6;Principal;Produtos farmacêuticos;714399.92 € ;"Hospital do Espírito Santo de Évora, E. P. E. (508085888)";"NOVARTIS FARMA-PRODUT.FARMACEUTICOS, SA (500063524)";"714.399,92 €";20-01-2020;08-01-2020;360 dias;Portugal;Artigo 259.º do Código dos Contratos Públicos;;;;;;;2969238;"CP 2017/6 - Acordo Quadro para fornecimento de Medicamentos do Foro Oncológico e Imunomoduladores, às Instituições e Serviços do Serviço Nacional de Saúde";true;;false;;;Código dos Contratos Públicos ( DL 111-B/2017 );false;false;
"Aquisição de Medicamentos do Foro Oncológico e Imunomodulares, ao abrigo do CPA 2021/6";Ao abrigo de acordo-quadro (art.º 259.º);Aquisição de bens móveis;33690000-3;Principal;Medicamentos vários;709137.3 € ;"Hospital do Espírito Santo de Évora, E. P. E. (508085888)";"LILLY PORTUGAL - PRODUTOS FARMACÊUTICOS, LDA. (500165602)";"709.137,30 €";22-02-2024;31-01-2024;365 dias;"Portugal, Évora, Évora";Artigo 259.º do Código dos Contratos Públicos;;;;;;;5032541;CP 2021/6 - Medicamentos do foro oncológico e imunomoduladores;false;;false;;;"Código dos Contratos Públicos (DL111-B/2017) e Lei n.º 30/2021, de 21.05";false;false;
Fornecimento de eletricidade em regime de mercado livre para Portugal Continental;Ao abrigo de acordo-quadro (art.º 259.º);Aquisição de bens móveis;09310000-5;Principal;Electricidade;708827.26 € ;"Hospital do Espírito Santo de Évora, E. P. E. (508085888)";"PETROGAL, S.A. (500697370)";"708.827,26 €";01-06-2022;22-12-2021;365 dias;"Portugal, Évora, Évora";Artigo 259.º do Código dos Contratos Públicos;;;;;;;4313070;Acordo-Quadro para o fornecimento de eletricidade em regime de mercado livre para Portugal Continental;true;https://plataforma-sncp.espap.gov.pt/espap/faces/app/pap/listaDocs.jsp?papId=1631;false;;;Código dos Contratos Públicos ( DL 111-B/2017 );false;false;
"Aquisição de Medicamentos do Foro Oncológico e Imunomodulares, ao abrigo do CPA 2021/6";Ao abrigo de acordo-quadro (art.º 259.º);Aquisição de bens móveis;33690000-3;Principal;Medicamentos vários;708632.34 € ;"Hospital do Espírito Santo de Évora, E. P. E. (508085888)";"ASTRAZENECA-PRODUTOS FARMACÊUTICOS,LDA. (502942240)";"708.632,34 €";22-02-2024;31-01-2024;365 dias;"Portugal, Évora, Évora";Artigo 259.º do Código dos Contratos Públicos;;;;;;;5032541;CP 2021/6 - Medicamentos do foro oncológico e imunomoduladores;false;;false;;;"Código dos Contratos Públicos (DL111-B/2017) e Lei n.º 30/2021, de 21.05";false;false;
"418/2023 - Convite ao abrigo do(s) acordo(s)-quadro 2021/41 (Medicamentos antivíricos e antifúngicos), 2020/1 (Medicamentos do aparelho cardiovascular), 2022/40 (Medicamentos antirretrovíricos para o ";Ao abrigo de acordo-quadro (art.º 259.º);Aquisição de bens móveis;33600000-6;Principal;Produtos farmacêuticos;707208.08 € ;"Hospital do Espírito Santo de Évora, EPE (508085888)";"NOVARTIS FARMA-PRODUT.FARMACEUTICOS, SA (500063524)";"707.208,08 €";19-06-2023;12-04-2023;305 dias;"Portugal, Évora, Évora";Artigo 259.º do Código dos Contratos Públicos;;;;;;;5354516;CP 2021/55 - Medicamentos diversos;true;https://community.vortal.biz/PRODPublic/Tendering/OpportunityDetail/Index?noticeUID=PT1.NTC.2276563;false;;;"Código dos Contratos Públicos (DL111-B/2017) e Lei n.º 30/2021, de 21.05";false;false;
Aquisição de medicamentos do foro oncológico;Ao abrigo de acordo-quadro (art.º 259.º);Aquisição de bens móveis;33652000-5;Principal;Antineoplásicos e imunomoduladores;706214.84 € ;"Hospital do Espírito Santo de Évora, E. P. E. (508085888)";"MERCK, S.A. (500650870)";"706.214,84 €";09-06-2017;23-03-2017;280 dias;"Portugal, Évora, Évora";Artigo 259.º do Código dos Contratos Públicos;;;;;;;1771819;CP 2015/6 - Acordo quadro para o fornecimento de Medicamentos do Foro Oncológico;false;;false;;;Código dos Contratos Públicos (DL 18/2008);false;false;
844/2024 - Convite à apresentação de propostas ao abrigo do(s) acordo(s)-quadro 2023/438 - Derivados do plasma humano para aquisição de medicamentos derivados do plasma ;Ao abrigo de acordo-quadro (art.º 259.º);Aquisição de bens móveis;33600000-6;Principal;Produtos farmacêuticos;705650.0 € ;"Hospital do Espírito Santo de Évora, EPE (508085888)";"CSL BEHRING, LDA. (503047201)";"705.650,00 €";14-08-2024;06-03-2024;304 dias;"Portugal, Évora, Évora";Artigo 259.º do Código dos Contratos Públicos;;;;;;;6506197;438/2023 - Acordo-quadro para fornecimento de derivados do plasma humano;true;https://community.vortal.biz/PRODPublic/Tendering/OpportunityDetail/Index?noticeUID=PT1.NTC.2749947;false;;;"Código dos Contratos Públicos (DL111-B/2017) e Lei n.º 30/2021, de 21.05";false;false;
"P259-2021-007 - CONVITE AO ABRIGO DO(S) ACORDO(S) QUADRO 2017/6, 2019/40 E 2019/61, PARA AS INSTITUIÇÕES DO SNS";Ao abrigo de acordo-quadro (art.º 259.º);Aquisição de bens móveis;33600000-6;Principal;Produtos farmacêuticos;698880.15 € ;"Hospital do Espírito Santo de Évora, E. P. E. (508085888)";"ROCHE FARMACEUTICA QUIMICA, LDA (500233810)";"698.880,15 €";16-04-2021;25-03-2021;280 dias;Portugal;Artigo 259.º do Código dos Contratos Públicos;;;;;;;2969238;"CP 2017/6 - Acordo Quadro para fornecimento de Medicamentos do Foro Oncológico e Imunomoduladores, às Instituições e Serviços do Serviço Nacional de Saúde";true;https://community.vortal.biz/PRODPublic/Tendering/OpportunityDetail/Index?noticeUID=PT1.NTC.1415168;false;;;Código dos Contratos Públicos ( DL 111-B/2017 );false;false;
Aquisição de medicamentos do foro oncológico e imunomodulares;Ao abrigo de acordo-quadro (art.º 259.º);Aquisição de bens móveis;33600000-6;Principal;Produtos farmacêuticos;694332.5 € ;"Hospital do Espírito Santo de Évora, EPE (508085888)";MERCK SHARP DOHME (500191360);"694.332,50 €";30-05-2022;28-04-2022;304 dias;"Portugal, Évora, Évora";Artigo 259.º do Código dos Contratos Públicos;;;;;;;5032541;CP 2021/6 - Medicamentos do foro oncológico e imunomoduladores;false;https://community.vortal.biz/PRODPublic/Tendering/OpportunityDetail/Index?noticeUID=PT1.NTC.1826211;false;;;"Código dos Contratos Públicos (DL111-B/2017) e Lei n.º 30/2021, de 21.05";false;false;
Fornecimento de Medicamentos exclusivos;Ajuste Direto Regime Geral;Aquisição de bens móveis;33690000-3;Principal;Medicamentos vários;Inexistente;"Hospital do Espírito Santo de Évora, E.P.E. (508085888)";Merck SA (500650870);"690.583,32 €";29-02-2012;20-01-2012;365 dias;"Portugal, Évora, Évora";"Artigo 24.º, n.º 1, alínea e) do Código dos Contratos Públicos";;;;;;;Não aplicável.;Não aplicável.;;;false;;;Código dos Contratos Públicos (DL 18/2008);false;false;
"Aquisição ao abrigo do(s) acordo(s)-quadro 2021/49, 2021/6, 2021/61 e 2022/40 para as Instituições do SNS";Ao abrigo de acordo-quadro (art.º 259.º);Aquisição de bens móveis;33600000-6;Principal;Produtos farmacêuticos;687337.54 € ;"Hospital do Espírito Santo de Évora, EPE (508085888)";"ASTRAZENECA-PRODUTOS FARMACÊUTICOS,LDA. (502942240)";"687.337,54 €";27-02-2024;14-02-2024;335 dias;"Portugal, Évora, Évora";Artigo 259.º do Código dos Contratos Públicos;;;;;;;6677696;491/2023 - Concurso público internacional para formação do acordo quadro de medicamentos do foro oncológico e imunomoduladores;true;https://community.vortal.biz/PRODPublic/Tendering/OpportunityDetail/Index?noticeUID=PT1.NTC.2726440;false;;;"Código dos Contratos Públicos (DL111-B/2017) e Lei n.º 30/2021, de 21.05";false;false;
Aquisição de Medicamentos do foro oncológico e imunomodulares;Ao abrigo de acordo-quadro (art.º 259.º);Aquisição de bens móveis;33600000-6;Principal;Produtos farmacêuticos;685504.51 € ;"Hospital do Espírito Santo de Évora, EPE (508085888)";Janssen Cilag Farmaceutica (500189412);"685.504,51 €";21-03-2022;16-02-2022;365 dias;"Portugal, Évora, Évora";Artigo 259.º do Código dos Contratos Públicos;;;;;;;5032541;CP 2021/6 - Medicamentos do foro oncológico e imunomoduladores;false;https://community.vortal.biz/PRODPublic/Tendering/OpportunityDetail/Index?noticeUID=PT1.NTC.1719413;false;;;"Código dos Contratos Públicos (DL111-B/2017) e Lei n.º 30/2021, de 21.05";false;false;
Aquisição de medicamentos do foro oncológico e imunomodulares;Ao abrigo de acordo-quadro (art.º 259.º);Aquisição de bens móveis;33600000-6;Principal;Produtos farmacêuticos;682358.44 € ;"Hospital do Espírito Santo de Évora, EPE (508085888)";"ROCHE FARMACÊUTICA QUIMICA, LDA. (500233810)";"682.358,44 €";22-04-2021;13-01-2021;350 dias;Portugal;Artigo 259.º do Código dos Contratos Públicos;;;;;;;2969238;"CP 2017/6 - Acordo Quadro para fornecimento de Medicamentos do Foro Oncológico e Imunomoduladores, às Instituições e Serviços do Serviço Nacional de Saúde";false;https://community.vortal.biz/PRODPublic/Tendering/OpportunityDetail/Index?noticeUID=PT1.NTC.1311428;false;;;Código dos Contratos Públicos ( DL 111-B/2017 );false;false;
Disponibilização de Equipamentos e Reagentes para a realização de MCDT;Concurso público;Aquisição de serviços;85148000-8;Principal;Serviços de análises clínicas;Inexistente;"Hospital do Espírito Santo de Évora, E.P.E. (508085888)";"Menarini Diagnosticos Lda (502610069), Johnson & Johnson Lda (500153370), Bio Merieux Lda (501524177), SIEMENS HEALTHCARE DIAGNOSTICS LDA (507925173), Abbott Laboratórios Lda (500006148), Izasa Portugal Lda (501086110)";"679.682,83 €";06-01-2011;22-12-2010;240 dias;"Portugal, Évora, Évora";"Artigo 20.º, n.º 1, alínea b) do Código dos Contratos Públicos";;;;;;;Não aplicável.;Não aplicável.;;;false;;;Código dos Contratos Públicos (DL 18/2008);false;false;
190043/23 - MCDT Telerradiologia;Concurso público;Aquisição de serviços;85150000-5;Principal;Serviços de imagiologia médica;678336.0 € ;"Hospital do Espírito Santo de Évora, E. P. E. (508085888)";"IMI - Imagens Médicas Integradas, S.A. (501721037)";"678.336,00 €";09-11-2023;02-02-2023;365 dias;"Portugal, Évora, Évora";"Artigo 20.º, n.º 1, alínea a) do Código dos Contratos Públicos";;;;;;;Não aplicável.;Não aplicável.;false;https://community.vortal.biz/PRODPublic/Tendering/OpportunityDetail/Index?noticeUID=PT1.NTC.2124494;false;;;"Código dos Contratos Públicos (DL111-B/2017) e Lei n.º 30/2021, de 21.05";false;false;
Aquisição de medicamentos vários;Ajuste Direto Regime Geral;Aquisição de bens móveis;33690000-3;Principal;Medicamentos vários;677527.6 € ;"Hospital do Espírito Santo de Évora, E. P. E. (508085888)";"LABESFAL SA (501169580), PFIZER BIOFARMACEUTICA SOC UNIPESSOAL LDA (513300376), FRESENIUS MEDICAL CARE LDA (503070220), OM PHARMA SA (500207410), LOGIFARMA LOGISTICA FARMACEUTICA SA (503934640), SANOFI- PRODUTOS FARMACEUTICOS LDA (500134960), FERRER HOSPITALAR SA (504507680), BRISTOL-MYERS SQUIB FARMAC PORTUGUESA SA (500048193)";"677.527,60 €";11-04-2016;24-02-2016;300 dias;"Portugal, Évora, Évora";"Artigo 24.º, n.º 1, alínea e) do Código dos Contratos Públicos";;;;;;;Não aplicável.;Não aplicável.;false;;false;;;Código dos Contratos Públicos (DL 18/2008);false;false;
Medicamentos de consumo geral e outros;Ajuste Direto Regime Geral;Aquisição de bens móveis;33690000-3;Principal;Medicamentos vários;672143.38 € ;"Hospital do Espírito Santo de Évora, E. P. E. (508085888)";"Healthcare Unipessoal Lda (509117961), Generis-Farmaceutica SA (508107997), Angelini Farmaceutica Lda (500583650), Res Medical  (502440163), Janssen Cilag Farmaceutica Lda (500189412), Abbot Medical Optics Spain Sl Suc Portugal (980262364), Actavis AS (980334934), Bayer Portugal SA (500043256), Lab Edol - Prod Farmaceuticos SA (507072642), Lab Pfizer Lda (500162166), Sandoz Farmaceutica Lda (506985261), GlaxoSmithKline Consum Healthc (500276994), Astrazeneca Prod Farm Lda (502942240), Bristol-Myers Squib Farmac Portuguesa Sa (500048193), Alcon Portugal (501251685), Ratiopharm Lda (502414910), Thea Portugal SA (507978358), Teva Pharma-Produtos Farmaceuticos Lda (507045491), Overpharma Lda (505792362), Proclinica Lda (500222665), Lab Vitoria (500162220), Lab Medinfar (500384045), Meda Pharma SA (500082090), Sanofi-Produtos Farmaceuticos Lda (500134960), Combino Pharm Portugal Lda (508622263), Merck Sharp & Dome Lda (500191360), Fresenius Kabi Pharma Portugal (504293753), Novartis Farma-Prod Farmaceuticos (500063524), Labesfal SA (501169580), B Braun Medical Lda (501506543)";"672.143,38 €";31-10-2013;08-05-2013;240 dias;"Portugal, Évora, Évora";Artigo 258.º do Código dos Contratos Públicos;;;;;;;Não aplicável.;Não aplicável.;;;false;;;Código dos Contratos Públicos (DL 18/2008);false;false;
Fornecimento de eletricidade;Ao abrigo de acordo-quadro (art.º 258.º);Aquisição de bens móveis;09310000-5;Principal;Electricidade;671811.18 € ;"Hospital do Espírito Santo de Évora, E. P. E. (508085888)";"Iberdrola Clientes Portugal, Unipessoal, Lda. (502124083)";"671.811,18 €";09-02-2018;28-12-2017;365 dias;"Portugal, Évora, Évora";"Artigo 27.º, n.º 1, alínea h) do Código dos Contratos Públicos";;;;;;;1494502;Acordo quadro para o fornecimento de eletricidade em regime de mercado livre para Portugal Continental;false;;false;;;Código dos Contratos Públicos (DL 18/2008);false;false;
"Convite à apresentação de propostas ao abrigo do(s) acordo(s)-quadro 2021/47, 2021/61, 2022/40, 2023/305, 2023/481, 2023/491 e 2023/492";Ao abrigo de acordo-quadro (art.º 259.º);Aquisição de bens móveis;33600000-6;Principal;Produtos farmacêuticos;666182.66 € ;"Hospital do Espírito Santo de Évora, EPE (508085888)";LILLY PORTUGAL - PRODUTOS FARMACEUTICOS (500165602);"666.182,66 €";01-04-2024;21-02-2024;334 dias;"Portugal, Évora, Évora";Artigo 259.º do Código dos Contratos Públicos;;;;;;;6677696;491/2023 - Concurso público internacional para formação do acordo quadro de medicamentos do foro oncológico e imunomoduladores;true;https://community.vortal.biz/PRODPublic/Tendering/OpportunityDetail/Index?noticeUID=PT1.NTC.2740051;false;;;"Código dos Contratos Públicos (DL111-B/2017) e Lei n.º 30/2021, de 21.05";false;false;
Aquisição de medicamentos do foro oncológico;Ao abrigo de acordo-quadro (art.º 259.º);Aquisição de bens móveis;33652000-5;Principal;Antineoplásicos e imunomoduladores;664944.4 € ;"Hospital do Espírito Santo de Évora, EPE (508085888)";"ROCHE FARMACEUTICA E QUIMICA, LDA (500233810)";"664.944,40 €";18-08-2017;04-05-2017;240 dias;"Portugal, Évora, Évora";Artigo 259.º do Código dos Contratos Públicos;;;;;;;1771819;CP 2015/6 - Acordo quadro para o fornecimento de Medicamentos do Foro Oncológico;false;;false;;;Código dos Contratos Públicos (DL 18/2008);false;false;
Aquisição de Gás Natural - 2023;Concurso público;Aquisição de bens móveis;09123000-7;Principal;Gás natural;658682.7 € ;"Hospital do Espírito Santo de Évora, E. P. E. (508085888)";Petrogal S.A. (500697370);"658.682,70 €";18-09-2023;01-03-2023;304 dias;"Portugal, Évora, Évora";"Artigo 20.º, n.º 1, alínea a) do Código dos Contratos Públicos";;;;;;;Não aplicável.;Não aplicável.;true;https://community.vortal.biz/PRODPublic/Tendering/OpportunityDetail/Index?noticeUID=PT1.NTC.2204551;false;;;"Código dos Contratos Públicos (DL111-B/2017) e Lei n.º 30/2021, de 21.05";false;false;
Sistemas de Cardioversores Desfibrilhadores Implantáveis;Ao abrigo de acordo-quadro (art.º 259.º);Aquisição de bens móveis;33182000-9;Principal;Material de assistência à função cardíaca;654200.0 € ;"Hospital do Espírito Santo de Évora, E. P. E. (508085888)";"Biotronik Portugal Unipessoal, Lda (510726941), BOSTON SCIENTIFIC PORTUGAL-DISPOSITIVOS MÉDICOS, LDA. (504988964), MICROPORT CRM PORTUGAL, LDA. (505514010), ABBOTT MEDICAL (PORTUGAL) - DISTRIBUIÇÃO DE PRODUTOS MÉDICOS, LDA (504180746), Medtronic Portugal lda (504223933)";"654.200,00 €";15-03-2019;14-03-2019;320 dias;"Portugal, Évora, Évora";Artigo 259.º do Código dos Contratos Públicos;;;;;;;3394183;2018/32 - Acordo Quadro para fornecimento de Sistemas de Cardioversores Desfibrilhadores Implantáveis;false;;false;;;Código dos Contratos Públicos ( DL 111-B/2017 );false;false;
Fornecimento de Energia Elétrica;Concurso público;Aquisição de serviços;71314100-3;Principal;Serviços de electricidade;Inexistente;"Hospital do Espírito Santo de Évora, E.P.E. (508085888)";EDP Comercial - Comercialização de Energia SA (503504564);"648.961,12 €";03-02-2012;19-01-2012;365 dias;"Portugal, Évora, Évora";"Artigo 20.º, n.º 1, alínea b) do Código dos Contratos Públicos";;;;;;;Não aplicável.;Não aplicável.;;;false;;;Código dos Contratos Públicos (DL 18/2008);false;false;
Prestação de serviços médicos 1º atendimento;Ao abrigo de acordo-quadro (art.º 259.º);Aquisição de serviços;79625000-1;Principal;Serviços de fornecimento de pessoal médico;647824.32 € ;"Hospital do Espírito Santo de Évora, E. P. E. (508085888)";RANDSTAD II - PRESTAÇÃO DE SERVIÇOS LDA (503298999);"647.824,32 €";08-03-2019;23-01-2019;365 dias;"Portugal, Évora, Évora";Artigo 259.º do Código dos Contratos Públicos;;;;;;;1490434;ACORDO QUADRO PARA PRESTAÇÃO DE SERVIÇOS MÉDICOS ÀS INSTITUIÇÕES E SERVIÇOS DO SERVIÇO NACIONAL DE SAÚDE;false;;false;;;Código dos Contratos Públicos ( DL 111-B/2017 );false;false;
"P259-2019-203 Aquisição de medicamentos ao abrigo do CP 2017/6; 2019/40; 2019/61  para as Instituições do SNS";Ao abrigo de acordo-quadro (art.º 259.º);Aquisição de bens móveis;33600000-6;Principal;Produtos farmacêuticos;644905.6 € ;"Hospital do Espírito Santo de Évora, E. P. E. (508085888)";Roche Farmaceutica (500233810);"644.905,60 €";14-01-2020;18-12-2019;365 dias;Portugal;Artigo 259.º do Código dos Contratos Públicos;;;;;;;4028557;CP 2019/40 - Medicamentos antirretrovíricos para o tratamento da infeção por VIH;true;;false;;;Código dos Contratos Públicos ( DL 111-B/2017 );false;false;
Aquisição de medicamentos do foro oncológico;Ao abrigo de acordo-quadro (art.º 259.º);Aquisição de bens móveis;33652000-5;Principal;Antineoplásicos e imunomoduladores;642068.52 € ;"Hospital do Espírito Santo de Évora, E. P. E. (508085888)";JANSSEN CILAG FARMACEUTICA LDA (500189412);"642.068,52 €";03-05-2017;16-02-2017;320 dias;"Portugal, Évora, Évora";Artigo 259.º do Código dos Contratos Públicos;;;;;;;1771819;CP 2015/6 - Acordo quadro para o fornecimento de Medicamentos do Foro Oncológico;false;;false;;;Código dos Contratos Públicos (DL 18/2008);false;false;
"P259-2021-101-Convite ao abrigo do(s) acordo(s)-quadro 2020/2, 2021/6 e 2019/61 para aquisição de medicamentos para suprir necessidades na área da saúde.";Ao abrigo de acordo-quadro (art.º 259.º);Aquisição de bens móveis;33600000-6;Principal;Produtos farmacêuticos;636930.67 € ;"Hospital do Espírito Santo de Évora, EPE (508085888)";"BIOGEN PORTUGAL, SOC FARMACÊUTICA, UNIPESSOAL (506415740)";"636.930,67 €";04-04-2022;30-03-2022;365 dias;"Portugal, Évora, Évora";Artigo 259.º do Código dos Contratos Públicos;;;;;;;5032541;CP 2021/6 - Medicamentos do foro oncológico e imunomoduladores;true;https://community.vortal.biz/PRODPublic/Tendering/OpportunityDetail/Index?noticeUID=PT1.NTC.1780468;false;;;"Código dos Contratos Públicos (DL111-B/2017) e Lei n.º 30/2021, de 21.05";false;false;
"Aquisição ao abrigo dos AQs 2017/6, 2018/12, 2018/49, 2018/55, 2018/64, 2019/61 2020/18 para as instituições do SNS";Ao abrigo de acordo-quadro (art.º 259.º);Aquisição de bens móveis;33600000-6;Principal;Produtos farmacêuticos;636821.68 € ;"Hospital do Espírito Santo de Évora, E. P. E. (SNCP) (508085888)";"NOVARTIS FARMA - Produtos Farmacêuticos, SA. (500063524)";"636.821,68 €";16-04-2021;25-03-2021;270 dias;Portugal;Artigo 259.º do Código dos Contratos Públicos;;;;;;;2969238;"CP 2017/6 - Acordo Quadro para fornecimento de Medicamentos do Foro Oncológico e Imunomoduladores, às Instituições e Serviços do Serviço Nacional de Saúde";true;https://community.vortal.biz/PRODPublic/Tendering/OpportunityDetail/Index?noticeUID=PT1.NTC.1378022;false;;;Código dos Contratos Públicos ( DL 111-B/2017 );false;false;
Aquisição de stents coronários;Ao abrigo de acordo-quadro (art.º 259.º);Aquisição de bens móveis;33182000-9;Principal;Material de assistência à função cardíaca;628652.0 € ;"Hospital do Espírito Santo de Évora, E. P. E. (508085888)";"ENDO VASCULAR, LDA (505537494), BIOTRONIK PORTUGAL UNIPESSOAL LDA (510726941), CARDINAL HEALTH PORTUGAL 513 UNIPESSOAL, LDA (513620834), TERUMO BCT PORTUGAL UNIPESSOAL LDA (510627048), Medtronic Portugal lda (504223933), ABBOTT MEDICAL (PORTUGAL) - DISTRIBUIÇÃO DE PRODUTOS MÉDICOS, LDA (504180746)";"628.652,00 €";15-03-2019;31-01-2019;330 dias;"Portugal, Évora, Évora";Artigo 259.º do Código dos Contratos Públicos;;;;;;;2771022;CP 2017/34 - Acordo quadro para fornecimento de Stents Coronários às Instituições e Serviços do Serviço Nacional de Saúde;false;;false;;;Código dos Contratos Públicos ( DL 111-B/2017 );false;false;
Aquisição de eletricidade ao abrigo dos lotes 2 e 3 do acordo quadro da ESPAP para as entidades do Ministério da Saúde;Ao abrigo de acordo-quadro (art.º 259.º);Aquisição de bens móveis;09310000-5;Principal;Electricidade;627442.17 € ;"Hospital do Espírito Santo de Évora, E. P. E. (SNCP) (508085888)";"EDP Comercial - Comercialização de Energia, S.A. (503504564)";"627.442,17 €";22-04-2022;28-04-2021;306 dias;"Portugal, Évora, Évora";Artigo 259.º do Código dos Contratos Públicos;;;;;;;4313070;Acordo-Quadro para o fornecimento de eletricidade em regime de mercado livre para Portugal Continental;true;https://community.vortal.biz/PRODPublic/Tendering/OpportunityDetail/Index?noticeUID=PT1.NTC.1381285;false;;;Código dos Contratos Públicos ( DL 111-B/2017 );false;false;
190034/21 - PS Médicos Sem Especialidade;Concurso público;Aquisição de serviços;85121210-8;Principal;Serviços de ginecologia ou obstetrícia;627216.2 € ;"Hospital do Espírito Santo de Évora, EPE (508085888)";"Talenter 24 - Serviços Permanentes, Lda (510359698)";"627.216,20 €";08-06-2021;13-01-2021;350 dias;"Portugal, Évora, Évora";"Artigo 20.º, n.º 1, alínea a) do Código dos Contratos Públicos";;;;;;;Não aplicável.;Não aplicável.;false;https://community.vortal.biz/PRODPublic/Tendering/OpportunityDetail/Index?noticeUID=PT1.NTC.1320597;false;;;Código dos Contratos Públicos ( DL 111-B/2017 );false;false;
"P259-2022-009 - Convite ao abrigo do(s) acordo(s)-quadro CP 2021/12 - Medicamentos do Aparelho  Respiratório, CP 2021/55 - Medicamentos Diversos,  CP 2021/49 - Medicamentos usados nas afeções oculares";Ao abrigo de acordo-quadro (art.º 259.º);Aquisição de bens móveis;33600000-6;Principal;Produtos farmacêuticos;625692.72 € ;"Hospital do Espírito Santo de Évora, EPE (508085888)";"NOVARTIS FARMA - Produtos Farmacêuticos, SA. (500063524)";"625.692,72 €";23-03-2022;16-03-2022;337 dias;"Portugal, Évora, Évora";Artigo 259.º do Código dos Contratos Públicos;;;;;;;5354516;CP 2021/55 - Medicamentos diversos;true;https://community.vortal.biz/PRODPublic/Tendering/OpportunityDetail/Index?noticeUID=PT1.NTC.1797403;false;;;"Código dos Contratos Públicos (DL111-B/2017) e Lei n.º 30/2021, de 21.05";false;false;
Fornecimento de Medicamentos exclusivos;Ajuste Direto Regime Geral;Aquisição de bens móveis;33690000-3;Principal;Medicamentos vários;Inexistente;"Hospital do Espírito Santo de Évora, E.P.E. (508085888)";BIOGEN IDEC PORTUGAL (506415740);"608.531,10 €";20-03-2012;20-01-2012;365 dias;"Portugal, Évora, Évora";"Artigo 24.º, n.º 1, alínea e) do Código dos Contratos Públicos";;;;;;;Não aplicável.;Não aplicável.;;;false;;;Código dos Contratos Públicos (DL 18/2008);false;false;
Fornecimento de medicamentos exclusivos;Ajuste Direto Regime Geral;Aquisição de bens móveis;33690000-3;Principal;Medicamentos vários;Inexistente;"Hospital do Espírito Santo de Évora, E.P.E. (508085888)";BIOGEN IDEC PORTUGAL (506415740);"604.378,80 €";29-02-2012;20-01-2012;365 dias;"Portugal, Évora, Évora";"Artigo 24.º, n.º 1, alínea e) do Código dos Contratos Públicos";;;;;;;Não aplicável.;Não aplicável.;;;false;;;Código dos Contratos Públicos (DL 18/2008);false;false;
Aquisição de bens e serviços de diálise peritoneal;Ao abrigo de acordo-quadro (art.º 259.º);Aquisição de bens móveis;33692800-5;Principal;Soluções para diálise;600994.44 € ;"Hospital do Espírito Santo de Évora, E. P. E. (508085888)";"Fresenius Medical Care Portugal, S.A. (503070220), BAXTER (503347345)";"600.994,44 €";02-01-2017;06-12-2016;360 dias;"Portugal, Évora, Évora";Artigo 259.º do Código dos Contratos Públicos;;;;;;;1481309;CP 2015/35 - Acordo quadro para fornecimento de bens e prestação de serviços de Diálise Peritoneal às Instituições e Serviços do Serviço Nacional de Saúde;false;;false;;;Código dos Contratos Públicos (DL 18/2008);false;false;
