Objeto do Contrato;Tipo de Procedimento;Tipo(s) de Contrato;CPV;CPV Tipo ;CPV Designação;CPV Valor;Entidade(s) Adjudicante(s);Entidade(s) Adjudicatária(s);Preço Contratual;Data de Publicação;Data de Celebração do Contrato;Prazo de Execução;Local de Execução;Fundamentação;Causa de Extinção do Contrato;Data de Fecho do Contrato;Preço Total Efetivo;Causas das Alterações ao Prazo;Causas das Alterações ao Preço;Estado;N.º registo do Acordo Quadro;Descrição do Acordo Quadro;Procedimento Centralizado;Ligação para Peças do Procedimento;Lista de Fornecedores (cocontratantes);Aquisição ao Abrigo de Acordo Quadro de outro Estado-membro da UE;Medidas especiais;Regime;Critérios Materiais;CCP;groupMembers
Empreitada de  construção do Novo Hospital sousa Martins-2ª Fase;Concurso público;Empreitadas de obras públicas;45215140-0;Principal;Construção de instalações hospitalares;4.89E7 € ;"Unidade Local de Saúde da Guarda, E. P. E. (508752000)";Edifer/Hagen-Construtoras do Novo Hospitalar ACE (509595200);"48.900.000,00 €";29-08-2013;20-05-2011;728 dias;"Portugal, Guarda, Guarda";"Artigo 19.º, alínea b) do Código dos Contratos Públicos";;;;;;;Não aplicável.;Não aplicável.;;;false;;;Código dos Contratos Públicos (DL 18/2008);false;false;
"Aquisição de eletricidade englobando BTE, MT, AT e MAT";Ao abrigo de acordo-quadro (art.º 259.º);Aquisição de bens móveis;09310000-5;Principal;Electricidade;2.371168378E7 € ;"Instituto Nacional de Emergência Médica, I.P. (501356126), SUCH - Serviço de Utilização Comum dos Hospitais (500900469), Unidade Local de Saúde de Matosinhos, E.P.E. (506361390), Centro Hospitalar Póvoa de Varzim - Vila do Conde, E.P.E. (508741823), Hospital Santa Maria Maior, E.P.E. - Barcelos (506361381), Hospital de Santarém, E.P.E. (506361462), Centro Hospitalar do Tâmega e Sousa, E. P. E. (508318262), Centro Hospitalar do Alto Ave, E.P.E. (508080827), Centro Hospitalar de Trás-os-Montes e Alto Douro, E. P. E. (508100496), Unidade Local de Saúde do Litoral Alentejano, E.P.E. (510445152), Centro Hospitalar de Setúbal, E. P. E. (507606787), Centro Hospitalar do Médio Tejo, E. P. E. (506361608), Hospital Garcia de Orta, E.P.E. (506361470), Administração Regional de Saúde Algarve, I.P. (503148709), Centro Hospitalar Psiquiátrico de Lisboa (508338476), Centro Hospitalar Lisboa Norte, E. P. E. (508481287), Hospital José Luciano de Castro - Anadia (501613021), Administração Regional de Saúde do Alentejo, I. P. (503148768), INFARMED - Autoridade Nacional do Medicamento e Produtos de Saúde I.P. (600037002), Centro Hospitalar Barreiro Montijo, E.P.E. (509186998), Instituto de Oftalmologia Dr. Gama Pinto (600000052), Direcção-Geral da Saúde (600037100), Centro Hospitalar Vila Nova de Gaia - Espinho, E. P. E. (508142156), Centro Hospitalar de Lisboa Central, E. P. E. (508080142), Instituto Português Oncologia de Coimbra Francisco Gentil, E.P.E. (506361438), Instituto Português do sangue (502423943), CENTRO HOSPITALAR DO ALGARVE (508718872), Administração Regional de Saúde do Norte, I. P. (503135593), Unidade Local de Saúde da Guarda, E.P.E. (508752000), Centro Hospitalar de Leiria, E.P.E. (509822932), Centro Hospitalar Tondela-Viseu, E.P.E. (509822940), Insituto Nacional de Saúde Dr. Ricardo Jorge, I.P. (501427511), Centro Hospitalar de Lisboa Ocidental, E.P.E. (507618319), Inspeção-Geral das Atividades em Saúde (600018857), Centro Hospitalar do Baixo Vouga, E.P.E. (510123210), Centro Hospitalar do Porto, E.P.E. (508331471), Centro Medicina de Reabilitação da Região Centro Rovisco Pais (503767336), Centro Hospitalar do Médio Ave, E.P.E. (508093937), Administração Regional de Saúde do Centro, I. P. (503122165), Unidade Local de Saúde do Alto Minho, E. P. E. (508786193), Unidade Local de Saúde do Baixo Alentejo, E.P.E. (508754275), Administração Regional de Saúde de Lisboa e Vale do Tejo, I. P. (503148776), Unidade Local de Saúde do Nordeste, E. P. E (509932584), Instituto Português Oncologia do Porto Francisco Gentil, E.P.E. (506362299), Hospital Professor Doutor Fernando Fonseca, E.P.E. (503035416), Serviço Partilhados do Ministério da Saúde, E. P. E. (509540716), Centro Hospitalar Cova da Beira, EPE (506361659), Administração Central do Sistema de Saúde, I.P. (508188423), Unidade Local de Saúde de Castelo Branco, E.P.E. (509309844), Centro Hospitalar e Universitário de Coimbra, E. P. E. (510103448), Hospital do Espírito Santo de Évora, E. P. E. (508085888), CHO - Centro Hospitalar do Oeste (510412009), Centro Hospitalar de Entre o Douro e Vouga, E.P.E. (508878462), Hospital de Magalhães Lemos, E. P. E. (502828790), Secretaria-Geral do Ministério da Saúde (600080684), Hospital Dr. Francisco Zagalo - Ovar (501510150)";E.D.P. (503504564);"23.711.683,78 €";01-04-2014;01-03-2014;365 dias;Portugal;Artigo 259.º do Código dos Contratos Públicos;Cumprimento integral do contrato;30-12-2014;"356.327,09 €";;diminuicao das necessidades;;314294;Acordo quadro para o fornecimento de electricidade em regime de mercado livre para Portugal Continental;true;;false;;;Código dos Contratos Públicos (DL 18/2008);false;false;
Empreitada de Requalificação do Edifício 5 do HSM para Instalação do Departamento da Criança e da Mulher (DCM);Concurso público;Empreitadas de obras públicas;45100000-8;Principal;Preparação dos locais para construção;7877000.0 € ;"Unidade Local de Saúde da Guarda, E. P. E. (508752000)";"IELAC - Instalações Eletricas e Ar Condicionado, Ldª: (509045588), Alberto Couto Alves, S.A. (501312412)";"7.877.000,00 €";24-06-2022;15-06-2022;548 dias;"Portugal, Guarda, Guarda";"Artigo 19.º, alínea a) do Código dos Contratos Públicos";;;;;;;Não aplicável.;Não aplicável.;false;https://community.vortal.biz/PRODPublic/Tendering/OpportunityDetail/Index?noticeUID=PT1.NTC.1637385;false;;;"Código dos Contratos Públicos (DL111-B/2017) e Lei n.º 30/2021, de 21.05";false;false;
Fornecimento de reagentes para a área nuclear (core) do Serviço de Patologia Clínica;Concurso público;Aquisição de bens móveis;33696500-0;Principal;Reagentes de laboratório;3947404.77 € ;"UNIDADE LOCAL DE SAÚDE DA GUARDA, E.P.E (508752000)";"Abbott Laboratórios, Lda. (500006148)";"3.947.404,77 €";16-08-2023;07-08-2023;1096 dias;"Portugal, Guarda, Guarda";"Artigo 20.º, n.º 1, alínea b) do Código dos Contratos Públicos";;;;;;;Não aplicável.;Não aplicável.;false;https://community.vortal.biz/PRODPublic/Tendering/OpportunityDetail/Index?noticeUID=PT1.NTC.2168262;false;;;"Código dos Contratos Públicos (DL111-B/2017) e Lei n.º 30/2021, de 21.05";false;false;
CONVITE À APRESENTAÇÃO DE PROPOSTA AO ABRIGO DO ACORDO QUADRO CP 2017/9 - DERIVADOS DO PLASMA;Ao abrigo de acordo-quadro (art.º 259.º);Aquisição de bens móveis;33100000-1;Principal;Equipamento médico;3736055.0 € ;"UNIDADE LOCAL DE SAÚDE DA GUARDA, E.P.E (508752000)";"CSL Behring, Lda (503047201)";"3.736.055,00 €";04-12-2019;25-11-2019;60 dias;Portugal;Artigo 259.º do Código dos Contratos Públicos;;;;;;;2800702;CP 2017/9 - Acordo quadro para fornecimento de Derivados do Plasma Humano às Instituições e Serviços do Serviço Nacional de Saúde;true;;false;;;Código dos Contratos Públicos ( DL 111-B/2017 );false;false;
Fornecimento de Reagentes para a área nuclear (Core) do Serviço de Patologia Clínica;Concurso público;Aquisição de bens móveis;33696000-5;Principal;Reagentes e meios de contraste;2873054.7 € ;"Unidade Local de Saúde da Guarda, E. P. E. (508752000)";"Abbott Laboratorios,Lda (500006148)";"2.873.054,70 €";08-02-2019;18-01-2019;1095 dias;"Portugal, Guarda, Guarda";"Artigo 20.º, n.º 1, alínea a) do Código dos Contratos Públicos";;;;;;;Não aplicável.;Não aplicável.;false;;false;;;Código dos Contratos Públicos ( DL 111-B/2017 );false;false;
Fornecimento de Alimentação e Concessão de Exploração de Refeitórios;Concurso público;Aquisição de serviços;55322000-3;Principal;Serviços de confecção de refeições;2546036.64 € ;"Unidade Local de Saúde da Guarda, E.P.E (508752000)";GERTAL - COMPANHIA GERAL DE RESTAURANTES E ALIMENTAÇÃO S.A (500126623);"2.546.036,64 €";20-04-2016;04-04-2016;1095 dias;"Portugal, Guarda, Guarda";"Artigo 20.º, n.º 1, alínea b) do Código dos Contratos Públicos";;;;;;;Não aplicável.;Não aplicável.;false;;false;;;Código dos Contratos Públicos (DL 18/2008);false;false;
"Aquisição de Serviços de Segurança e Vigilância para a ULS Guarda, E.P.E  por um período de 36 meses";Concurso público;Aquisição de serviços;79710000-4;Principal;Serviços de segurança;2365837.2 € ;"UNIDADE LOCAL DE SAÚDE DA GUARDA, E.P.E (508752000)";"COPS- Companhia Operacional de Segurança, Unipessoal, Lda. (508569974)";"2.365.837,20 €";09-01-2024;08-01-2024;1096 dias;"Portugal, Guarda, Guarda";"Artigo 20.º, n.º 1, alínea a) do Código dos Contratos Públicos";;;;;;;Não aplicável.;Não aplicável.;false;https://community.vortal.biz/PRODPublic/Tendering/OpportunityDetail/Index?noticeUID=PT1.NTC.2294784;false;;;"Código dos Contratos Públicos (DL111-B/2017) e Lei n.º 30/2021, de 21.05";false;false;
Empreitada de Requalificação do Centro de Saúde de Seia;Concurso público;Empreitadas de obras públicas;45215100-8;Principal;Obras de construção de edifícios relacionados com serviços de saúde;1918999.94 € ;"Unidade Local de Saúde da Guarda, E. P. E. (508752000)";"Manteivias - Engenharia e Construção, S.A. (507200420)";"1.918.999,94 €";11-05-2023;10-05-2023;550 dias;"Portugal, Guarda, Guarda";"Artigo 19.º, alínea a) do Código dos Contratos Públicos";;;;;;;Não aplicável.;Não aplicável.;false;https://community.vortal.biz/PRODPublic/Tendering/OpportunityDetail/Index?noticeUID=PT1.NTC.1836875;false;;;"Código dos Contratos Públicos (DL111-B/2017) e Lei n.º 30/2021, de 21.05";false;false;
Reagentes para area nuclear(core) Patologia Clinica HSM e HNSA da ULSG;Concurso público;Aquisição de bens móveis;33696500-0;Principal;Reagentes de laboratório;1917150.0 € ;"Unidade Local de Saúde da Guarda, EPE (508752000)";"ABBOTT LABORATORIOS, LDA. (500006148)";"1.917.150,00 €";19-10-2015;04-06-2014;1095 dias;"Portugal, Guarda, Guarda";"Artigo 20.º, n.º 1, alínea b) do Código dos Contratos Públicos";;;;;;;Não aplicável.;Não aplicável.;false;;false;;;Código dos Contratos Públicos (DL 18/2008);false;false;
Aquisição de Papel para fotocópia e Impressão ;Ao abrigo de acordo-quadro (art.º 259.º);Aquisição de bens móveis;30197643-5;Principal;Papel para fotocópia;1678737.97 € ;"Administração Central do Sistema de Saúde, IP (508188423), Centro Hospitalar de Trás-os-Montes e Alto Douro, EPE (508100496), Centro Hospitalar do Alto Ave, EPE (508080827), Unidade Local de Saúde de Matosinhos, EPE (506361390), Centro Medicina de Reabilitação da Região Centro Rovisco Pais (503767336), Hospital Dr. Francisco Zagalo (507846044), Centro Hospitalar de Leiria-Pombal, EPE (509822932), Centro Hospitalar Barreiro Montijo, EPE (509186998), Centro Hospitalar do Algarve, EPE (510745997), Hospital de Magalhães Lemos, EPE (502828790), Administração Regional de Saúde do Centro, IP (503122165), Administração Regional de Saúde do Norte, IP (503135593), Instituto Português do Sangue e da Transplantação, IP (502423943), Centro Hospitalar Tondela-Viseu, EPE (509822940), Direção-Geral da Saúde (600037100), Centro Hospitalar de Entre Douro e Vouga,  EPE (508878462), Centro Hospitalar Tâmega e Sousa, EPE (508318262), Hospital José Luciano de Castro (501613021), Centro Hospitalar de Setúbal, EPE (507606787), Hospital Espírito Santo, EPE (508085888), Centro Hospitalar Cova da Beira, EPE (506361659), Centro Hospitalar de Lisboa Norte, EPE (508481287), Instituto Nacional de Saúde Dr. Ricardo Jorge, IP (501427511), Centro Hospitalar Lisboa Central, EPE (508080142), Centro Hospitalar Psiquiátrico de Lisboa (508338476), Secretaria-Geral do Ministério da Saúde (600080684), Instituto Português de Oncologia do Porto Francisco Gentil, EPE (506362299), Unidade Local de Saúde do Alto Minho, EPE (508786193), Unidade Local de Saúde de Castelo Branco, EPE (509309844), Autoridade Nacional do Medicamento e Produtos de Saúde, IP (600037002), Administração Regional de Saúde do Alentejo, IP (503148768), Instituto Nacional de Emergência Médica, IP (501356126), Centro Hospitalar do Médio Ave, EPE (508093937), Unidade Local de Saúde do Nordeste, EPE (509932584), Unidade Local de Saúde do Baixo Alentejo, EPE (508754275), Unidade Local de saúde da Guarda, EPE (508752000), Centro Hospitalar de S. João, EPE (509821197), Administração Regional de Saúde do Algarve, IP (503148709), Centro Hospitalar de Lisboa Ocidental, EPE (507618319), Instituto Português de Oncologia de Coimbra Francisco Gentil, EPE (506361438), Serviço de Intervenção nos Comportamentos Aditivos e nas Dependências (600084884), Centro Hospitalar Vila Nova de Gaia/Espinho, EPE (508142156), Centro Hospitalar do Médio Tejo, EPE (506361608), Hospital de Santarém, EPE (506361462), Serviços Partilhados do Ministério da Saúde, EPE (509540716), Hospital Distrital Figueira da Foz, EPE (506361527), Centro Hospitalar e Universitário de Coimbra, EPE (510103448), Instituto de Oftalmologia Dr. Gama Pinto (600000052), Administração Regional de Saúde de Lisboa e Vale do Tejo, IP (503148776), Inspeção-Geral das Atividades em Saúde (600018857), Hospital Santa Maria Maior, EPE (506361381), Centro Hospitalar do Porto, EPE (508331471), Centro Hospitalar do Oeste (510412009), Hospital Professor Doutor Fernando Fonseca, EPE (503035416), Unidade Local de Saúde do Norte Alentejano, EPE (508094461), Hospital Garcia de Orta, EPE (506361470), Hospital Arcebispo João Crisóstomo (501626123)";"staples portugal,sa (503789372)";"1.678.737,97 €";01-04-2014;02-01-2014;365 dias;Portugal;Artigo 259.º do Código dos Contratos Públicos;Cumprimento integral do contrato;30-01-2014;"5.443,80 €";;O total efetivo corresponde apenas a este Centro Hospitalar.;;162548;"Concurso limitado por prévia qualificação para a celebração de Acordo Quadro para fornecimento de papel, economato e consumíveis de impressão.";true;;false;;;Código dos Contratos Públicos (DL 18/2008);false;false;
CCS-UCBST 770/2023 - Aquisição de Gás Natural para as Entidades do Ministério da Saúde e Serviço Nacional de Saúde para os meses de março a dezembro de 2024;Concurso público;Aquisição de bens móveis;09123000-7;Principal;Gás natural;1548222.77 € ;"Unidade Local de Saúde da Guarda, E. P. E. (508752000)";"PETROGAL, S.A. (500697370)";"1.548.222,77 €";08-03-2024;08-03-2024;306 dias;"Portugal, Guarda, Guarda";"Artigo 20.º, n.º 1, alínea a) do Código dos Contratos Públicos";;;;;;;Não aplicável.;Não aplicável.;true;https://community.vortal.biz/PRODPublic/Tendering/OpportunityDetail/Index?noticeUID=PT1.NTC.2714065;false;;;"Código dos Contratos Públicos (DL111-B/2017) e Lei n.º 30/2021, de 21.05";false;false;
AQUISIÇÃO DE ELETRICIDADE AO ABRIGO DOS LOTES 2 E 3 DO ACORDO QUADRO DA ESPAP (AQ-ELE 2019) PARA AS ENTIDADES DO MINISTÉRIO DA SAÚDE;Ao abrigo de acordo-quadro (art.º 259.º);Aquisição de bens móveis;09310000-5;Principal;Electricidade;1445005.87 € ;"Unidade Local de Saúde da Guarda, E. P. E. (508752000)";"Iberdrola Clientes Portugal, Unipessoal, Lda.  (502124083)";"1.445.005,87 €";08-03-2022;28-02-2022;275 dias;"Portugal, Guarda";Artigo 259.º do Código dos Contratos Públicos;;;;;;;4313070;Acordo-Quadro para o fornecimento de eletricidade em regime de mercado livre para Portugal Continental;true;https://plataforma-sncp.espap.gov.pt/espap/faces/app/pap/listaDocs.jsp?papId=2647;false;;;Código dos Contratos Públicos ( DL 111-B/2017 );false;false;
Aquisição de Gás Natural - 2023;Concurso público;Aquisição de bens móveis;09123000-7;Principal;Gás natural;1387275.97 € ;"Unidade Local de Saúde da Guarda, E. P. E. (508752000)";"Petrogal, S.A. (500697370)";"1.387.275,97 €";07-03-2023;01-03-2023;306 dias;"Portugal, Guarda";"Artigo 20.º, n.º 1, alínea a) do Código dos Contratos Públicos";;;;;;;Não aplicável.;Não aplicável.;true;https://community.vortal.biz/PRODPublic/Tendering/OpportunityDetail/Index?noticeUID=PT1.NTC.2204551;false;;;"Código dos Contratos Públicos (DL111-B/2017) e Lei n.º 30/2021, de 21.05";false;false;
CCS-UMC 00131_2022 Concurso Público para Aquisição de Gás Natural para as Entidades do Ministério da Saúde;Concurso público;Aquisição de bens móveis;09123000-7;Principal;Gás natural;1209251.8 € ;"Unidade Local de Saúde da Guarda, E. P. E. (508752000)";" Petrogal, S.A. (500697370)";"1.209.251,80 €";21-07-2022;19-05-2022;225 dias;"Portugal, Guarda";"Artigo 20.º, n.º 1, alínea a) do Código dos Contratos Públicos";;;;;;;Não aplicável.;Não aplicável.;true;https://community.vortal.biz/PRODPublic/Tendering/OpportunityDetail/Index?noticeUID=PT1.NTC.1873690;false;;;"Código dos Contratos Públicos (DL111-B/2017) e Lei n.º 30/2021, de 21.05";false;false;
CCS-UMC 00253_2022 Concurso Público para Aquisição de Eletricidade para as Entidades do Ministério da Saúde;Concurso público;Aquisição de bens móveis;09310000-5;Principal;Electricidade;1124919.17 € ;"Unidade Local de Saúde da Guarda, E. P. E. (508752000)";Iberdrola Clientes Portugal Unipessoal (502124083);"1.124.919,17 €";14-03-2023;24-02-2023;306 dias;"Portugal, Guarda";"Artigo 20.º, n.º 1, alínea a) do Código dos Contratos Públicos";;;;;;;Não aplicável.;Não aplicável.;true;https://community.vortal.biz/PRODPublic/Tendering/OpportunityDetail/Index?noticeUID=PT1.NTC.2204742;false;;;"Código dos Contratos Públicos (DL111-B/2017) e Lei n.º 30/2021, de 21.05";false;false;
"Serviço de fornecimento de refeições confecionadas, distribuição e concessão da exploração do refeitório do Hospital Sousa Martins e do Hospital Nossa Senhora da Assunção para o ano 2024";Concurso público;Aquisição de serviços;55500000-5;Principal;Serviços de cantinas e de fornecimento de refeições (catering);996536.63 € ;"Unidade Local de Saúde da Guarda, E. P. E. (508752000)";"ITAU - Instituto Técnico de Alimentação Humana, S.A. (500142858)";"996.536,63 €";05-06-2024;22-04-2024;245 dias;"Portugal, Guarda, Guarda";"Artigo 20.º, n.º 1, alínea a) do Código dos Contratos Públicos";;;;;;;Não aplicável.;Não aplicável.;false;https://community.vortal.biz/PRODPublic/Tendering/OpportunityDetail/Index?noticeUID=PT1.NTC.2783563;false;;;"Código dos Contratos Públicos (DL111-B/2017) e Lei n.º 30/2021, de 21.05";false;false;
Fornecimento de eletricidade ao abrigo do Lote 8 do Acordo Quadro da ESPAP para os estabelecimentos e serviços do SNS;Ao abrigo de acordo-quadro (art.º 259.º);Aquisição de bens móveis;09310000-5;Principal;Electricidade;933827.49 € ;"Unidade Local de Saúde da Guarda, E. P. E. (SNCP) (508752000)";"Iberdrola Clientes Portugal, Unipessoal, Lda.  (502124083)";"933.827,49 €";25-07-2022;27-12-2018;365 dias;"Portugal, Guarda";Artigo 259.º do Código dos Contratos Públicos;;;;;;;1494502;Acordo quadro para o fornecimento de eletricidade em regime de mercado livre para Portugal Continental;true;;false;;;Código dos Contratos Públicos (DL 18/2008);false;false;
Fornecimento de Alimentação e Concessão de Exploração de Refeitórios;Ajuste Direto Regime Geral;Aquisição de serviços;55000000-0;Principal;"Serviços de hotelaria, restauração e comércio a retalho";922761.24 € ;"Unidade Local de Saúde da Guarda, E. P. E. (508752000)";"Itau, Instituto Técnico Alimentação Humana, SA (500142858)";"922.761,24 €";23-05-2022;23-05-2022;276 dias;"Portugal, Guarda, Guarda";"Artigo 24.º, n.º 1, alínea c) do Código dos Contratos Públicos";;;;;;;Não aplicável.;Não aplicável.;false;https://www.ulsguarda.min-saude.pt/;false;;;Código dos Contratos Públicos ( DL 111-B/2017 );true;false;
"Convite ao abrigo do(s) acordo(s)-quadro 2019/55, 2020/1, 2020/61 - medicamentos diversos, 2021/6, 2021/12, 2021/61, 2022/40, 2022/55, para suprir necessidades na área da saúde";Ao abrigo de acordo-quadro (art.º 259.º);Aquisição de bens móveis;33600000-6;Principal;Produtos farmacêuticos;808258.44 € ;"UNIDADE LOCAL DE SAÚDE DA GUARDA, E.P.E (508752000)";MERCK SHARP DOHME (500191360);"808.258,44 €";31-03-2023;03-02-2023;366 dias;"Portugal, Lisboa, Lisboa";Artigo 259.º do Código dos Contratos Públicos;;;;;;;5032541;CP 2021/6 - Medicamentos do foro oncológico e imunomoduladores;true;https://community.vortal.biz/PRODPublic/Tendering/OpportunityDetail/Index?noticeUID=PT1.NTC.2213883;false;;;"Código dos Contratos Públicos (DL111-B/2017) e Lei n.º 30/2021, de 21.05";false;false;
Aquisição de energia eléctrica ao abrigo do AQ-PARA -2015;Ao abrigo de acordo-quadro (art.º 259.º);Aquisição de bens móveis;09310000-5;Principal;Electricidade;807437.59 € ;"Centro Hospitalar Barreiro Montijo, E. P. E. (509186998), Hospital do Espírito Santo de Évora, E. P. E. (508085888), Hospital de Santarém, EPE (506361462), Centro Hospitalar Póvoa de Varzim - Vila do Conde, E.P.E. (508741823), Unidade Local de Saúde do Litoral Alentejano, E. P. E. (510445152), Centro Hospitalar Vila Nova de Gaia - Espinho, E. P. E. (508142156), Unidade Local de Saúde de Castelo Branco, E. P. E. (509309844), Centro Hospitalar Cova da Beira, EPE (506361659), Centro Hospitalar Médio Ave, E.P.E.. (508093937), Hospital Dr. Francisco Zagalo (501510150), Centro de medicina e Reabilitação da Região Centro Rovisco Pais (503767336), Administração Regional de Saúde Algarve, I.P. (503148709), Unidade Local de Saúde Nordeste, EPE (509932584), Hospital de José Luciano de Castro (501613021), Centro Hospitalar de Lisboa Ocidental, E. P. E. (507618319), Administração Regional de Saúde Norte, I.P. (503135593), Centro Hospitalar do Algarve, E. P. E. (510745997), Hospital Distrital da Figueira da Foz, EPE (506361527), Unidade Local de Saúde do Norte Alentejano, E. P. E. (508094461), Administração Regional de Saúde do Centro, I. P. (503122165), Hospital Arcebispo João Crisóstomo (501626123), Centro Hospitalar de Setúbal, E. P. E. (507606787), Centro Hospitalar e Universitário de Coimbra, E. P. E. (510103448), SPMS - Serviços Partilhados do Ministério da Saúde, E. P. E. (509540716), Centro Hospitalar Porto, E. P. E. (508331471), Instituto Português de Oncologia de Lisboa Francisco Gentil, E. P. E. (506361616), Inspeção-Geral das Atividades em Saúde (600018857), Hospital de Magalhães Lemos, E. P. E. (502828790), Unidade Local de Saúde do Alto Minho, E. P. E. (508786193), Centro Hospitalar de São João, E. P. E. (509821197), CHO - Centro Hospitalar do Oeste (510412009), Centro Hospitalar Psiquiátrico de Lisboa (CHPL) (508338476), Hospital Prof. Doutor Fernando Fonseca E.P.E. (503035416), Centro Hospitalar Lisboa Norte, E. P. E. (508481287), Unidade Local de Saúde de Matosinhos, EPE (ULSM) (506361390), Administração Regional de Saúde Lisboa e Vale do Tejo, I.P. (503148776), Unidade Local de Saude do Baixo Alentejo, EPE (508754275), Administração Central do Sistema de Saúde, I. P. (508188423), Unidade Local de Saúde da Guarda, E. P. E. (508752000), Hospital Santa Maria Maior, E. P. E. (506361381), Instituto Nacional de Saúde Dr. Ricardo Jorge, I. P. (501427511), Centro Hospitalar de Trás-os-Montes e Alto Douro, E. P. E. (508100496), Instituto Português de Oncologia do Porto Francisco Gentil, E. P. E. (506362299), Centro Hospitalar Tondela-Viseu, E. P. E. (509822940), Hospital Garcia de Orta, E. P. E. (506361470), Centro Hospitalar de Lisboa Central, E. P. E. (508080142), Secretaria-Geral do Ministério da Saúde - SNCP (600080684), Centro Hospitalar do Alto Ave, EPE (508080827), SUCH - Serviço Utilização Comum Hospitais (500900469), Instituto de Oftalmologia Dr. Gama Pinto (600000052), INFARMED - Autoridade Nacional do Medicamento e Produtos de Saúde I.P. (600037002), CENTRO HOSPITALAR DE LEIRIA, E.P.E. (509822932), Instituto Português do Sangue e da Transplantação, I. P. (502423943), Administração Regional de Saúde do Alentejo, I. P. (503148768), Centro Hospitalar do Tâmega e Sousa, E. P. E. (508318262), Centro Hospitalar do Médio Tejo, E. P. E. (506361608), Direção-Geral da Saúde (600037100), Instituto Nacional de Emergência Médica, I. P. (501356126), Centro Hospitalar do Baixo Vouga, E. P. E (CHBV, E. P. E.) (510123210), Centro Hospitalar de Entre o Douro e Vouga, E.P.E. (508878462), Instituto Português de Oncologia de Coimbra - Francisco Gentil E.P.E. (506361438)";"GALP Power, S.A. (504723456)";"807.437,59 €";26-08-2015;13-02-2015;305 dias;"Portugal, Lisboa, Lisboa";Artigo 259.º do Código dos Contratos Públicos;Cumprimento integral do contrato;31-12-2015;"807.437,59 €";NÃO APLICÁVEL;NÃO APLICÁVEL;;314294;Acordo quadro para o fornecimento de electricidade em regime de mercado livre para Portugal Continental;true;;false;;;Código dos Contratos Públicos (DL 18/2008);false;false;
"Convite ao abrigo do(s) acordo(s)-quadro 2019/40, 2019/55, 2020/1, 2020/50, 2021/6, 2021/12, para suprir necessidades na área da saúde.";Ao abrigo de acordo-quadro (art.º 259.º);Aquisição de bens móveis;33600000-6;Principal;Produtos farmacêuticos;737337.54 € ;"UNIDADE LOCAL DE SAÚDE DA GUARDA, E.P.E (508752000)";MERCK SHARP DOHME (500191360);"737.337,54 €";28-01-2022;28-01-2022;365 dias;Portugal;Artigo 259.º do Código dos Contratos Públicos;;;;;;;4028557;CP 2019/40 - Medicamentos antirretrovíricos para o tratamento da infeção por VIH;true;https://community.vortal.biz/PRODPublic/Tendering/OpportunityDetail/Index?noticeUID=PT1.NTC.1779366;false;;;"Código dos Contratos Públicos (DL111-B/2017) e Lei n.º 30/2021, de 21.05";false;false;
