"Aquisição de Medicamentos ao abrigo dos Acordos Quadro 2017/6, 2017/67, 2018/55, 2018/64, 2019/40, 2019/61, 2020/18, 2020/2, 2020/50 no âmbito da agregação centralizada 2021";Ao abrigo de acordo-quadro (art.º 259.º);Aquisição de bens móveis;33600000-6;Principal;Produtos farmacêuticos;123405.0 € ;"Unidade Local de Saúde da Guarda, E. P. E. (508752000)";OM PHARMA S.A (500207410);"123.405,00 €";14-04-2021;09-04-2021;240 dias;Portugal;Artigo 259.º do Código dos Contratos Públicos;;;;;;;2969238;"CP 2017/6 - Acordo Quadro para fornecimento de Medicamentos do Foro Oncológico e Imunomoduladores, às Instituições e Serviços do Serviço Nacional de Saúde";true;https://community.vortal.biz/PRODPublic/Tendering/OpportunityDetail/Index?noticeUID=PT1.NTC.1449601;false;;;Código dos Contratos Públicos ( DL 111-B/2017 );false;false;
"Convite à apresentação de propostas ao abrigo do(s) acordo(s)-quadro 2020/61; 2021/12o; 2021/55; 2021/6; 2021/61; 2022/40 ; 2022/55; 2023/304; 2023/481; 2023/491, para aquisição de medicamentos.";Ao abrigo de acordo-quadro (art.º 259.º);Aquisição de bens móveis;33600000-6;Principal;Produtos farmacêuticos;123405.0 € ;"UNIDADE LOCAL DE SAÚDE DA GUARDA, E.P.E (508752000)";"VIFOR PHARMA PORTUGAL, SA (516677586)";"123.405,00 €";18-07-2024;19-02-2024;335 dias;Portugal;Artigo 259.º do Código dos Contratos Públicos;;;;;;;6677696;491/2023 - Concurso público internacional para formação do acordo quadro de medicamentos do foro oncológico e imunomoduladores;true;https://community.vortal.biz/PRODPublic/Tendering/OpportunityDetail/Index?noticeUID=PT1.NTC.2740851;false;;;"Código dos Contratos Públicos (DL111-B/2017) e Lei n.º 30/2021, de 21.05";false;false;
Aquisição de Equipamento de Raio X Convencional e Respetivos Acessórios Para o Serviço de Urgência Básica do Hospital Nossa Senhora da Assunção;Concurso público;Aquisição de bens móveis;33110000-4;Principal;"Equipamento de imagiologia para uso médico, dentário e veterinário";122432.0 € ;"UNIDADE LOCAL DE SAÚDE DA GUARDA, E.P.E (508752000)";Micromil - Sistemas Médicos e Industriais SA (501605770);"122.432,00 €";27-04-2022;28-05-2020;30 dias;"Portugal, Guarda, Guarda";"Artigo 20.º, n.º 1, alínea b) do Código dos Contratos Públicos";;;;;;;Não aplicável.;Não aplicável.;false;;false;;;Código dos Contratos Públicos ( DL 111-B/2017 );false;false;
"Convite ao abrigo do(s) acordo(s)-quadro 2020/18, 2020/61, 2021/47, 2021/55, 2021/6, 2021/61 e 2022/40, para suprir necessidades na área da saúde";Ao abrigo de acordo-quadro (art.º 259.º);Aquisição de bens móveis;33600000-6;Principal;Produtos farmacêuticos;122352.62 € ;"UNIDADE LOCAL DE SAÚDE DA GUARDA, E.P.E (508752000)";MERCK S.A. (500650870);"122.352,62 €";20-02-2023;17-02-2023;334 dias;"Portugal, Lisboa, Lisboa";Artigo 259.º do Código dos Contratos Públicos;;;;;;;5152742;"CP 2021/47 - Medicamentos do aparelho locomotor, usados no tratamento das doenças endócrinas e hormonas";true;https://community.vortal.biz/PRODPublic/Tendering/OpportunityDetail/Index?noticeUID=PT1.NTC.2232453;false;;;"Código dos Contratos Públicos (DL111-B/2017) e Lei n.º 30/2021, de 21.05";false;false;
"Convite ao abrigo do(s) acordo(s)-quadro 2020/18, 2021/12, 2021/49 2021/55, 2021/6, 2021/61 e 2022/40 para suprir necessidades na área da saúde";Ao abrigo de acordo-quadro (art.º 259.º);Aquisição de bens móveis;33600000-6;Principal;Produtos farmacêuticos;121721.28 € ;"Unidade Local de Saúde da Guarda, E. P. E. (508752000)";"LABORATORIOS PFIZER, S.A. (500162166)";"121.721,28 €";13-07-2022;30-06-2022;243 dias;"Portugal, Lisboa, Lisboa";Artigo 259.º do Código dos Contratos Públicos;;;;;;;5032541;CP 2021/6 - Medicamentos do foro oncológico e imunomoduladores;true;https://community.vortal.biz/PRODPublic/Tendering/OpportunityDetail/Index?noticeUID=PT1.NTC.1925080;false;;;"Código dos Contratos Públicos (DL111-B/2017) e Lei n.º 30/2021, de 21.05";false;false;
"Aquisição de Sistema Audit Trail para a Unidade Local de Saúde da Guarda, EPE - Projeto SAMA 00263";Concurso público;Aquisição de bens móveis;48100000-9;Principal;Pacote de software para sectores específicos;121697.0 € ;"Unidade Local de Saúde da Guarda, E. P. E. (508752000)";"HLTYSYS - HealtySystems, Lda. (510552544)";"121.697,00 €";11-05-2022;04-05-2022;276 dias;"Portugal, Guarda, Guarda";"Artigo 20.º, n.º 1, alínea b) do Código dos Contratos Públicos";;;;;;;Não aplicável.;Não aplicável.;false;https://community.vortal.biz/PRODPublic/Tendering/OpportunityDetail/Index?noticeUID=PT1.NTC.1850792;false;;;"Código dos Contratos Públicos (DL111-B/2017) e Lei n.º 30/2021, de 21.05";false;false;
AJUSTE DIRETO PARA AQUISIÇÃO DE SERVIÇOS DE MANUTENÇÃO E ASSISTÊNCIA TÉCNICA AOS SISTEMAS PACS SYNGO INSTALADOS NAS ENTIDADES DO MINISTÉRIO DA SAÚDE PARA O ANO 2024;Ajuste Direto Regime Geral;Aquisição de serviços;72500000-0;Principal;Serviços relacionados com a informática;120675.66 € ;"UNIDADE LOCAL DE SAÚDE DA GUARDA, E.P.E (508752000)";"SIEMENS HEALTHCARE,UNIPESSOAL, LDA. (507925173)";"120.675,66 €";20-03-2024;18-03-2024;365 dias;"Portugal, Guarda";"Artigo 24.º, n.º 1, alínea e), subalínea iii) do Código dos Contratos Públicos";;;;;;;Não aplicável.;Não aplicável.;true;https://community.vortal.biz/PRODPublic/Tendering/OpportunityDetail/Index?noticeUID=PT1.NTC.2770652;false;;;"Código dos Contratos Públicos (DL111-B/2017) e Lei n.º 30/2021, de 21.05";false;false;
"Convite à apresentação de propostas ao abrigo do(s) acordo(s)-quadro 2021/047 – Medicamentos do aparelho locomotor, usados no tratamento de doenças endócrinas e hormonas 2023/436 – Medicamentos para o";Ao abrigo de acordo-quadro (art.º 259.º);Aquisição de bens móveis;33600000-6;Principal;Produtos farmacêuticos;120400.0 € ;"UNIDADE LOCAL DE SAÚDE DA GUARDA, E.P.E (508752000)";"BIOGEN PORTUGAL Soc. Farmacêutica, Unipessoal Lda. (506415740)";"120.400,00 €";04-03-2024;19-02-2024;337 dias;"Portugal, Guarda, Guarda";Artigo 259.º do Código dos Contratos Públicos;;;;;;;6677696;491/2023 - Concurso público internacional para formação do acordo quadro de medicamentos do foro oncológico e imunomoduladores;true;https://community.vortal.biz/PRODPublic/Tendering/OpportunityDetail/Index?noticeUID=PT1.NTC.2727046;false;;;"Código dos Contratos Públicos (DL111-B/2017) e Lei n.º 30/2021, de 21.05";false;false;
"Aquisição de Sistema Integrador de Interoperabilidade HL7 AIDA ""SAMA 2020 - Projeto Saúde Segura operação n.º 35563""";Concurso público;Aquisição de bens móveis<br/>Aquisição de serviços;72416000-9;Principal;Fornecedores de aplicações;120000.0 € ;"UNIDADE LOCAL DE SAÚDE DA GUARDA, E.P.E (508752000)";GISCON (501937102);"120.000,00 €";02-07-2020;30-10-2019;90 dias;"Portugal, Guarda, Guarda";"Artigo 20.º, n.º 1, alínea b) do Código dos Contratos Públicos";;;;;;;Não aplicável.;Não aplicável.;false;;false;;;Código dos Contratos Públicos ( DL 111-B/2017 );false;false;
P259-2021-008 - CONVITE AO ABRIGO DO(S) ACORDO(S) QUADRO 2017/6 (MEDICAMENTOS DO FOROONCOLÓGICO E IMUNOMODULADORES) E 2018/7 (HORMONAS E OUTROS MEDICAMENTOS USADOS NO TRATAMENTO DE DOENÇAS ENDÓCRINAS);Ao abrigo de acordo-quadro (art.º 259.º);Aquisição de bens móveis;33600000-6;Principal;Produtos farmacêuticos;119821.56 € ;"UNIDADE LOCAL DE SAÚDE DA GUARDA, E.P.E (508752000)";"Pfizer Biofarmacêutica, Sociedade Unipessoal, Lda. (513300376)";"119.821,56 €";05-02-2021;25-01-2021;180 dias;Portugal;Artigo 259.º do Código dos Contratos Públicos;;;;;;;2969238;"CP 2017/6 - Acordo Quadro para fornecimento de Medicamentos do Foro Oncológico e Imunomoduladores, às Instituições e Serviços do Serviço Nacional de Saúde";true;https://community.vortal.biz/PRODPublic/Tendering/OpportunityDetail/Index?noticeUID=PT1.NTC.1384704;false;;;Código dos Contratos Públicos ( DL 111-B/2017 );false;false;
"Convite ao abrigo do(s) acordo(s)-quadro 2019/55, 2021/6 , 2021/61, 2022/40 para suprir necessidades na área da saúde";Ao abrigo de acordo-quadro (art.º 259.º);Aquisição de bens móveis;33600000-6;Principal;Produtos farmacêuticos;119073.01 € ;"Unidade Local de Saúde da Guarda, E. P. E. (508752000)";"ROCHE FARMACEUTICA QUIMICA, LDA (500233810)";"119.073,01 €";02-01-2023;28-12-2022;365 dias;"Portugal, Lisboa, Lisboa";Artigo 259.º do Código dos Contratos Públicos;;;;;;;5032541;CP 2021/6 - Medicamentos do foro oncológico e imunomoduladores;true;https://community.vortal.biz/PRODPublic/Tendering/OpportunityDetail/Index?noticeUID=PT1.NTC.2155687;false;;;"Código dos Contratos Públicos (DL111-B/2017) e Lei n.º 30/2021, de 21.05";false;false;
"115/2022 - Convite ao abrigo do(s) acordo(s)-quadro 2021/61 (medicamentos diversos), 2021/49 (medicamentos usados nas afeções oculares e otorrinolaringológicas) e 2021/12 (medicamentos do aparelho res";Ao abrigo de acordo-quadro (art.º 259.º);Aquisição de bens móveis;33600000-6;Principal;Produtos farmacêuticos;117512.0 € ;"UNIDADE LOCAL DE SAÚDE DA GUARDA, E.P.E (508752000)";NOVARTIS (500063524);"117.512,00 €";15-11-2022;09-09-2022;151 dias;"Portugal, Lisboa, Lisboa";Artigo 259.º do Código dos Contratos Públicos;;;;;;;5666621;CP 2021/61 - Medicamentos diversos;true;https://community.vortal.biz/PRODPublic/Tendering/OpportunityDetail/Index?noticeUID=PT1.NTC.2007772;false;;;"Código dos Contratos Públicos (DL111-B/2017) e Lei n.º 30/2021, de 21.05";false;false;
"Convite à apresentação de propostas ao abrigo do(s) acordo(s)-quadro  2021/6,  2021/61,  2022/173 e 2023/304 para aquisição de medicamentos";Ao abrigo de acordo-quadro (art.º 259.º);Aquisição de bens móveis;33600000-6;Principal;Produtos farmacêuticos;116653.28 € ;"UNIDADE LOCAL DE SAÚDE DA GUARDA, E.P.E (508752000)";"Roche - Farmacêutica Química, Lda. (500233810)";"116.653,28 €";31-01-2024;27-12-2023;366 dias;"Portugal, Lisboa, Lisboa";Artigo 259.º do Código dos Contratos Públicos;;;;;;;5032541;CP 2021/6 - Medicamentos do foro oncológico e imunomoduladores;true;https://community.vortal.biz/PRODPublic/Tendering/OpportunityDetail/Index?noticeUID=PT1.NTC.2650192;false;;;"Código dos Contratos Públicos (DL111-B/2017) e Lei n.º 30/2021, de 21.05";false;false;
"Serviços para Recolha, Transporte, Tratamento e Destino Final de Residuos Hospitalares";Concurso público;Aquisição de serviços;90511000-2;Principal;Serviços de recolha de resíduos;116424.44 € ;"Unidade Local de Saúde da Guarda, EPE (508752000)";SUCH-SERVIÇOS DE UTILIZAÇÃO COMUM DOS HOSPITAIS (500900469);"116.424,44 €";11-11-2016;21-05-2015;365 dias;"Portugal, Guarda, Guarda";"Artigo 20.º, n.º 1, alínea b) do Código dos Contratos Públicos";;;;;;;Não aplicável.;Não aplicável.;false;;false;;;Código dos Contratos Públicos (DL 18/2008);false;false;
"CONVITE AO ABRIGO DO(S) ACORDO(S) QUADRO 2018/64 - MEDICAMENTOS DIVERSOS, 2019/61 - MEDICAMENTOS DIVERSOS, 2017/06 - MEDICAMENTOS DO FORO ONCOLÓGICO E IMUNOMODULADORES,  PARA AS INSTITUIÇÕES DO SNS";Ao abrigo de acordo-quadro (art.º 259.º);Aquisição de bens móveis;33600000-6;Principal;Produtos farmacêuticos;116230.71 € ;"Unidade Local de Saúde da Guarda, E. P. E. (508752000)";BRISTOL MYERS SQUIBB-FARM. POR (500048193);"116.230,71 €";11-02-2021;01-02-2021;180 dias;Portugal;Artigo 259.º do Código dos Contratos Públicos;;;;;;;4088496;CP 2019/61 - Medicamentos diversos;true;https://community.vortal.biz/PRODPublic/Tendering/OpportunityDetail/Index?noticeUID=PT1.NTC.1391717;false;;;Código dos Contratos Públicos ( DL 111-B/2017 );false;false;
51/56/2023 - CPA 2022/56 - Meios de diagnóstico - Imagiologia;Ao abrigo de acordo-quadro (art.º 259.º);Aquisição de bens móveis;33600000-6;Principal;Produtos farmacêuticos;116192.8 € ;"Unidade Local de Saúde da Guarda, E. P. E. (508752000)";BAYER PORTUGAL LDA (500043256);"116.192,80 €";21-12-2022;14-12-2022;365 dias;"Portugal, Guarda, Guarda";Artigo 259.º do Código dos Contratos Públicos;;;;;;;5758900;CP 2022/56 - Meios de diagnóstico para imagiologia;false;https://community.vortal.biz/PRODPublic/Tendering/OpportunityDetail/Index?noticeUID=PT1.NTC.2096487;false;;;"Código dos Contratos Públicos (DL111-B/2017) e Lei n.º 30/2021, de 21.05";false;false;
P259-2019-221 - Aquisição de medicamentos no âmbito da Agregação Centralizada 2020 para Instituições do SNS;Ao abrigo de acordo-quadro (art.º 259.º);Aquisição de bens móveis;33600000-6;Principal;Produtos farmacêuticos;116109.96 € ;"UNIDADE LOCAL DE SAÚDE DA GUARDA, E.P.E (508752000)";Bayer Portugal S.A. (500043256);"116.109,96 €";09-12-2019;03-12-2019;360 dias;Portugal;Artigo 259.º do Código dos Contratos Públicos;;;;;;;2969238;"CP 2017/6 - Acordo Quadro para fornecimento de Medicamentos do Foro Oncológico e Imunomoduladores, às Instituições e Serviços do Serviço Nacional de Saúde";true;;false;;;Código dos Contratos Públicos ( DL 111-B/2017 );false;false;
Reagentes para Determinação da Microbiologia das Águas - Laboratório de Saúde Pública da Guarda;Ajuste Direto Regime Geral;Aquisição de bens móveis;33696500-0;Principal;Reagentes de laboratório;115864.04 € ;"Unidade Local de Saúde da Guarda, E. P. E. (508752000)";"IBERLAB & IMUNOREAGE - SOLUÇÕES P LABORAT., LDA (503406694)";"115.864,04 €";21-03-2023;21-03-2023;306 dias;"Portugal, Guarda, Guarda";"Artigo 24.º, n.º 1, alínea e), subalínea iii) do Código dos Contratos Públicos";;;;;;;Não aplicável.;Não aplicável.;false;https://community.vortal.biz/PRODPublic/Tendering/OpportunityDetail/Index?noticeUID=PT1.NTC.2290742;false;;;"Código dos Contratos Públicos (DL111-B/2017) e Lei n.º 30/2021, de 21.05";false;false;
"Fornecimento de Alimentação para a Unidade Local de Saúde da Guarda, E.P.E.";Concurso público;Aquisição de serviços;55520000-1;Principal;Serviços de fornecimento de refeições (catering);115845.1 € ;"Unidade Local de Saúde da Guarda, E.P.E (508752000)";"SOLNAVE – Restaurantes e Alimentação, S.A (500272328)";"115.845,10 €";19-05-2015;01-12-2014;30 dias;"Portugal, Guarda, Guarda";"Artigo 20.º, n.º 1, alínea b) do Código dos Contratos Públicos";;;;;;;Não aplicável.;Não aplicável.;false;;false;;;Código dos Contratos Públicos (DL 18/2008);false;false;
SERVIÇOS DE MANUTENÇÃO E ASSISTÊNCIA TÉCNICA AOS SISTEMAS PACS SYNGO INSTALADOS NAS ENTIDADES DO MINISTÉRIO DA SAÚDE PARA O ANO 2023;Ajuste Direto Regime Geral;Aquisição de serviços;72500000-0;Principal;Serviços relacionados com a informática;114168.08 € ;"UNIDADE LOCAL DE SAÚDE DA GUARDA, E.P.E (508752000)";"SIEMENS HEALTHCARE, LDA (507925173)";"114.168,08 €";08-02-2023;02-02-2023;365 dias;"Portugal, Guarda";"Artigo 24.º, n.º 1, alínea e), subalínea iii) do Código dos Contratos Públicos";;;;;;;Não aplicável.;Não aplicável.;true;https://community.vortal.biz/PRODPublic/Tendering/OpportunityDetail/Index?noticeUID=PT1.NTC.2216243;false;;;"Código dos Contratos Públicos (DL111-B/2017) e Lei n.º 30/2021, de 21.05";false;false;
Aquisição de Medicamentos ao abrigo do AQ 2017/6 no âmbito da agregação centralizada 2021;Ao abrigo de acordo-quadro (art.º 259.º);Aquisição de bens móveis;33600000-6;Principal;Produtos farmacêuticos;113842.11 € ;"UNIDADE LOCAL DE SAÚDE DA GUARDA, E.P.E (508752000)";"ASTELLAS FARMA, LDA. (502540249)";"113.842,11 €";17-02-2021;08-02-2021;360 dias;Portugal;Artigo 259.º do Código dos Contratos Públicos;;;;;;;2969238;"CP 2017/6 - Acordo Quadro para fornecimento de Medicamentos do Foro Oncológico e Imunomoduladores, às Instituições e Serviços do Serviço Nacional de Saúde";true;https://community.vortal.biz/PRODPublic/Tendering/OpportunityDetail/Index?noticeUID=PT1.NTC.1383423;false;;;Código dos Contratos Públicos ( DL 111-B/2017 );false;false;
Aquisição de Combustíveis Rodoviários - 2023;Concurso público;Aquisição de bens móveis;09130000-9;Principal;Petróleo e destilados;113227.73 € ;"Unidade Local de Saúde da Guarda, E. P. E. (508752000)";"Petrogal, S.A. (500697370)";"113.227,73 €";21-03-2023;16-03-2023;306 dias;"Portugal, Guarda";"Artigo 20.º, n.º 1, alínea a) do Código dos Contratos Públicos";;;;;;;Não aplicável.;Não aplicável.;true;https://community.vortal.biz/PRODPublic/Tendering/OpportunityDetail/Index?noticeUID=PT1.NTC.2204576;false;;;"Código dos Contratos Públicos (DL111-B/2017) e Lei n.º 30/2021, de 21.05";false;false;
CPA 2021/6 - Medicamentos Antineoplasicos - Hematologia;Ao abrigo de acordo-quadro (art.º 259.º);Aquisição de bens móveis;33652100-6;Principal;Antineoplásicos;112648.8 € ;"UNIDADE LOCAL DE SAÚDE DA GUARDA, E.P.E (508752000)";"ASTRAZENECA PRODUTOS FARMACEUTICOS, LDA (502942240)";"112.648,80 €";08-03-2022;03-03-2022;334 dias;Portugal;Artigo 259.º do Código dos Contratos Públicos;;;;;;;5032541;CP 2021/6 - Medicamentos do foro oncológico e imunomoduladores;false;https://community.vortal.biz/PRODPublic/Tendering/OpportunityDetail/Index?noticeUID=PT1.NTC.1807194;false;;;"Código dos Contratos Públicos (DL111-B/2017) e Lei n.º 30/2021, de 21.05";false;false;
CPA 2021/6 - Medicamentos Antineoplasicos - Hematologia;Ao abrigo de acordo-quadro (art.º 259.º);Aquisição de bens móveis;33652100-6;Principal;Antineoplásicos;112464.9648 € ;"UNIDADE LOCAL DE SAÚDE DA GUARDA, E.P.E (508752000)";"JANSSEN - CILAG FARMACEUTICA, LDA (500189412)";"112.464,96 €";08-03-2022;03-03-2022;334 dias;Portugal;Artigo 259.º do Código dos Contratos Públicos;;;;;;;5032541;CP 2021/6 - Medicamentos do foro oncológico e imunomoduladores;false;https://community.vortal.biz/PRODPublic/Tendering/OpportunityDetail/Index?noticeUID=PT1.NTC.1807194;false;;;"Código dos Contratos Públicos (DL111-B/2017) e Lei n.º 30/2021, de 21.05";false;false;
Aquisição de Serviços de Manutenção para Equipamentos de Electromedicina da Marca General Electric Healthcare da ULSG: Triénio 2023-2025 (36 meses);Ajuste Direto Regime Geral;Aquisição de serviços;50420000-5;Principal;Serviços de reparação e manutenção de equipamento médico e cirúrgico;110854.6 € ;"UNIDADE LOCAL DE SAÚDE DA GUARDA, E.P.E (508752000)";"General Electric Healthcare Portugal, Sociedade Unipessoal, Lda. (500357129)";"110.854,60 €";31-08-2023;30-08-2023;1095 dias;"Portugal, Guarda, Guarda";"Artigo 24.º, n.º 1, alínea e), subalínea ii) do Código dos Contratos Públicos";;;;;;;Não aplicável.;Não aplicável.;false;https://community.vortal.biz/PRODPublic/Tendering/OpportunityDetail/Index?noticeUID=PT1.NTC.2513075;false;;;"Código dos Contratos Públicos (DL111-B/2017) e Lei n.º 30/2021, de 21.05";false;false;
Contrato de Manutenção do Sistema de Arquivo e Distribuição de Imagens (PACS) da ULSG para 2022;Ajuste Direto Regime Geral;Aquisição de serviços;72212180-4;Principal;Serviços de desenvolvimento de software para medicina;110414.0 € ;"Unidade Local de Saúde da Guarda, E. P. E. (508752000)";"Siemens Healthcare, Unipessoal, Lda (507925173)";"110.414,00 €";23-03-2022;22-03-2022;365 dias;"Portugal, Guarda";"Artigo 24.º, n.º 1, alínea e), subalínea ii) do Código dos Contratos Públicos";;;;;;;Não aplicável.;Não aplicável.;false;https://community.vortal.biz/PRODPublic/Tendering/OpportunityDetail/Index?noticeUID=PT1.NTC.1850914;false;;;"Código dos Contratos Públicos (DL111-B/2017) e Lei n.º 30/2021, de 21.05";false;false;
Contrato Manutenção do Sistema de Arquivo e Distribuição de Imagens (PACS);Ajuste Direto Regime Geral;Aquisição de serviços;72212180-4;Principal;Serviços de desenvolvimento de software para medicina;110414.0 € ;"UNIDADE LOCAL DE SAÚDE DA GUARDA, E.P.E (508752000)";"Siemens Healthcare, Unipessoal, Lda. (507925173)";"110.414,00 €";24-03-2022;24-07-2019;365 dias;"Portugal, Guarda";"Artigo 24.º, n.º 1, alínea e), subalínea ii) do Código dos Contratos Públicos";;;;;;;Não aplicável.;Não aplicável.;false;;false;;;Código dos Contratos Públicos ( DL 111-B/2017 );true;false;
Contrato de Manutenção do Sistema de Arquivo e Distribuição de Imagens (PACS) da ULSG;Ajuste Direto Regime Geral;Aquisição de serviços;72212180-4;Principal;Serviços de desenvolvimento de software para medicina;110414.0 € ;"Unidade Local de Saúde da Guarda, E. P. E. (508752000)";SIMENS (507925173);"110.414,00 €";30-09-2021;28-09-2021;365 dias;"Portugal, Guarda, Guarda";"Artigo 24.º, n.º 1, alínea e), subalínea ii) do Código dos Contratos Públicos";;;;;;;Não aplicável.;Não aplicável.;false;https://community.vortal.biz/PRODPublic/Tendering/OpportunityDetail/Index?noticeUID=PT1.NTC.1660001;false;;;"Código dos Contratos Públicos (DL111-B/2017) e Lei n.º 30/2021, de 21.05";false;false;
Contrato Manutenção do Sistema de Arquivo e Distribuição de Imagens (PACS) da ULSG para 2018;Ajuste Direto Regime Geral;Aquisição de serviços;72200000-7;Principal;Serviços de consultoria e de programação de software;110414.0 € ;"Unidade Local de Saúde da Guarda, E. P. E. (508752000)";"SIEMENS HEALTHCARE, UNIPESSOAL, LDA. (507925173)";"110.414,00 €";27-04-2022;24-09-2018;365 dias;"Portugal, Guarda";"Artigo 24.º, n.º 1, alínea e), subalínea ii) do Código dos Contratos Públicos";;;;;;;Não aplicável.;Não aplicável.;false;https://next.vortal.biz/PRODPT1BusinessLine/Tendering/ProcedureEdit/View?docUniqueIdentifier=PT1.REQ.13924119#stpContractDocumentsStep;false;;;Código dos Contratos Públicos ( DL 111-B/2017 );true;false;
Renovação do Contrato Manutenção do Sistema de Arquivo e Distribuição de Imagens (PACS) para 2020;Ajuste Direto Regime Geral;Aquisição de serviços;72200000-7;Principal;Serviços de consultoria e de programação de software;110414.0 € ;"Unidade Local de Saúde da Guarda, E. P. E. (508752000)";"SIEMENS HEALTHCARE, UNIPESSOAL, LDA. (507925173)";"110.414,00 €";27-04-2022;09-06-2020;365 dias;"Portugal, Guarda";"Artigo 24.º, n.º 1, alínea e), subalínea ii) do Código dos Contratos Públicos";;;;;;;Não aplicável.;Não aplicável.;false;;false;;;Código dos Contratos Públicos ( DL 111-B/2017 );true;false;
Renovação do Contrato de Manutenção do Sistema de Arquivo e Distribuição de Imagens (PACS) para 2017;Ajuste Direto Regime Geral;Aquisição de serviços;72200000-7;Principal;Serviços de consultoria e de programação de software;110414.0 € ;"UNIDADE LOCAL DE SAÚDE DA GUARDA, E.P.E (508752000)";"Siemens Healthcare, Lda (507925173)";"110.414,00 €";12-06-2017;26-05-2017;365 dias;"Portugal, Guarda, Guarda";"Artigo 24.º, n.º 1, alínea e) do Código dos Contratos Públicos";;;;;;;Não aplicável.;Não aplicável.;false;;false;;;Código dos Contratos Públicos (DL 18/2008);false;false;
"P259-2019-207 - Aquisição ao abrigo dos AQ 2017/6, 2019/40, 2017/65, 2018/55 e 2017/64 para as Instituições do SNS ";Ao abrigo de acordo-quadro (art.º 259.º);Aquisição de bens móveis;33600000-6;Principal;Produtos farmacêuticos;110003.0 € ;"UNIDADE LOCAL DE SAÚDE DA GUARDA, E.P.E (508752000)";"Janssen-Cilag, Lda. (500189412)";"110.003,00 €";09-12-2019;03-12-2019;360 dias;Portugal;Artigo 259.º do Código dos Contratos Públicos;;;;;;;4028557;CP 2019/40 - Medicamentos antirretrovíricos para o tratamento da infeção por VIH;true;;false;;;Código dos Contratos Públicos ( DL 111-B/2017 );false;false;
Aquisição de Serviços de Segurança e Vigilância para a ULSG - março abril 2018;Ajuste Direto Regime Geral;Aquisição de serviços;79710000-4;Principal;Serviços de segurança;109997.74 € ;"UNIDADE LOCAL DE SAÚDE DA GUARDA, E.P.E (508752000)";"CHARON, PRESTAÇÃO DE SERVIÇOS DE SEGURANÇA E VIGILÂNCIA, S.A (501718540)";"109.997,74 €";06-04-2018;09-03-2018;60 dias;"Portugal, Guarda, Guarda";"Artigo 20.º, n.º 1, alínea a) do Código dos Contratos Públicos";;;;;;;Não aplicável.;Não aplicável.;false;;false;;;Código dos Contratos Públicos ( DL 111-B/2017 );false;false;
AQUISIÇÃO DE SERVIÇOS DE SEGURANÇA E VIGILÂNCIA PARA A ULSG – MAIO E JUNHO 2018;Ajuste Direto Regime Geral;Aquisição de serviços;79710000-4;Principal;Serviços de segurança;109997.74 € ;"Unidade Local de Saúde da Guarda, E. P. E. (508752000)";"CHARON, PRESTAÇÃO DE SERVIÇOS DE SEGURANÇA E VIGILÂNCIA, S.A (501718540)";"109.997,74 €";16-05-2018;02-05-2018;60 dias;"Portugal, Guarda, Guarda";"Artigo 27.º, n.º 1, alínea a) do Código dos Contratos Públicos";;;;;;;Não aplicável.;Não aplicável.;false;;false;;;Código dos Contratos Públicos ( DL 111-B/2017 );false;false;
Aquisição de Serviços de Segurança e Vigilância para a ULSG - Fev 2018;Ajuste Direto Regime Geral;Aquisição de serviços;79710000-4;Principal;Serviços de segurança;109997.28 € ;"UNIDADE LOCAL DE SAÚDE DA GUARDA, E.P.E (508752000)";"CHARON, PRESTAÇÃO DE SERVIÇOS DE SEGURANÇA E VIGILÂNCIA, S.A (501718540)";"109.997,28 €";02-02-2018;19-01-2018;60 dias;"Portugal, Guarda, Guarda";"Artigo 27.º, n.º 1, alínea a) do Código dos Contratos Públicos";;;;;;;Não aplicável.;Não aplicável.;false;;false;;;Código dos Contratos Públicos (DL 18/2008);false;false;
Aquisição de Equipamento EBUS e Respetivos Acessórios para o Serviço de Pneumologia do HSM;Concurso público;Aquisição de bens móveis;33100000-1;Principal;Equipamento médico;109983.99 € ;"UNIDADE LOCAL DE SAÚDE DA GUARDA, E.P.E (508752000)";FUJIFILM EUROPE GMBH (980456517);"109.983,99 €";09-09-2020;01-06-2020;30 dias;"Portugal, Guarda, Guarda";"Artigo 20.º, n.º 1, alínea b) do Código dos Contratos Públicos";;;;;;;Não aplicável.;Não aplicável.;false;https://community.vortal.biz/PRODPublic/Tendering/OpportunityDetail/Index?noticeUID=PT1.NTC.1152497;false;;;Código dos Contratos Públicos ( DL 111-B/2017 );false;false;
