Aquisição de Sistema de Gestão da Anestesiologia da ULS Guarda ;Concurso público;Aquisição de serviços;72226000-5;Principal;Serviços de consultoria em matéria de testes de aceitação de software de sistema;88000.0 € ;"Unidade Local de Saúde da Guarda, E. P. E. (508752000)";B - Simple (506188841);"88.000,00 €";03-01-2018;24-11-2017;84 dias;"Portugal, Guarda, Guarda";"Artigo 20.º, n.º 1, alínea b) do Código dos Contratos Públicos";;;;;;;Não aplicável.;Não aplicável.;false;;false;;;Código dos Contratos Públicos (DL 18/2008);false;false;
AQUISIÇÃO DE ENDOSCÓPIOS PARA O SERVIÇO DE GASTRENTEROLOGIA DO HSM;Concurso público;Aquisição de bens móveis;33000000-0;Principal;"Equipamento médico, medicamentos e produtos para cuidados pessoais";87400.0 € ;"Unidade Local de Saúde da Guarda, E. P. E. (508752000)";Sistemas Integrales de la medicina SA (980488842);"87.400,00 €";01-10-2015;22-09-2015;8 dias;"Portugal, Guarda, Guarda";"Artigo 20.º, n.º 1, alínea b) do Código dos Contratos Públicos";;;;;;;Não aplicável.;Não aplicável.;false;;false;;;Código dos Contratos Públicos (DL 18/2008);false;false;
Obras de Beneficiação das Instalações da Cozinha do HSM;Ajuste Direto Regime Geral;Empreitadas de obras públicas;45000000-7;Principal;Construção;87000.0 € ;"Unidade Local de Saúde da Guarda, E.P.E (508752000)";"EDIBEIRAS-EDIFICIOS E OBRAS PÚBLICAS DAS BEIRAS,LDA (508005833)";"87.000,00 €";19-05-2015;15-05-2015;90 dias;"Portugal, Guarda, Guarda";"Artigo 19.º, alínea a) do Código dos Contratos Públicos";;;;;;;Não aplicável.;Não aplicável.;false;;false;;;Código dos Contratos Públicos (DL 18/2008);false;false;
"Fornecimento de reagentes para a extração e deteção/quantificação de microrganismos responsáveis por infeções respiratórias, sexualmente transmissíveis, gastrointestinais, e outras por PCR Real Time";Ajuste Direto Regime Geral;Aquisição de bens móveis;33696500-0;Principal;Reagentes de laboratório;86700.0 € ;"Unidade Local de Saúde da Guarda, E. P. E. (508752000)";"CEPHEID IBÉRIA, S.L.U. - Sucursal em Portugal (980655684)";"86.700,00 €";20-11-2023;17-11-2023;90 dias;"Portugal, Guarda, Guarda";"Artigo 24.º, n.º 1, alínea e), subalínea iii) do Código dos Contratos Públicos";;;;;;;Não aplicável.;Não aplicável.;false;https://community.vortal.biz/PRODPublic/Tendering/OpportunityDetail/Index?noticeUID=PT1.NTC.2620476;false;;;"Código dos Contratos Públicos (DL111-B/2017) e Lei n.º 30/2021, de 21.05";false;false;
"419/2023 - Convite ao abrigo do(s) acordo(s)-quadro 2020/61 (Medicamentos diversos), 2021/41  (Medicamentos antivíricos e antifúngicos), 2021/47 (Medicamentos do aparelho locomotor, usados no  tratame";Ao abrigo de acordo-quadro (art.º 259.º);Aquisição de bens móveis;33600000-6;Principal;Produtos farmacêuticos;86337.23 € ;"Unidade Local de Saúde da Guarda, E. P. E. (508752000)";"LABORATORIOS PFIZER, S.A. (500162166)";"86.337,23 €";31-03-2023;31-03-2023;306 dias;"Portugal, Lisboa, Lisboa";Artigo 259.º do Código dos Contratos Públicos;;;;;;;5032541;CP 2021/6 - Medicamentos do foro oncológico e imunomoduladores;true;https://community.vortal.biz/PRODPublic/Tendering/OpportunityDetail/Index?noticeUID=PT1.NTC.2280982;false;;;"Código dos Contratos Públicos (DL111-B/2017) e Lei n.º 30/2021, de 21.05";false;false;
Aquisição ao abrigo do Acordo - Quadro 2022/13 para aquisição da vacina contra a gripe;Ao abrigo de acordo-quadro (art.º 259.º);Aquisição de bens móveis;33600000-6;Principal;Produtos farmacêuticos;85995.0 € ;"UNIDADE LOCAL DE SAÚDE DA GUARDA, E.P.E (508752000)";"MYLAN, LDA (502248793)";"85.995,00 €";10-07-2023;03-07-2023;215 dias;"Portugal, Lisboa, Lisboa";Artigo 259.º do Código dos Contratos Públicos;;;;;;;5839055;CP 2022/13 - Vacinas e tuberculinas;true;https://community.vortal.biz/PRODPublic/Tendering/OpportunityDetail/Index?noticeUID=PT1.NTC.2418493;false;;;"Código dos Contratos Públicos (DL111-B/2017) e Lei n.º 30/2021, de 21.05";false;false;
Aquisição de reagentes para pesquisa de sangue oculto nas fezes com colocação de equipamento no Laboratório de Saúde Pública da ULS da Guarda;Concurso público;Aquisição de bens móveis;33696700-2;Principal;Reagentes para urologia;85500.0 € ;"Unidade Local de Saúde da Guarda, E. P. E. (508752000)";"SYSMEX PORTUGAL, S.A. (500094853)";"85.500,00 €";29-06-2021;07-06-2021;1095 dias;"Portugal, Guarda, Guarda";"Artigo 20.º, n.º 1, alínea b) do Código dos Contratos Públicos";;;;;;;Não aplicável.;Não aplicável.;false;https://community.vortal.biz/PRODPublic/Tendering/OpportunityDetail/Index?noticeUID=PT1.NTC.1517501;false;;;Código dos Contratos Públicos ( DL 111-B/2017 );false;false;
CONVITE AO ABRIGO DO(S) ACORDO(S) QUADRO 2019/13  PARA AS INSTITUIÇÕES DO SNS;Ao abrigo de acordo-quadro (art.º 259.º);Aquisição de bens móveis;33600000-6;Principal;Produtos farmacêuticos;85366.45 € ;"Unidade Local de Saúde da Guarda, E. P. E. (508752000)";"Sanofi - Produtos Farmacêuticos, Lda (500134960)";"85.366,45 €";02-08-2021;07-07-2021;212 dias;Portugal;Artigo 259.º do Código dos Contratos Públicos;;;;;;;3957155;"CP 2019/13 - Vacinas do PNV e outras, e Tuberculinas do PN para a Tuberculose";true;https://community.vortal.biz/PRODPublic/Tendering/OpportunityDetail/Index?noticeUID=PT1.NTC.1548082;false;;;Código dos Contratos Públicos ( DL 111-B/2017 );false;false;
Aquisição ao abrigo do AQ 2019/13 para as instituições do SNS;Ao abrigo de acordo-quadro (art.º 259.º);Aquisição de bens móveis;33600000-6;Principal;Produtos farmacêuticos;84952.0 € ;"Unidade Local de Saúde da Guarda, E. P. E. (508752000)";"SANOFI - PRODUTOS FARMACÊUTICOS, LDA. (500134960)";"84.952,00 €";11-07-2022;08-07-2022;184 dias;"Portugal, Lisboa, Lisboa";Artigo 259.º do Código dos Contratos Públicos;;;;;;;3957155;"CP 2019/13 - Vacinas do PNV e outras, e Tuberculinas do PN para a Tuberculose";true;https://community.vortal.biz/PRODPublic/Tendering/OpportunityDetail/Index?noticeUID=PT1.NTC.1939952;false;;;"Código dos Contratos Públicos (DL111-B/2017) e Lei n.º 30/2021, de 21.05";false;false;
Medicamentos do foro oncológico (2021/6);Ao abrigo de acordo-quadro (art.º 259.º);Aquisição de bens móveis;33600000-6;Principal;Produtos farmacêuticos;84748.64 € ;"Unidade Local de Saúde da Guarda, E. P. E. (508752000)";BOERINGER INGLHEIM PORTUGAL (500293023);"84.748,64 €";19-01-2022;28-12-2021;365 dias;Portugal;Artigo 259.º do Código dos Contratos Públicos;;;;;;;5032541;CP 2021/6 - Medicamentos do foro oncológico e imunomoduladores;false;https://community.vortal.biz/PRODPublic/Tendering/OpportunityDetail/Index?noticeUID=PT1.NTC.1725043;false;;;Código dos Contratos Públicos ( DL 111-B/2017 );false;false;
Corretivos da volemia e outras soluçoes estereis ;Ao abrigo de acordo-quadro (art.º 259.º);Aquisição de bens móveis;33690000-3;Principal;Medicamentos vários - Medicamentos;84682.0 € ;"Unidade Local de Saúde da Guarda, E. P. E. (508752000)";"B. Braun Medical, Unipessoal Lda. (501506543)";"84.682,00 €";28-12-2022;14-12-2022;365 dias;"Portugal, Guarda, Guarda";Artigo 259.º do Código dos Contratos Públicos;;;;;;;4580464;CP 2020/3 - Corretivos da volémia e outras soluções estéreis;false;https://community.vortal.biz/PRODPublic/Tendering/OpportunityDetail/Index?noticeUID=PT1.NTC.2096867;false;;;"Código dos Contratos Públicos (DL111-B/2017) e Lei n.º 30/2021, de 21.05";false;false;
P259-2020-118 - Aquisição de Medicamentos ao abrigo do AQ 2017/6 para as Instituições do SNS;Ao abrigo de acordo-quadro (art.º 259.º);Aquisição de bens móveis;33600000-6;Principal;Produtos farmacêuticos;84249.66 € ;"UNIDADE LOCAL DE SAÚDE DA GUARDA, E.P.E (508752000)";"ASTRAZENECA-PRODUTOS FARMACÊUTICOS,LDA. (502942240)";"84.249,66 €";29-12-2020;07-10-2020;60 dias;Portugal;Artigo 259.º do Código dos Contratos Públicos;;;;;;;2969238;"CP 2017/6 - Acordo Quadro para fornecimento de Medicamentos do Foro Oncológico e Imunomoduladores, às Instituições e Serviços do Serviço Nacional de Saúde";true;https://community.vortal.biz/PRODPublic/Tendering/OpportunityDetail/Index?noticeUID=PT1.NTC.1256247;false;;;Código dos Contratos Públicos ( DL 111-B/2017 );false;false;
Aquisição de reagentes diagnóstico de meningites e encefalites com colocação de equipamento;Concurso público;Aquisição de bens móveis;33696500-0;Principal;Reagentes de laboratório;84000.0 € ;"Unidade Local de Saúde da Guarda, E. P. E. (508752000)";BIOMERIEUX PORTUGAL (501524177);"84.000,00 €";02-02-2022;24-11-2021;1095 dias;"Portugal, Guarda, Guarda";"Artigo 20.º, n.º 1, alínea b) do Código dos Contratos Públicos";;;;;;;Não aplicável.;Não aplicável.;false;https://community.vortal.biz/PRODPublic/Tendering/OpportunityDetail/Index?noticeUID=PT1.NTC.1637384;false;;;"Código dos Contratos Públicos (DL111-B/2017) e Lei n.º 30/2021, de 21.05";false;false;
"Aquisição de material de incontinencia, proteção cutanea e alivio de pressão CPA2021/25";Ao abrigo de acordo-quadro (art.º 259.º);Aquisição de bens móveis;33700000-7;Principal;Produtos para cuidados pessoais;83860.0 € ;"Unidade Local de Saúde da Guarda, E. P. E. (508752000)";"ALBINO DIAS DE ANDRADE, LDA (500013810)";"83.860,00 €";23-03-2022;23-03-2022;365 dias;Portugal;Artigo 259.º do Código dos Contratos Públicos;;;;;;;5113050;"CP 2021-25: ACORDO QUADRO PARA FORNECIMENTO DE MATERIAL DE INCONTINÊNCIA, PROTEÇÃO CUTÂNEA E ALÍVIO DE PRESSÃO, PARA AS INSTITUIÇÕES E SERVIÇOS DO SNS";false;https://community.vortal.biz/PRODPublic/Tendering/OpportunityDetail/Index?noticeUID=PT1.NTC.1737390;false;;;"Código dos Contratos Públicos (DL111-B/2017) e Lei n.º 30/2021, de 21.05";false;false;
Concurso Público com publicação de anúncio no Jornal Oficial da União Europeia | JOUE para aquisição de Licenciamento de Software Microsoft e Serviços Conexos para as Entidades do SNS e Ministério da Saúde.;Concurso público;Aquisição de bens móveis;48200000-0;Principal;"Pacote de software para ligações em rede, Internet e intranet";83759.76 € ;"Unidade Local de Saúde da Guarda, E. P. E. (508752000)";"Crayon Software Licensing, Unipessoal, Lda. (513246290)";"83.759,76 €";31-07-2024;27-05-2024;307 dias;"Portugal, Guarda, Guarda";"Artigo 20.º, n.º 1, alínea a) do Código dos Contratos Públicos";;;;;;;Não aplicável.;Não aplicável.;true;https://community.vortal.biz/PRODPublic/Tendering/OpportunityDetail/Index?noticeUID=PT1.NTC.2831150;false;;;"Código dos Contratos Públicos (DL111-B/2017) e Lei n.º 30/2021, de 21.05";false;false;
P259-2021-055 - Aquisição de vacinas para cumprimento do Programa Nacional de Vacinação 2021;Ao abrigo de acordo-quadro (art.º 259.º);Aquisição de bens móveis;33600000-6;Principal;Produtos farmacêuticos;83638.44 € ;"UNIDADE LOCAL DE SAÚDE DA GUARDA, E.P.E (508752000)";"GLAXOSMITHKLINE-PROD. FARMACÊUTICOS, LDA. (500139962)";"83.638,44 €";02-08-2021;24-05-2021;212 dias;Portugal;Artigo 259.º do Código dos Contratos Públicos;;;;;;;3957155;"CP 2019/13 - Vacinas do PNV e outras, e Tuberculinas do PN para a Tuberculose";true;https://community.vortal.biz/PRODPublic/Tendering/OpportunityDetail/Index?noticeUID=PT1.NTC.1512869;false;;;Código dos Contratos Públicos ( DL 111-B/2017 );false;false;
Aquisição de um Intensificador de Imagem para a Unidade de  Cirurgia de Ambulatório do Hospital Nossa Senhora d'Assunção;Concurso público;Aquisição de bens móveis;24931260-9;Principal;Intensificadores de imagem;83000.0 € ;"Unidade Local de Saúde da Guarda, E. P. E. (508752000)";"PHILIPS PORTUGUESA, S.A. (500216843)";"83.000,00 €";28-03-2022;15-02-2022;30 dias;"Portugal, Guarda, Guarda";"Artigo 20.º, n.º 1, alínea b) do Código dos Contratos Públicos";;;;;;;Não aplicável.;Não aplicável.;false;https://community.vortal.biz/PRODPublic/Tendering/OpportunityDetail/Index?noticeUID=PT1.NTC.1755945;false;;;"Código dos Contratos Públicos (DL111-B/2017) e Lei n.º 30/2021, de 21.05";false;false;
Aquisição de medicamentos de fornecimento/distribuição exclusiva do laboratório Baxter;Ajuste Direto Regime Geral;Aquisição de bens móveis;33600000-6;Principal;Produtos farmacêuticos;82800.0 € ;"Unidade Local de Saúde da Guarda, E. P. E. (508752000)";Baxter Med-Farm. Lda (503347345);"82.800,00 €";06-04-2021;11-02-2021;300 dias;Portugal;"Artigo 24.º, n.º 1, alínea e), subalínea iii) do Código dos Contratos Públicos";;;;;;;Não aplicável.;Não aplicável.;false;https://community.vortal.biz/PRODPublic/Tendering/OpportunityDetail/Index?noticeUID=PT1.NTC.1406842;false;;;Código dos Contratos Públicos ( DL 111-B/2017 );false;false;
Medicamentos Diversos (CPA 2019/55);Ao abrigo de acordo-quadro (art.º 259.º);Aquisição de bens móveis;33600000-6;Principal;Produtos farmacêuticos;82328.0 € ;"UNIDADE LOCAL DE SAÚDE DA GUARDA, E.P.E (508752000)";Roche (500233810);"82.328,00 €";27-02-2021;26-11-2020;365 dias;Portugal;Artigo 259.º do Código dos Contratos Públicos;;;;;;;4308617;CP 2019/55 - Medicamentos diversos;false;https://community.vortal.biz/PRODPublic/Tendering/OpportunityDetail/Index?noticeUID=PT1.NTC.1284245;false;;;Código dos Contratos Públicos ( DL 111-B/2017 );false;false;
P259-2019-236 - CONVITE À APRESENTAÇÃO DE PROPOSTA AO ABRIGO DO ACORDO QUADRO 2018/6 PARA AS INSTITUIÇÕES DO SERVIÇO NACIONAL DE SAÚDE;Ao abrigo de acordo-quadro (art.º 259.º);Aquisição de bens móveis;33600000-6;Principal;Produtos farmacêuticos;82270.0 € ;"Unidade Local de Saúde da Guarda, E. P. E. (508752000)";OM PHARMA S.A (500207410);"82.270,00 €";20-12-2019;13-12-2019;360 dias;Portugal;Artigo 259.º do Código dos Contratos Públicos;;;;;;;2489595;CP 2016/18 - Acordo quadro para fornecimento de Medicamentos do Grupo 4: Sangue às Instituições e Serviços do Serviço Nacional de Saúde;true;;false;;;Código dos Contratos Públicos ( DL 111-B/2017 );false;false;
"CPA 2023/306 - Corretivos da volémia, soluções para conservação de órgãos, hemodiálise, hemofiltraçã";Ao abrigo de acordo-quadro (art.º 259.º);Aquisição de bens móveis;33600000-6;Principal;Produtos farmacêuticos;82085.0 € ;"UNIDADE LOCAL DE SAÚDE DA GUARDA, E.P.E (508752000)";"Overpharma, Produtos Médicos e Farmacêuticos, Lda. (505792362)";"82.085,00 €";19-02-2024;14-02-2024;365 dias;"Portugal, Guarda, Guarda";Artigo 259.º do Código dos Contratos Públicos;;;;;;;6268838;"306/2023 - Acordo Quadro para fornecimento de corretivos da volémia, soluções para conservação de órgãos, hemodiálise, hemofiltração e outras soluções estéreis, na área da saúde";false;https://community.vortal.biz/PRODPublic/Tendering/OpportunityDetail/Index?noticeUID=PT1.NTC.2712048;false;;;Código dos Contratos Públicos (DL 18/2008);false;false;
Aquisição ao abrigo do AQ 2019/13 para as instituições do SNS;Ao abrigo de acordo-quadro (art.º 259.º);Aquisição de bens móveis;33600000-6;Principal;Produtos farmacêuticos;81900.0 € ;"Unidade Local de Saúde da Guarda, E. P. E. (508752000)";"MYLAN, LDA. (502248793)";"81.900,00 €";11-07-2022;08-07-2022;184 dias;"Portugal, Lisboa, Lisboa";Artigo 259.º do Código dos Contratos Públicos;;;;;;;3957155;"CP 2019/13 - Vacinas do PNV e outras, e Tuberculinas do PN para a Tuberculose";true;https://community.vortal.biz/PRODPublic/Tendering/OpportunityDetail/Index?noticeUID=PT1.NTC.1939952;false;;;"Código dos Contratos Públicos (DL111-B/2017) e Lei n.º 30/2021, de 21.05";false;false;
"716/2023- Aquisição ao abrigo do(s) acordo(s)-quadro 2021/49, 2021/6, 2021/61 e 2022/40 para as Instituições do SNS";Ao abrigo de acordo-quadro (art.º 259.º);Aquisição de bens móveis;33600000-6;Principal;Produtos farmacêuticos;81625.28 € ;"UNIDADE LOCAL DE SAÚDE DA GUARDA, E.P.E (508752000)";"ASTRAZENECA - Produtos Farmaceuticos, Lda. (502942240)";"81.625,28 €";31-01-2024;14-12-2023;366 dias;"Portugal, Lisboa, Lisboa";Artigo 259.º do Código dos Contratos Públicos;;;;;;;5032541;CP 2021/6 - Medicamentos do foro oncológico e imunomoduladores;true;https://community.vortal.biz/PRODPublic/Tendering/OpportunityDetail/Index?noticeUID=PT1.NTC.2650258;false;;;"Código dos Contratos Públicos (DL111-B/2017) e Lei n.º 30/2021, de 21.05";false;false;
Fornecimento de Combustíveis Rodoviários para os Estabelecimentos e Serviços do SNS 2019;Concurso público;Aquisição de bens móveis;09100000-0;Principal;Combustíveis;80802.05 € ;"UNIDADE LOCAL DE SAÚDE DA GUARDA, E.P.E (508752000)";" Petrogal, S.A. (500697370)";"80.802,05 €";27-03-2019;11-12-2018;365 dias;Portugal;"Artigo 20.º, n.º 1, alínea a) do Código dos Contratos Públicos";;;;;;;Não aplicável.;Não aplicável.;true;;false;;;Código dos Contratos Públicos ( DL 111-B/2017 );false;false;
AQUISIÇÃO DE HARDWARE DE SUPORTE DO INTEGRADOR AIDA - SAMA 2020;Concurso público;Aquisição de bens móveis;48822000-6;Principal;Servidores informáticos;80778.03 € ;"UNIDADE LOCAL DE SAÚDE DA GUARDA, E.P.E (508752000)";"Divultec - Serviços de Informática, Lda (508453259)";"80.778,03 €";02-07-2020;04-04-2019;30 dias;Portugal;"Artigo 20.º, n.º 1, alínea b) do Código dos Contratos Públicos";;;;;;;Não aplicável.;Não aplicável.;false;;false;;;Código dos Contratos Públicos ( DL 111-B/2017 );false;false;
Serviços de Lavandaria e Tratamento de Roupa para o ano 2016;Ajuste Direto Regime Geral;Aquisição de serviços;98311000-6;Principal;Serviços de recolha de roupa por lavandarias;80624.88 € ;"Unidade Local de Saúde da Guarda, E. P. E. (508752000)";Such - Serv. Utiliz. Comuns Hospitais (500900469);"80.624,88 €";14-11-2016;21-06-2016;365 dias;"Portugal, Guarda, Guarda";"Artigo 27.º, n.º 1, alínea a) do Código dos Contratos Públicos";;;;;;;Não aplicável.;Não aplicável.;false;;false;;;Código dos Contratos Públicos (DL 18/2008);false;false;
"AD-2021-025- AJUSTE DIRETO PARA A AQUISIÇÃO DE BENS PARA SUPRIR NECESSIDADES, PARA AS INSTITUIÇÕES DO SNS";Ajuste Direto Regime Geral;Aquisição de bens móveis;33600000-6;Principal;Produtos farmacêuticos;80006.26 € ;"Unidade Local de Saúde da Guarda, E. P. E. (508752000)";"Sanofi - Produtos Farmacêuticos, Lda (500134960)";"80.006,26 €";30-07-2021;24-05-2021;213 dias;Portugal;"Artigo 24.º, n.º 1, alínea e), subalínea ii) do Código dos Contratos Públicos";;;;;;;Não aplicável.;Não aplicável.;true;https://community.vortal.biz/PRODPublic/Tendering/OpportunityDetail/Index?noticeUID=PT1.NTC.1512887;false;;;Código dos Contratos Públicos ( DL 111-B/2017 );false;false;
Aquisição de 1 ecógrafo para estudos em Obstetrícia e diagnóstico pré-natal para a Unidade Local de Saúde da Guarda. E.P.E.;Concurso público;Aquisição de bens móveis;33100000-1;Principal;Equipamento médico;80000.0 € ;"Unidade Local de Saúde da Guarda, E. P. E. (508752000)";Canon Medical (980023700);"80.000,00 €";16-01-2024;15-01-2024;30 dias;"Portugal, Guarda, Guarda";"Artigo 20.º, n.º 1, alínea b) do Código dos Contratos Públicos";;;;;;;Não aplicável.;Não aplicável.;false;https://community.vortal.biz/PRODPublic/Tendering/OpportunityDetail/Index?noticeUID=PT1.NTC.2670277;false;;;"Código dos Contratos Públicos (DL111-B/2017) e Lei n.º 30/2021, de 21.05";false;false;
Aquisição de Serviços de Lavandaria e Tratamento de Roupa para o ano 2019;Consulta Prévia;Aquisição de serviços;98311000-6;Principal;Serviços de recolha de roupa por lavandarias;79999.42 € ;"UNIDADE LOCAL DE SAÚDE DA GUARDA, E.P.E (508752000)";SUCH | Serviço de Utilização Comum dos Hospitais (500900469);"79.999,42 €";06-02-2019;28-01-2019;365 dias;Portugal;Artigo 27.º-A do Código dos Contratos Públicos;;;;;;;Não aplicável.;Não aplicável.;false;;false;;;Código dos Contratos Públicos ( DL 111-B/2017 );true;false;
Aquisição de Serviços de Lavandaria e Tratamento de Roupa para o ano 2018;Ajuste Direto Regime Geral;Aquisição de serviços;98311000-6;Principal;Serviços de recolha de roupa por lavandarias;79999.42 € ;"UNIDADE LOCAL DE SAÚDE DA GUARDA, E.P.E (508752000)";Serviço de Utilização Comum dos Hospitais (500900469);"79.999,42 €";16-02-2018;30-01-2018;365 dias;"Portugal, Guarda, Seia<BR/>Portugal, Guarda, Gouveia";"Artigo 27.º, n.º 1, alínea a) do Código dos Contratos Públicos";;;;;;;Não aplicável.;Não aplicável.;false;;false;;;Código dos Contratos Públicos (DL 18/2008);false;false;
"Aquisição de Serviços de Lavandaria e Tratamento de Roupa Hospitalar para a Unidade Local de Saúde da Guarda, E.P.E. para o ano 2017";Concurso público;Aquisição de serviços;98310000-9;Principal;Serviços de lavagem e de limpeza a seco;79999.42 € ;"Unidade Local de Saúde da Guarda, E. P. E. (508752000)";Serviço de Utilização Comum dos Hospitais (500900469);"79.999,42 €";04-04-2017;13-03-2017;365 dias;"Portugal, Guarda, Guarda";"Artigo 20.º, n.º 1, alínea b) do Código dos Contratos Públicos";;;;;;;Não aplicável.;Não aplicável.;false;;false;;;Código dos Contratos Públicos (DL 18/2008);false;false;
"P259-2020-055 - Convite à Apresentação de proposta ao abrigo dos AQ 2017/6, 2018/55, 2018/7 para as Instituições e Serviços do SNS";Ao abrigo de acordo-quadro (art.º 259.º);Aquisição de bens móveis;33100000-1;Principal;Equipamento médico;79833.6 € ;"Unidade Local de Saúde da Guarda, E. P. E. (508752000)";"Janssen Cilag Farmacêutica, Lda (500189412)";"79.833,60 €";28-05-2020;27-04-2020;90 dias;Portugal;Artigo 259.º do Código dos Contratos Públicos;;;;;;;2969238;"CP 2017/6 - Acordo Quadro para fornecimento de Medicamentos do Foro Oncológico e Imunomoduladores, às Instituições e Serviços do Serviço Nacional de Saúde";true;https://community.vortal.biz/PRODPublic/Tendering/OpportunityDetail/Index?noticeUID=PT1.NTC.1140446;false;;;Código dos Contratos Públicos ( DL 111-B/2017 );false;false;
51/55/2023- CPA 2019/55 - Medicamentos Diversos II;Ao abrigo de acordo-quadro (art.º 259.º);Aquisição de bens móveis;33600000-6;Principal;Produtos farmacêuticos;79748.48 € ;"Unidade Local de Saúde da Guarda, E. P. E. (508752000)";"JANSSEN - CILAG FARMACÊUTICA, LDA. (500189412)";"79.748,48 €";26-12-2022;14-12-2022;365 dias;"Portugal, Guarda, Guarda";Artigo 259.º do Código dos Contratos Públicos;;;;;;;4308617;CP 2019/55 - Medicamentos diversos;false;https://community.vortal.biz/PRODPublic/Tendering/OpportunityDetail/Index?noticeUID=PT1.NTC.2099870;false;;;"Código dos Contratos Públicos (DL111-B/2017) e Lei n.º 30/2021, de 21.05";false;false;
"P259-2021-127 - Convite ao abrigo do(s) acordo(s)-quadro 2019/40 (Medicamentos antirretrovíricos para o tratamento da infeção por VIH), 2019/55 (Medicamentos Diversos), 2020/1 (Medicamentos do Aparelh";Ao abrigo de acordo-quadro (art.º 259.º);Aquisição de bens móveis;33600000-6;Principal;Produtos farmacêuticos;79737.99 € ;"UNIDADE LOCAL DE SAÚDE DA GUARDA, E.P.E (508752000)";"ALLOGA LOGIFARMA, S.A. (503934640)";"79.737,99 €";17-02-2022;11-02-2022;334 dias;Portugal;Artigo 259.º do Código dos Contratos Públicos;;;;;;;5032541;CP 2021/6 - Medicamentos do foro oncológico e imunomoduladores;true;https://community.vortal.biz/PRODPublic/Tendering/OpportunityDetail/Index?noticeUID=PT1.NTC.1778864;false;;;"Código dos Contratos Públicos (DL111-B/2017) e Lei n.º 30/2021, de 21.05";false;false;
Fornecimento de reagentes de Alergologia com duração de 6  Meses;Ajuste Direto Regime Geral;Aquisição de bens móveis;33696500-0;Principal;Reagentes de laboratório;78900.81 € ;"Unidade Local de Saúde da Guarda, E. P. E. (508752000)";THERMO FISHER DIAGNOSTICS (506916243);"78.900,81 €";12-07-2023;11-07-2023;184 dias;"Portugal, Guarda, Guarda";"Artigo 24.º, n.º 1, alínea e), subalínea iii) do Código dos Contratos Públicos";;;;;;;Não aplicável.;Não aplicável.;false;https://community.vortal.biz/PRODPublic/Tendering/OpportunityDetail/Index?noticeUID=PT1.NTC.2443875;false;;;"Código dos Contratos Públicos (DL111-B/2017) e Lei n.º 30/2021, de 21.05";false;false;
51/19/2023 - CPA 2022/19 Medicamentos antipsicóticos  ;Ao abrigo de acordo-quadro (art.º 259.º);Aquisição de bens móveis;33600000-6;Principal;Produtos farmacêuticos;78730.22 € ;"UNIDADE LOCAL DE SAÚDE DA GUARDA, E.P.E (508752000)";"JANSSEN CILAG FARMACEUTICA, LDA. (500189412)";"78.730,22 €";17-03-2023;26-01-2023;365 dias;"Portugal, Guarda, Guarda";Artigo 259.º do Código dos Contratos Públicos;;;;;;;5880340;"CP 2022/19 - Medicamentos antipsicóticos, anestésicos e relaxantes musculares";false;https://community.vortal.biz/PRODPublic/Tendering/OpportunityDetail/Index?noticeUID=PT1.NTC.2206052;false;;;"Código dos Contratos Públicos (DL111-B/2017) e Lei n.º 30/2021, de 21.05";false;false;
Aquisição de combustíveis rodoviários ao abrigo de acordo quadro em vigor na ESPAP para as Entidades do Ministério da Saúde;Ao abrigo de acordo-quadro (art.º 259.º);Aquisição de bens móveis;09130000-9;Principal;Petróleo e destilados;78681.7 € ;"Unidade Local de Saúde da Guarda, E. P. E. (508752000)";"Petrogal, S.A. (500697370)";"78.681,70 €";24-02-2022;29-12-2021;365 dias;"Portugal, Guarda";Artigo 259.º do Código dos Contratos Públicos;;;;;;;3742486;Acordo Quadro de fornecimento de combustíveis rodoviários AQ-CR 2018;true;https://plataforma-sncp.espap.gov.pt/espap/faces/app/pap/listaDocs.jsp?papId=2149;false;;;Código dos Contratos Públicos ( DL 111-B/2017 );false;false;
