"Convite à apresentação de propostas ao abrigo do(s) acordo(s)-quadro 2021/047 – Medicamentos do aparelho locomotor, usados no tratamento de doenças endócrinas e hormonas 2023/436 – Medicamentos para o";Ao abrigo de acordo-quadro (art.º 259.º);Aquisição de bens móveis;33600000-6;Principal;Produtos farmacêuticos;222608.1 € ;"HOSPITAL PROFESSOR DOUTOR FERNANDO FONSECA, EPE (503035416)";"EISAI FARMACÊUTICA, Unipessoal Lda. (507847660)";"222.608,10 €";17-03-2024;14-03-2024;289 dias;"Portugal, Lisboa, Amadora";Artigo 259.º do Código dos Contratos Públicos;;;;;;;6677696;491/2023 - Concurso público internacional para formação do acordo quadro de medicamentos do foro oncológico e imunomoduladores;true;https://community.vortal.biz/PRODPublic/Tendering/OpportunityDetail/Index?noticeUID=PT1.NTC.2727046;false;;;"Código dos Contratos Públicos (DL111-B/2017) e Lei n.º 30/2021, de 21.05";false;false;
"CONVITE AO ABRIGO DO(S) ACORDO(S) QUADRO 2017/6, 2018/7 e 2019/61 PARA AS INSTITUIÇÕES DO SNS";Ao abrigo de acordo-quadro (art.º 259.º);Aquisição de bens móveis;33600000-6;Principal;Produtos farmacêuticos;222563.1 € ;Hospital Prof. Doutor Fernando Fonseca E.P.E. (503035416);"MERCK, SA (500650870)";"222.563,10 €";19-02-2021;10-02-2021;315 dias;"Portugal, Lisboa, Amadora";Artigo 259.º do Código dos Contratos Públicos;;;;;;;2969238;"CP 2017/6 - Acordo Quadro para fornecimento de Medicamentos do Foro Oncológico e Imunomoduladores, às Instituições e Serviços do Serviço Nacional de Saúde";true;https://community.vortal.biz/PRODPublic/Tendering/OpportunityDetail/Index?noticeUID=PT1.NTC.1377759;false;;;Código dos Contratos Públicos ( DL 111-B/2017 );false;false;
Manutenção aos Equipamentos de Imagem e Diagnóstico;Ajuste Direto Regime Geral;Aquisição de serviços;50000000-5;Principal;Serviços de reparação e manutenção;222554.28 € ;Hospital Prof. Doutor Fernando Fonseca E.P.E. (503035416);"Olympus Iberia S.A.U, Sucursal em Portugal (980474710)";"222.554,28 €";21-07-2023;27-02-2023;366 dias;"Portugal, Lisboa, Amadora";"Artigo 24.º, n.º 1, alínea e), subalínea iii) do Código dos Contratos Públicos";;;;;;;Não aplicável.;Não aplicável.;false;https://gov.saphety.com/bizgov/econcursos/procedurePiecesExport_240391!exportProcedure.action;false;;;Código dos Contratos Públicos ( DL 111-B/2017 );false;false;
"Daclastavir, Oral, 60 MG, Comprimido";Ajuste Direto Regime Geral;Aquisição de bens móveis;33600000-6;Principal;Produtos farmacêuticos;221883.77 € ;"Hospital Professor Doutor Fernando Fonseca, E. P. E. (503035416)";Bristol-Myers Squibb Farmacêutica Portuguesa. S.A. (500048193);"221.883,77 €";07-10-2016;28-09-2016;94 dias;"Portugal, Lisboa, Amadora";"Artigo 20.º, n.º 1, alínea a) do Código dos Contratos Públicos";;;;;;;Não aplicável.;Não aplicável.;false;;false;;;Código dos Contratos Públicos (DL 18/2008);false;false;
"Convite ao abrigo do(s) acordo(s)-quadro 2019/55, 2020/1, 2020/61, 2021/6, 2021/12, 2021/61, 2022/40, 2022/55, para suprir necessidades na área da saúde.";Ao abrigo de acordo-quadro (art.º 259.º);Aquisição de bens móveis;33600000-6;Principal;Produtos farmacêuticos;216415.6 € ;Hospital Prof. Doutor Fernando Fonseca E.P.E. (503035416);MERCK SHARP DOHME (500191360);"216.415,60 €";20-03-2023;12-01-2023;364 dias;"Portugal, Lisboa, Amadora";Artigo 259.º do Código dos Contratos Públicos;;;;;;;5032541;CP 2021/6 - Medicamentos do foro oncológico e imunomoduladores;true;https://community.vortal.biz/PRODPublic/Tendering/OpportunityDetail/Index?noticeUID=PT1.NTC.2155663;false;;;"Código dos Contratos Públicos (DL111-B/2017) e Lei n.º 30/2021, de 21.05";false;false;
"Aquisição de Medicamentos do aparelho respiratório, ao abrigo do CPA 2021/012, para o HFF, para o ano 2024";Ao abrigo de acordo-quadro (art.º 259.º);Aquisição de bens móveis;33600000-6;Principal;Produtos farmacêuticos;215929.8 € ;"Hospital Professor Doutor Fernando Fonseca, E. P. E. (503035416)";"NOVARTIS FARMA - PRODUTOS FARMACÊUTICOS, S.A. (500063524)";"215.929,80 €";23-01-2024;23-01-2024;343 dias;"Portugal, Lisboa, Amadora";Artigo 259.º do Código dos Contratos Públicos;;;;;;;5500952;CP 2021/12 - Medicamentos do aparelho respiratório;false;https://community.vortal.biz/PRODPublic/Tendering/OpportunityDetail/Index?noticeUID=PT1.NTC.2699270;false;;;"Código dos Contratos Públicos (DL111-B/2017) e Lei n.º 30/2021, de 21.05";false;false;
Aquisição de Corretivos de Volémia e Outras Soluções Estéreis ao abrigo do AQ 2014/3 - 2017;Ao abrigo de acordo-quadro (art.º 259.º);Aquisição de bens móveis;33600000-6;Principal;Produtos farmacêuticos;215713.01 € ;"Hospital Professor Doutor Fernando Fonseca, E. P. E. (503035416)";"B. Braun Medical, Lda. (501506543)";"215.713,01 €";24-01-2018;02-05-2017;243 dias;"Portugal, Lisboa, Amadora";Artigo 259.º do Código dos Contratos Públicos;;;;;;;1331181;Acordo Quadro para fornecimento de corretivos da volémia e outras soluções estéreis às Instituições e Serviços do Serviço Nacional de Saúde;false;;false;;;Código dos Contratos Públicos (DL 18/2008);false;false;
"Convite à apresentação de propostas ao abrigo do(s) acordo(s)-quadro 2021/33 – Cardioversores Desfibrilhadores Implantáveis e Pacemakers, para aquisição de Cardioversores Desfibrilhadores Implantáveis";Ao abrigo de acordo-quadro (art.º 259.º);Aquisição de bens móveis;33698000-9;Principal;Produtos para fins clínicos;215502.2 € ;"HOSPITAL PROFESSOR DOUTOR FERNANDO FONSECA, EPE (503035416)";Abbott Medical (504180746);"215.502,20 €";29-04-2024;27-03-2024;305 dias;"Portugal, Lisboa, Amadora";Artigo 259.º do Código dos Contratos Públicos;;;;;;;5354504;CP 2021/33 Acordo Quadro para fornecimento de Cardioversores Desfibrilhadores Implantáveis e Pacemakers na área da Saúde;true;https://community.vortal.biz/PRODPublic/Tendering/OpportunityDetail/Index?noticeUID=PT1.NTC.2769645;false;;;"Código dos Contratos Públicos (DL111-B/2017) e Lei n.º 30/2021, de 21.05";false;false;
"Aquisição de Gases Medicinais, ao Lab. Nippon Gases, para a ULSASI, para o ano 2024";Ajuste Direto Regime Geral;Aquisição de bens móveis;33600000-6;Principal;Produtos farmacêuticos;215425.58 € ;"Hospital Professor Doutor Fernando Fonseca, E. P. E. (503035416)";"NIPPON GASES PORTUGAL - UNIPESSOAL, LDA. (501738916)";"215.425,58 €";24-04-2024;23-04-2024;91 dias;"Portugal, Lisboa, Amadora";"Artigo 24.º, n.º 1, alínea e), subalínea ii) do Código dos Contratos Públicos";;;;;;;Não aplicável.;Não aplicável.;false;;false;;;Código dos Contratos Públicos ( DL 111-B/2017 );true;false;
Aquisição de serviços de desenvolvimento do business intelligence -  SAMA 2020 - CRD POCI-05-5762-FSE-000115 no HFF;Concurso público;Aquisição de serviços;72000000-5;Principal;"Serviços de TI: consultoria, desenvolvimento de software, Internet e apoio";213500.0 € ;"Hospital Professor Doutor Fernando Fonseca, E. P. E. (503035416)";"PROLOGICA - SISTEMAS INFORMATICOS, SA (501432507)";"213.500,00 €";23-07-2021;23-07-2021;304 dias;"Portugal, Lisboa, Amadora";"Artigo 20.º, n.º 1, alínea a) do Código dos Contratos Públicos";;;;;;;Não aplicável.;Não aplicável.;false;https://gov.saphety.com/bizgov/econcursos/procedurePiecesExport_203289!exportProcedure.action;false;;;Código dos Contratos Públicos ( DL 111-B/2017 );false;false;
"FINGOLIMOD [0,5 MG; CÁP/COMP] e INTERFERÃO BETA-1B [8 M.U.I./ML; 1,2 ML; PÓ SOL INJ; FRS]";Ao abrigo de acordo-quadro (art.º 259.º);Aquisição de bens móveis;33600000-6;Principal;Produtos farmacêuticos;213109.23 € ;"Hospital Professor Doutor Fernando Fonseca, E. P. E. (503035416)";"Novartis Farma, S.A. (500223076)";"213.109,23 €";25-11-2016;25-11-2016;36 dias;"Portugal, Lisboa, Amadora";Artigo 259.º do Código dos Contratos Públicos;;;;;;;1771819;CP 2015/6 - Acordo quadro para o fornecimento de Medicamentos do Foro Oncológico;false;;false;;;Código dos Contratos Públicos (DL 18/2008);false;false;
Convite à apresentação de propostas ao abrigo do(s) acordo(s)-quadro 2022/13 (vacinas e tuberculinas) para aquisição de vacinas.;Ao abrigo de acordo-quadro (art.º 259.º);Aquisição de bens móveis;33600000-6;Principal;Produtos farmacêuticos;210706.5 € ;"HOSPITAL PROFESSOR DOUTOR FERNANDO FONSECA, EPE (503035416)";"SANOFI - PROD. FARMACÊUTICOS, LDA. (500134960)";"210.706,50 €";25-03-2024;21-03-2024;337 dias;"Portugal, Lisboa, Amadora";Artigo 259.º do Código dos Contratos Públicos;;;;;;;5839055;CP 2022/13 - Vacinas e tuberculinas;true;https://community.vortal.biz/PRODPublic/Tendering/OpportunityDetail/Index?noticeUID=PT1.NTC.2765990;false;;;"Código dos Contratos Públicos (DL111-B/2017) e Lei n.º 30/2021, de 21.05";false;false;
"Aquisição de Imunoglobulina Humana 50ml, 100ml e 200ml, ao Lab. Kedrion, para a ULSASI, para o ano 2024";Ajuste Direto Regime Geral;Aquisição de bens móveis;33600000-6;Principal;Produtos farmacêuticos;209000.0 € ;"HOSPITAL PROFESSOR DOUTOR FERNANDO FONSECA, EPE (503035416)";Kedrion Biopharma Gmbh - Sucursal Em Portugal (980701996);"209.000,00 €";20-05-2024;20-05-2024;60 dias;"Portugal, Lisboa, Amadora";"Artigo 24.º, n.º 1, alínea e), subalínea ii) do Código dos Contratos Públicos";;;;;;;Não aplicável.;Não aplicável.;false;https://community.vortal.biz/PRODPublic/Tendering/OpportunityDetail/Index?noticeUID=PT1.NTC.2869745;false;;;"Código dos Contratos Públicos (DL111-B/2017) e Lei n.º 30/2021, de 21.05";false;false;
Convite à apresentação de propostas ao abrigo do(s) acordo(s)-quadro 2022/13 (vacinas e tuberculinas) para aquisição de vacinas.;Ao abrigo de acordo-quadro (art.º 259.º);Aquisição de bens móveis;33600000-6;Principal;Produtos farmacêuticos;208250.0 € ;"HOSPITAL PROFESSOR DOUTOR FERNANDO FONSECA, EPE (503035416)";"Laboratório Pfizer, Lda. (500162166)";"208.250,00 €";07-08-2024;09-05-2024;235 dias;"Portugal, Lisboa, Amadora";Artigo 259.º do Código dos Contratos Públicos;;;;;;;5839055;CP 2022/13 - Vacinas e tuberculinas;true;https://community.vortal.biz/PRODPublic/Tendering/OpportunityDetail/Index?noticeUID=PT1.NTC.2864679;false;;;"Código dos Contratos Públicos (DL111-B/2017) e Lei n.º 30/2021, de 21.05";false;false;
Medicamentos de Foro Oncológico;Ao abrigo de acordo-quadro (art.º 259.º);Aquisição de bens móveis;33600000-6;Principal;Produtos farmacêuticos;207847.52 € ;"Hospital Professor Doutor Fernando Fonseca, E. P. E. (503035416)";"Biogen Portugal, Lda. (506415740)";"207.847,52 €";26-10-2016;04-10-2016;88 dias;"Portugal, Lisboa, Amadora";Artigo 259.º do Código dos Contratos Públicos;;;;;;;1771819;CP 2015/6 - Acordo quadro para o fornecimento de Medicamentos do Foro Oncológico;false;;false;;;Código dos Contratos Públicos (DL 18/2008);false;false;
"23/ADCM/2021 - Aquisição de serviços de manutenção aos Equipamentos de Imagem e Diagnostico, para o ano 2021";Ajuste Direto Regime Geral;Aquisição de serviços;50421200-4;Principal;Serviços de reparação e manutenção de equipamentos de raios X;207808.3 € ;"Hospital Professor Doutor Fernando Fonseca, E. P. E. (503035416)";Olympus (980474710);"207.808,30 €";04-05-2021;17-04-2021;365 dias;"Portugal, Lisboa, Amadora";"Artigo 24.º, n.º 1, alínea e), subalínea iii) do Código dos Contratos Públicos";;;;;;;Não aplicável.;Não aplicável.;false;https://gov.saphety.com/bizgov/econcursos/procedurePiecesExport_205443!exportProcedure.action;false;;;Código dos Contratos Públicos ( DL 111-B/2017 );false;false;
"Aquisição de Medicamentos do Aparelho Respiratório, ao abrigo do CPA 2018/12, para o HFF, para o ano 2022, II";Ao abrigo de acordo-quadro (art.º 259.º);Aquisição de bens móveis;33600000-6;Principal;Produtos farmacêuticos;207719.2 € ;"HOSPITAL PROFESSOR DOUTOR FERNANDO FONSECA, EPE (503035416)";"GLAXOSMITHKLINE-PROD. FARMACÊUTICOS, LDA. (500139962)";"207.719,20 €";29-06-2022;20-12-2021;364 dias;"Portugal, Lisboa, Amadora";Artigo 259.º do Código dos Contratos Públicos;;;;;;;3583388;CP 2018/12;false;https://community.vortal.biz/PRODPublic/Tendering/OpportunityDetail/Index?noticeUID=PT1.NTC.1725781;false;;;"Código dos Contratos Públicos (DL111-B/2017) e Lei n.º 30/2021, de 21.05";false;false;
"Aquisição de Batas de Proteção, no âmbito do COVID-19 para o Hospital Prof. Dr. Fernando Fonseca, EPE para o ano 2020.";Ajuste Direto Regime Geral;Aquisição de bens móveis;33698000-9;Principal;Produtos para fins clínicos;207000.0 € ;"Hospital Professor Doutor Fernando Fonseca, E. P. E. (503035416)";"Desafios em Sintonia Unipessoal, Lda (513589910)";"207.000,00 €";10-11-2020;09-11-2020;3 dias;"Portugal, Lisboa, Amadora";"Artigo 24.º, n.º 1, alínea c) do Código dos Contratos Públicos";;;;;;;Não aplicável.;Não aplicável.;false;;false;;;Código dos Contratos Públicos ( DL 111-B/2017 );true;false;
"Aquisição de Meios de diagnóstico - imagiologia ao abrigo do CPA 2019/56, para o ano 2021";Ao abrigo de acordo-quadro (art.º 259.º);Aquisição de bens móveis;33100000-1;Principal;Equipamento médico;206967.0 € ;"HOSPITAL PROFESSOR DOUTOR FERNANDO FONSECA, EPE (503035416)";"BAYER  PORTUGAL, LDA (500043256)";"206.967,00 €";09-08-2021;01-01-2021;364 dias;"Portugal, Lisboa, Amadora";Artigo 259.º do Código dos Contratos Públicos;;;;;;;3962524;CP 2019/56 - Meios de diagnóstico - imagiologia;false;https://community.vortal.biz/PRODPublic/Tendering/OpportunityDetail/Index?noticeUID=PT1.NTC.1319139;false;;;Código dos Contratos Públicos ( DL 111-B/2017 );false;false;
"P259-2021-127 - Convite ao abrigo do(s) acordo(s)-quadro 2019/40 (Medicamentos antirretrovíricos para o tratamento da infeção por VIH), 2019/55 (Medicamentos Diversos), 2020/1 (Medicamentos do Aparelh";Ao abrigo de acordo-quadro (art.º 259.º);Aquisição de bens móveis;33600000-6;Principal;Produtos farmacêuticos;205082.9 € ;"HOSPITAL PROFESSOR DOUTOR FERNANDO FONSECA, EPE (503035416)";GILEAD SCIENCES LDA. (503604704);"205.082,90 €";19-09-2022;23-02-2022;311 dias;"Portugal, Lisboa, Amadora";Artigo 259.º do Código dos Contratos Públicos;;;;;;;5032541;CP 2021/6 - Medicamentos do foro oncológico e imunomoduladores;true;https://community.vortal.biz/PRODPublic/Tendering/OpportunityDetail/Index?noticeUID=PT1.NTC.1778864;false;;;"Código dos Contratos Públicos (DL111-B/2017) e Lei n.º 30/2021, de 21.05";false;false;
"15D0705222 - AQUISIÇÃO DE EQUIPAMENTO DE RX COM AMPOLA DE TECTO PARA O SERVIÇO DE IMAGIOLOGIA ¿ URGENCIA GERAL SALA A, PARA O H.F.F,E.P.E.";Ajuste Direto Regime Geral;Aquisição de bens móveis;33100000-1;Principal;Equipamento médico;204800.0 € ;"Hospital Professor Doutor Fernando Fonseca, E. P. E. (503035416)";"SIEMENS HEALTHCARE, Unipessoal, LDA. (507925173)";"204.800,00 €";17-05-2023;12-04-2023;60 dias;"Portugal, Lisboa, Amadora";"Artigo 26.º, n.º 1, alínea a) do Código dos Contratos Públicos";;;;;;;Não aplicável.;Não aplicável.;false;https://gov.saphety.com/bizgov/econcursos/procedurePiecesExport_245166!exportProcedure.action;false;;;Código dos Contratos Públicos ( DL 111-B/2017 );false;false;
"15F0249521 - Aquisição e instalação de Sistema de Raios - X digital com coluna de tecto, com colimação automática e ""tracking vertical"" do movimento do potter vertical e mesa para as salas da Urgência Geral do Hospital Professor Doutor Fernando Fonseca, E.P.E.";Concurso público;Aquisição de bens móveis;33111600-7;Principal;Aparelhos de radiografia;204633.17 € ;"Hospital Professor Doutor Fernando Fonseca, E. P. E. (503035416)";"Siemens Healthcare, Unipessoal, Lda (507925173)";"204.633,17 €";24-06-2021;16-06-2021;60 dias;"Portugal, Lisboa, Amadora";"Artigo 20.º, n.º 1, alínea b) do Código dos Contratos Públicos";;;;;;;Não aplicável.;Não aplicável.;false;https://gov.saphety.com/bizgov/econcursos/procedurePiecesExport_206872!exportProcedure.action;false;;;Código dos Contratos Públicos ( DL 111-B/2017 );false;false;
Aquisição de Corretivos da Volémia e outras soluções estéreis para 2018 - Parte I ao abrigo do Acordo Quadro 2017/03;Ao abrigo de acordo-quadro (art.º 259.º);Aquisição de bens móveis;33600000-6;Principal;Produtos farmacêuticos;203944.49 € ;Hospital Prof. Doutor Fernando Fonseca E.P.E. (503035416);"B. Braun Medical, Lda. (501506543)";"203.944,49 €";24-01-2018;12-01-2018;353 dias;"Portugal, Lisboa, Amadora";Artigo 259.º do Código dos Contratos Públicos;;;;;;;2528675;CP 2017/3 - Acordo Quadro para fornecimento de corretivos da volémia e outras soluções estéreis ;false;;false;;;Código dos Contratos Públicos (DL 18/2008);false;false;
Aquisição de Medicamentos ao abrigo do CPA 2019/040;Ao abrigo de acordo-quadro (art.º 259.º);Aquisição de bens móveis;33600000-6;Principal;Produtos farmacêuticos;202357.2 € ;"HOSPITAL PROFESSOR DOUTOR FERNANDO FONSECA, EPE (503035416)";"GILEAD SCIENCES, LDA (503604704)";"202.357,20 €";28-07-2021;09-02-2021;62 dias;"Portugal, Lisboa, Amadora";Artigo 259.º do Código dos Contratos Públicos;;;;;;;4028557;CP 2019/40 - Medicamentos antirretrovíricos para o tratamento da infeção por VIH;false;https://community.vortal.biz/PRODPublic/Tendering/OpportunityDetail/Index?noticeUID=PT1.NTC.1380857;false;;;Código dos Contratos Públicos ( DL 111-B/2017 );false;false;
Sistemas de Cardioversores ;Concurso público;Aquisição de bens móveis;33182000-9;Principal;Material de assistência à função cardíaca;202000.0 € ;"HOSPITAL PROFESSOR DOUTOR FERNANDO FONSECA, EPE (503035416)";Abbott Medical (504180746);"202.000,00 €";06-04-2018;19-03-2018;287 dias;"Portugal, Lisboa, Amadora";"Artigo 20.º, n.º 1, alínea b) do Código dos Contratos Públicos";;;;;;;Não aplicável.;Não aplicável.;false;;false;;;Código dos Contratos Públicos (DL 18/2008);false;false;
Aquisição de Kit para Ablação por Crio Focal e Kit para CrioAblação focal com cateter Feezor;Ajuste Direto Regime Geral;Aquisição de bens móveis;33698000-9;Principal;Produtos para fins clínicos;202000.0 € ;"Hospital Professor Doutor Fernando Fonseca, E. P. E. (503035416)";"MEDTRONIC PORTUGAL, LDA. (504223933)";"202.000,00 €";18-03-2024;18-03-2024;120 dias;"Portugal, Lisboa, Amadora";"Artigo 24.º, n.º 1, alínea e), subalínea ii) do Código dos Contratos Públicos";;;;;;;Não aplicável.;Não aplicável.;false;https://community.vortal.biz/PRODPublic/Tendering/OpportunityDetail/Index?noticeUID=PT1.NTC.2708543;false;;;"Código dos Contratos Públicos (DL111-B/2017) e Lei n.º 30/2021, de 21.05";false;false;
"Aquisição de IMUNOGLOBULINA HUMANA, IV, 50MG/ML;200ML ao Laboratório Kedrion para o HFF para o ano 2022";Ajuste Direto Regime Geral;Aquisição de bens móveis;33600000-6;Principal;Produtos farmacêuticos;201600.0 € ;"Hospital Professor Doutor Fernando Fonseca, E. P. E. (503035416)";KEDRION BIOPHARMA GMBH- PORTUGAL (980701996);"201.600,00 €";17-08-2022;11-08-2022;153 dias;"Portugal, Lisboa, Amadora";"Artigo 24.º, n.º 1, alínea e), subalínea ii) do Código dos Contratos Públicos";;;;;;;Não aplicável.;Não aplicável.;false;https://gov.saphety.com/bizgov/econcursos/procedurePiecesExport_231563!exportProcedure.action;false;;;"Código dos Contratos Públicos (DL111-B/2017) e Lei n.º 30/2021, de 21.05";false;false;
Aquisição de Corretivos de Volémia e Outras Soluções Estéreis ao abrigo do AQ 2014/3 - 2017;Ao abrigo de acordo-quadro (art.º 259.º);Aquisição de bens móveis;33600000-6;Principal;Produtos farmacêuticos;201485.5 € ;"Hospital Professor Doutor Fernando Fonseca, E. P. E. (503035416)";"OVERPHARMA - PROD. MÉDICOS E FARMACÊUTICOS, LDA. (505792362)";"201.485,50 €";24-01-2018;02-05-2017;243 dias;"Portugal, Lisboa, Amadora";Artigo 259.º do Código dos Contratos Públicos;;;;;;;1331181;Acordo Quadro para fornecimento de corretivos da volémia e outras soluções estéreis às Instituições e Serviços do Serviço Nacional de Saúde;false;;false;;;Código dos Contratos Públicos (DL 18/2008);false;false;
Aquisição de Medicamentos do foro oncológico e imunomoduladores ao abrigo do CPA 2021/6 para o HFF para o ano de 2023;Ao abrigo de acordo-quadro (art.º 259.º);Aquisição de bens móveis;33600000-6;Principal;Produtos farmacêuticos;201300.0 € ;"HOSPITAL PROFESSOR DOUTOR FERNANDO FONSECA, EPE (503035416)";"Merck Sharp & Dohme, Lda (500191360)";"201.300,00 €";07-12-2023;05-12-2023;36 dias;"Portugal, Lisboa, Amadora";Artigo 259.º do Código dos Contratos Públicos;;;;;;;5032541;CP 2021/6 - Medicamentos do foro oncológico e imunomoduladores;false;;false;;;Código dos Contratos Públicos ( DL 111-B/2017 );false;false;
"Convite ao abrigo do(s) acordo(s)-quadro 2019/40, 2019/55, 2020/1, 2020/50, 2021/6, 2021/12, para suprir necessidades na área da saúde.";Ao abrigo de acordo-quadro (art.º 259.º);Aquisição de bens móveis;33600000-6;Principal;Produtos farmacêuticos;200802.0 € ;"HOSPITAL PROFESSOR DOUTOR FERNANDO FONSECA, EPE (503035416)";MERCK SHARP DOHME (500191360);"200.802,00 €";07-09-2022;02-02-2022;332 dias;"Portugal, Lisboa, Amadora";Artigo 259.º do Código dos Contratos Públicos;;;;;;;4028557;CP 2019/40 - Medicamentos antirretrovíricos para o tratamento da infeção por VIH;true;https://community.vortal.biz/PRODPublic/Tendering/OpportunityDetail/Index?noticeUID=PT1.NTC.1779366;false;;;"Código dos Contratos Públicos (DL111-B/2017) e Lei n.º 30/2021, de 21.05";false;false;
"FORNECIMENTO DE SERVIÇOS DE INTERNAMENTO DE CUIDADOS CONTINUADOS NAS REGIÕES: OESTE (NUTS III – 19), GRANDE LISBOA (NUTS III – 20), PENÍNSULA DE SETÚBAL (NUTS III – 21) ";Concurso público;Aquisição de serviços;85100000-0;Principal;Serviços de saúde;200475.0 € ;"Hospital Professor Doutor Fernando Fonseca, E. P. E. (503035416)";Associação de Socorros da Freguesia da Encarnação (501866213);"200.475,00 €";08-01-2016;04-01-2016;30 dias;"Portugal, Lisboa, Mafra";"Artigo 20.º, n.º 1, alínea b) do Código dos Contratos Públicos";;;;;;;Não aplicável.;Não aplicável.;false;;false;;;Código dos Contratos Públicos (DL 18/2008);false;false;
Aquisição de Reagentes - Siemens;Ajuste Direto Regime Geral;Aquisição de bens móveis;33696500-0;Principal;Reagentes de laboratório;199972.33 € ;"Hospital Professor Doutor Fernando Fonseca, E. P. E. (503035416)";"Siemens Healthcare, Unipessoal, Lda (507925173)";"199.972,33 €";07-07-2016;22-12-2015;61 dias;"Portugal, Lisboa, Amadora";"Artigo 26.º, n.º 1, alínea a) do Código dos Contratos Públicos";;;;;;;Não aplicável.;Não aplicável.;false;;false;;;Código dos Contratos Públicos (DL 18/2008);false;false;
"Convite à apresentação de propostas ao abrigo do(s) acordo(s)-quadro 2020/61; 2021/12o; 2021/55; 2021/6; 2021/61; 2022/40 ; 2022/55; 2023/304; 2023/481; 2023/491, para aquisição de medicamentos.";Ao abrigo de acordo-quadro (art.º 259.º);Aquisição de bens móveis;33600000-6;Principal;Produtos farmacêuticos;199704.57 € ;"HOSPITAL PROFESSOR DOUTOR FERNANDO FONSECA, EPE (503035416)";"JABA RECORDATI, SA. (500492867)";"199.704,57 €";07-08-2024;11-04-2024;249 dias;"Portugal, Lisboa, Amadora";Artigo 259.º do Código dos Contratos Públicos;;;;;;;6677696;491/2023 - Concurso público internacional para formação do acordo quadro de medicamentos do foro oncológico e imunomoduladores;true;https://community.vortal.biz/PRODPublic/Tendering/OpportunityDetail/Index?noticeUID=PT1.NTC.2740851;false;;;"Código dos Contratos Públicos (DL111-B/2017) e Lei n.º 30/2021, de 21.05";false;false;
Serviços de Higiene e limpeza;Ajuste Direto Regime Geral;Aquisição de serviços;90910000-9;Principal;Serviços de limpeza;199090.0 € ;"Hospital Professor Doutor Fernando Fonseca, E. P. E. (503035416)";"SÁ LIMPA - SOCIEDADE DE LIMPEZAS, LDA (504458086)";"199.090,00 €";07-02-2024;27-12-2023;31 dias;"Portugal, Lisboa, Amadora";"Artigo 24.º, n.º 1, alínea c) do Código dos Contratos Públicos";;;;;;;Não aplicável.;Não aplicável.;false;;false;;;Código dos Contratos Públicos ( DL 111-B/2017 );true;false;
"IMUNOGLOBULINA HUMANA, IV, 50MG/ML;200ML";Ajuste Direto Regime Geral;Aquisição de bens móveis;33600000-6;Principal;Produtos farmacêuticos;199080.0 € ;"Hospital Professor Doutor Fernando Fonseca, E. P. E. (503035416)";KEDRION PORTUGAL (508472830);"199.080,00 €";03-05-2021;08-04-2021;60 dias;"Portugal, Lisboa, Amadora";"Artigo 24.º, n.º 1, alínea e), subalínea ii) do Código dos Contratos Públicos";;;;;;;Não aplicável.;Não aplicável.;false;https://gov.saphety.com/bizgov/econcursos/procedurePiecesExport_206581!exportProcedure.action;false;;;Código dos Contratos Públicos ( DL 111-B/2017 );false;false;
"Convite à apresentação de propostas ao abrigo do(s) acordo(s)-quadro 2021/33 – Cardioversores Desfibrilhadores Implantáveis e Pacemakers, para aquisição de Cardioversores Desfibrilhadores Implantáveis";Ao abrigo de acordo-quadro (art.º 259.º);Aquisição de bens móveis;33600000-6;Principal;Produtos farmacêuticos;198900.0 € ;"HOSPITAL PROFESSOR DOUTOR FERNANDO FONSECA, EPE (503035416)";"MEDTRONIC PORTUGAL, LDA (504223933)";"198.900,00 €";29-04-2024;27-03-2024;305 dias;"Portugal, Lisboa, Amadora";Artigo 259.º do Código dos Contratos Públicos;;;;;;;5354504;CP 2021/33 Acordo Quadro para fornecimento de Cardioversores Desfibrilhadores Implantáveis e Pacemakers na área da Saúde;true;https://community.vortal.biz/PRODPublic/Tendering/OpportunityDetail/Index?noticeUID=PT1.NTC.2769645;false;;;"Código dos Contratos Públicos (DL111-B/2017) e Lei n.º 30/2021, de 21.05";false;false;
