Contrato de Fornecimento de Imunoglobulina Humana 50MG/ML;Ajuste Direto Regime Geral;Aquisição de bens móveis;33600000-6;Principal;Produtos farmacêuticos;320000.0 € ;"Hospital Professor Doutor Fernando Fonseca, E. P. E. (503035416)";OCTAPHARMA - PRODUTOS FARMACEUTICOS  (502820780);"320.000,00 €";17-10-2016;04-10-2016;86 dias;"Portugal, Lisboa, Amadora";"Artigo 20.º, n.º 1, alínea a) do Código dos Contratos Públicos";;;;;;;Não aplicável.;Não aplicável.;false;;false;;;Código dos Contratos Públicos (DL 18/2008);false;false;
"Aquisição de ECULIZUMAB, IV, 10MG/ML; 30 ML, SOL INJ, ao Laboratório Alexion, para o ano 2021";Ajuste Direto Regime Geral;Aquisição de bens móveis;33600000-6;Principal;Produtos farmacêuticos;316723.2 € ;"Hospital Professor Doutor Fernando Fonseca, E. P. E. (503035416)";"ALEXION PHARMA SPAIN, SL SUCURSAL EM PORTUGAL (980553768)";"316.723,20 €";29-06-2021;10-05-2021;235 dias;"Portugal, Lisboa, Amadora";"Artigo 24.º, n.º 1, alínea e), subalínea iii) do Código dos Contratos Públicos";;;;;;;Não aplicável.;Não aplicável.;false;;false;;;Código dos Contratos Públicos ( DL 111-B/2017 );true;false;
"Convite à apresentação de propostas ao abrigo do(s) acordo(s)-quadro 2020/61; 2021/12o; 2021/55; 2021/6; 2021/61; 2022/40 ; 2022/55; 2023/304; 2023/481; 2023/491, para aquisição de medicamentos.";Ao abrigo de acordo-quadro (art.º 259.º);Aquisição de bens móveis;33600000-6;Principal;Produtos farmacêuticos;314315.82 € ;"HOSPITAL PROFESSOR DOUTOR FERNANDO FONSECA, EPE (503035416)";"Takeda - Farmacêuticos Portugal, Lda. (502801204)";"314.315,82 €";07-08-2024;11-04-2024;249 dias;"Portugal, Lisboa, Amadora";Artigo 259.º do Código dos Contratos Públicos;;;;;;;6677696;491/2023 - Concurso público internacional para formação do acordo quadro de medicamentos do foro oncológico e imunomoduladores;true;https://community.vortal.biz/PRODPublic/Tendering/OpportunityDetail/Index?noticeUID=PT1.NTC.2740851;false;;;"Código dos Contratos Públicos (DL111-B/2017) e Lei n.º 30/2021, de 21.05";false;false;
"P259-2021-101-Convite ao abrigo do(s) acordo(s)-quadro 2020/2, 2021/6 e 2019/61 para aquisição de medicamentos para suprir necessidades na área da saúde.";Ao abrigo de acordo-quadro (art.º 259.º);Aquisição de bens móveis;33600000-6;Principal;Produtos farmacêuticos;313040.0 € ;"HOSPITAL PROFESSOR DOUTOR FERNANDO FONSECA, EPE (503035416)";Biogen Portugal Sociedade Farmacêutica Unipessoal Lda. (506415740);"313.040,00 €";23-09-2022;20-04-2022;255 dias;"Portugal, Lisboa, Amadora";Artigo 259.º do Código dos Contratos Públicos;;;;;;;5032541;CP 2021/6 - Medicamentos do foro oncológico e imunomoduladores;true;https://community.vortal.biz/PRODPublic/Tendering/OpportunityDetail/Index?noticeUID=PT1.NTC.1780468;false;;;"Código dos Contratos Públicos (DL111-B/2017) e Lei n.º 30/2021, de 21.05";false;false;
"Aquisição de reagentes para realização de teste de biologia molecula, no âmbito do vírus COVID-19, para o ano de 2022";Ajuste Direto Regime Geral;Aquisição de bens móveis;33696000-5;Principal;Reagentes e meios de contraste;312130.0 € ;"Hospital Professor Doutor Fernando Fonseca, E. P. E. (503035416)";"CEPHEID IBERIA, S.L.U. (SUCURSAL EM PORTUGAL) (980655684)";"312.130,00 €";20-06-2022;20-06-2022;10 dias;"Portugal, Lisboa, Amadora";"Artigo 2º, n.º 1 do DL . nº 10-A/2020, de 13.03";;;;;;;Não aplicável.;Não aplicável.;false;;false;;;"Decreto-Lei n.º 10-A/2020, de 13.03";true;false;
Aquisição de Gases Medicinais até Junho de 2018;Ajuste Direto Regime Geral;Aquisição de bens móveis;33600000-6;Principal;Produtos farmacêuticos;311202.36 € ;Hospital Prof. Doutor Fernando Fonseca E.P.E. (503035416);"Nippon Gases Portugal, Unop. Lda (501738916)";"311.202,36 €";06-04-2018;23-03-2018;180 dias;"Portugal, Lisboa, Amadora";"Artigo 24.º, n.º 1, alínea c) do Código dos Contratos Públicos";;;;;;;Não aplicável.;Não aplicável.;false;;false;;;Código dos Contratos Públicos ( DL 111-B/2017 );false;false;
Reforço da Limpeza de Zonas Críticas;Ajuste Direto Regime Geral;Aquisição de serviços;90000000-7;Principal;"Serviços relativos a águas residuais, resíduos, limpeza e ambiente";311063.29 € ;"Hospital Professor Doutor Fernando Fonseca, E. P. E. (503035416)";Eulen S.A. - Sucursal em Portugal (980122538);"311.063,29 €";21-07-2021;15-07-2021;170 dias;"Portugal, Lisboa, Amadora";"Artigo 2º, n.º 1 do DL . nº 10-A/2020, de 13.03";;;;;;;Não aplicável.;Não aplicável.;false;;false;;;"Decreto-Lei n.º 10-A/2020, de 13.03";true;false;
"P259-2021-101-Convite ao abrigo do(s) acordo(s)-quadro 2020/2, 2021/6 e 2019/61 para aquisição de medicamentos para suprir necessidades na área da saúde.";Ao abrigo de acordo-quadro (art.º 259.º);Aquisição de bens móveis;33600000-6;Principal;Produtos farmacêuticos;309230.0 € ;"HOSPITAL PROFESSOR DOUTOR FERNANDO FONSECA, EPE (503035416)";Biogen Portugal Sociedade Farmacêutica Unipessoal Lda. (506415740);"309.230,00 €";23-09-2022;20-04-2022;255 dias;"Portugal, Lisboa, Amadora";Artigo 259.º do Código dos Contratos Públicos;;;;;;;5032541;CP 2021/6 - Medicamentos do foro oncológico e imunomoduladores;true;https://community.vortal.biz/PRODPublic/Tendering/OpportunityDetail/Index?noticeUID=PT1.NTC.1780468;false;;;"Código dos Contratos Públicos (DL111-B/2017) e Lei n.º 30/2021, de 21.05";false;false;
Aquisição de serviços de manutenção da General Electric;Ajuste Direto Regime Geral;Aquisição de serviços;50000000-5;Principal;Serviços de reparação e manutenção;308020.18 € ;Hospital Prof. Doutor Fernando Fonseca E.P.E. (503035416);General Electric (500357129);"308.020,18 €";05-07-2016;21-01-2016;365 dias;"Portugal, Lisboa, Amadora";"Artigo 24.º, n.º 1, alínea e) do Código dos Contratos Públicos";;;;;;;Não aplicável.;Não aplicável.;false;;false;;;Código dos Contratos Públicos (DL 18/2008);false;false;
"Aquisição de Consumíveis para Sistema de Mapeamento Intra-Cardíaco com consola Ensite, para o Hospital Prof. Dr. Fernando Fonseca, EPE., para o ano de 2022";Ajuste Direto Regime Geral;Aquisição de bens móveis;33698000-9;Principal;Produtos para fins clínicos;306125.0 € ;Hospital Prof. Doutor Fernando Fonseca E.P.E. (503035416);ABBOTT MEDICAL PORT. DIST. PROD.MED. (EX. ST.JUDE) (504180746);"306.125,00 €";29-06-2023;17-01-2022;364 dias;"Portugal, Lisboa, Amadora";"Artigo 24.º, n.º 1, alínea e), subalínea ii) do Código dos Contratos Públicos";;;;;;;Não aplicável.;Não aplicável.;false;https://gov.saphety.com/bizgov/econcursos/procedurePiecesExport_219082!exportProcedure.action;false;;;Código dos Contratos Públicos ( DL 111-B/2017 );false;false;
"Aquisição de Imunoglobulina Humana 50ml, 100ml e 200ml, ao Lab. Kedrion, para a ULSASI, para o ano 2024";Ajuste Direto Regime Geral;Aquisição de bens móveis;33600000-6;Principal;Produtos farmacêuticos;305250.0 € ;"HOSPITAL PROFESSOR DOUTOR FERNANDO FONSECA, EPE (503035416)";KEDRION BIOPHARMA  (980701996);"305.250,00 €";12-08-2024;01-04-2024;60 dias;"Portugal, Lisboa, Amadora";"Artigo 24.º, n.º 1, alínea e), subalínea ii) do Código dos Contratos Públicos";;;;;;;Não aplicável.;Não aplicável.;false;https://community.vortal.biz/PRODPublic/Tendering/OpportunityDetail/Index?noticeUID=PT1.NTC.2823844;false;;;"Código dos Contratos Públicos (DL111-B/2017) e Lei n.º 30/2021, de 21.05";false;false;
"Aquisição de Medicamentos diversos, ao abrigo do CPA 2019/55, para o HFF, para o ano 2023";Ao abrigo de acordo-quadro (art.º 259.º);Aquisição de bens móveis;33600000-6;Principal;Produtos farmacêuticos;305102.0 € ;"HOSPITAL PROFESSOR DOUTOR FERNANDO FONSECA, EPE (503035416)";"JANSSEN CILAG FARMACEUTICA, LDA (500189412)";"305.102,00 €";06-09-2023;11-01-2023;354 dias;"Portugal, Lisboa, Amadora";Artigo 259.º do Código dos Contratos Públicos;;;;;;;4308617;CP 2019/55 - Medicamentos diversos;false;https://community.vortal.biz/PRODPublic/Tendering/OpportunityDetail/Index?noticeUID=PT1.NTC.2171040;false;;;"Código dos Contratos Públicos (DL111-B/2017) e Lei n.º 30/2021, de 21.05";false;false;
Convite à apresentação de propostas ao abrigo do(s) acordo(s)-quadro 2022/13 (vacinas e tuberculinas) para aquisição de vacinas.;Ao abrigo de acordo-quadro (art.º 259.º);Aquisição de bens móveis;33600000-6;Principal;Produtos farmacêuticos;303893.98 € ;"HOSPITAL PROFESSOR DOUTOR FERNANDO FONSECA, EPE (503035416)";"GLAXOSMITHKLINE-PROD. FARMACÊUTICOS, LDA. (500139962)";"303.893,98 €";25-03-2024;21-03-2024;337 dias;"Portugal, Lisboa, Amadora";Artigo 259.º do Código dos Contratos Públicos;;;;;;;5839055;CP 2022/13 - Vacinas e tuberculinas;true;https://community.vortal.biz/PRODPublic/Tendering/OpportunityDetail/Index?noticeUID=PT1.NTC.2765990;false;;;"Código dos Contratos Públicos (DL111-B/2017) e Lei n.º 30/2021, de 21.05";false;false;
Serviços de Limpeza;Ajuste Direto Regime Geral;Aquisição de serviços;90910000-9;Principal;Serviços de limpeza;303361.4 € ;"Hospital Professor Doutor Fernando Fonseca, E. P. E. (503035416)";"SÁ LIMPA - FACILITY SERVICES, LDA (504458086)";"303.361,40 €";31-10-2022;28-10-2022;61 dias;"Portugal, Lisboa, Amadora";"Artigo 24.º, n.º 1, alínea c) do Código dos Contratos Públicos";;;;;;;Não aplicável.;Não aplicável.;false;;false;;;Código dos Contratos Públicos ( DL 111-B/2017 );true;false;
" Aquisição de Corretivos da volémia, soluções para conservação de órgãos, hemodiálise, hemofiltração e outras soluções estéreis ao abrigo do CPA 2023/306 para o HFF para o ano de 2024";Ao abrigo de acordo-quadro (art.º 259.º);Aquisição de bens móveis;33600000-6;Principal;Produtos farmacêuticos;301934.31 € ;"Hospital Professor Doutor Fernando Fonseca, E. P. E. (503035416)";"LABESFAL, Laboratório Almiro S.A. (501169580)";"301.934,31 €";29-02-2024;29-02-2024;365 dias;"Portugal, Lisboa, Amadora";Artigo 259.º do Código dos Contratos Públicos;;;;;;;6268838;"306/2023 - Acordo Quadro para fornecimento de corretivos da volémia, soluções para conservação de órgãos, hemodiálise, hemofiltração e outras soluções estéreis, na área da saúde";false;https://community.vortal.biz/PRODPublic/Tendering/OpportunityDetail/Index?noticeUID=PT1.NTC.2703548;false;;;"Código dos Contratos Públicos (DL111-B/2017) e Lei n.º 30/2021, de 21.05";false;false;
"Aquisição de Consumíveis para Sistema de Mapeamento Intra-Cardíaco com consola Ensite, para o Hospital Prof. Dr. Fernando Fonseca, EPE., para o ano de 2023";Ajuste Direto Regime Geral;Aquisição de bens móveis;33698000-9;Principal;Produtos para fins clínicos;301387.5 € ;Hospital Prof. Doutor Fernando Fonseca E.P.E. (503035416);ABBOTT MEDICAL PORT. DIST. PROD.MED. (EX. ST.JUDE) (504180746);"301.387,50 €";29-06-2023;04-01-2023;364 dias;"Portugal, Lisboa, Amadora";"Artigo 24.º, n.º 1, alínea e), subalínea ii) do Código dos Contratos Públicos";;;;;;;Não aplicável.;Não aplicável.;false;https://gov.saphety.com/bizgov/econcursos/procedurePiecesExport_239407!exportProcedure.action;false;;;Código dos Contratos Públicos ( DL 111-B/2017 );false;false;
Contratação de Serviços de Vigilância e Segurança;Ajuste Direto Regime Geral;Aquisição de serviços;79710000-4;Principal;Serviços de segurança;300690.45 € ;"Hospital Professor Doutor Fernando Fonseca, E. P. E. (503035416)";"Prosegur Activa Portugal, Unipessoal, Lda (501290567)";"300.690,45 €";14-07-2016;16-02-2016;151 dias;"Portugal, Lisboa, Amadora";"Artigo 24.º, n.º 1, alínea c) do Código dos Contratos Públicos";;;;;;;Não aplicável.;Não aplicável.;false;;false;;;Código dos Contratos Públicos (DL 18/2008);false;false;
"AQUISIÇÃO DE SOLUÇÃO MAPP PARA AS ÁREAS DE COLHEITA DE AMOSTRAS LABORATORIAIS E SEGURANÇA TRANSFUSIONAL (EXPANSÃO), PARA A ULSASI, E.P.E.";Ajuste Direto Regime Geral;Aquisição de serviços;72212213-5;Principal;Serviços de desenvolvimento de software para melhoria de sistemas operativos;300200.0 € ;"Unidade Local de Saude Amadora/Sintra, E.P.E. (503035416)";BIQ - CONSULTORES DE ENG. E GESTAO INDUS (504105337);"300.200,00 €";18-07-2024;16-07-2024;30 dias;"Portugal, Lisboa, Amadora";"Artigo 26.º, n.º 1, alínea a) do Código dos Contratos Públicos";;;;;;;Não aplicável.;Não aplicável.;false;https://community.vortal.biz/PRODPublic/Tendering/OpportunityDetail/Index?noticeUID=PT1.NTC.2905158;false;;;"Código dos Contratos Públicos (DL111-B/2017) e Lei n.º 30/2021, de 21.05";false;false;
"15D0532623 - Aquisição de solução MAPP para as áreas de colheita de amostras laboratoriais e segurança transfusional (expansão), para o HFF, EPE, com referência SAMA POCI-05-5762-FSE-000357";Ajuste Direto Regime Geral;Aquisição de bens móveis;48170000-0;Principal;Pacote de software de conformidade;300200.0 € ;"Hospital Professor Doutor Fernando Fonseca, E. P. E. (503035416)";"BIQ - HEALTH SOLUTIONS, LDA. (504105337)";"300.200,00 €";22-08-2023;17-08-2023;30 dias;"Portugal, Lisboa, Amadora";"Artigo 26.º, n.º 1, alínea a) do Código dos Contratos Públicos";;;;;;;Não aplicável.;Não aplicável.;false;https://community.vortal.biz/PRODPublic/Tendering/OpportunityDetail/Index?noticeUID=PT1.NTC.2459060;false;;;"Código dos Contratos Públicos (DL111-B/2017) e Lei n.º 30/2021, de 21.05";false;false;
"P259-2021-127 - Convite ao abrigo do(s) acordo(s)-quadro 2019/40 (Medicamentos antirretrovíricos para o tratamento da infeção por VIH), 2019/55 (Medicamentos Diversos), 2020/1 (Medicamentos do Aparelh";Ao abrigo de acordo-quadro (art.º 259.º);Aquisição de bens móveis;33600000-6;Principal;Produtos farmacêuticos;300161.4 € ;"HOSPITAL PROFESSOR DOUTOR FERNANDO FONSECA, EPE (503035416)";"JANSSEN CILAG FARMACEUTICA, LDA. (500189412)";"300.161,40 €";20-09-2022;23-02-2022;311 dias;"Portugal, Lisboa, Amadora";Artigo 259.º do Código dos Contratos Públicos;;;;;;;5032541;CP 2021/6 - Medicamentos do foro oncológico e imunomoduladores;true;https://community.vortal.biz/PRODPublic/Tendering/OpportunityDetail/Index?noticeUID=PT1.NTC.1778864;false;;;"Código dos Contratos Públicos (DL111-B/2017) e Lei n.º 30/2021, de 21.05";false;false;
"P259-2021-127 - Convite ao abrigo do(s) acordo(s)-quadro 2019/40 (Medicamentos antirretrovíricos para o tratamento da infeção por VIH), 2019/55 (Medicamentos Diversos), 2020/1 (Medicamentos do Aparelh";Ao abrigo de acordo-quadro (art.º 259.º);Aquisição de bens móveis;33600000-6;Principal;Produtos farmacêuticos;300161.4 € ;"HOSPITAL PROFESSOR DOUTOR FERNANDO FONSECA, EPE (503035416)";"JANSSEN CILAG FARMACEUTICA, LDA. (500189412)";"300.161,40 €";20-09-2022;23-02-2022;311 dias;"Portugal, Lisboa, Amadora";Artigo 259.º do Código dos Contratos Públicos;;;;;;;5032541;CP 2021/6 - Medicamentos do foro oncológico e imunomoduladores;true;https://community.vortal.biz/PRODPublic/Tendering/OpportunityDetail/Index?noticeUID=PT1.NTC.1778864;false;;;"Código dos Contratos Públicos (DL111-B/2017) e Lei n.º 30/2021, de 21.05";false;false;
"Aquisição de 20.000 (vinte mil) Fatos de proteção integral, à empresa Enerre, no âmbito do COVID-19, para o Hospital Prof. Dr. Fernando Fonseca, EPE";Ajuste Direto Regime Geral;Aquisição de bens móveis;33698000-9;Principal;Produtos para fins clínicos;300000.0 € ;"Hospital Professor Doutor Fernando Fonseca, E. P. E. (503035416)";"Enerre - Produções e Representações,Lda (500732680)";"300.000,00 €";07-05-2020;22-04-2020;1 dias;"Portugal, Lisboa, Amadora";"Artigo 24.º, n.º 1, alínea c) do Código dos Contratos Públicos";;;;;;;Não aplicável.;Não aplicável.;false;;false;;;Código dos Contratos Públicos ( DL 111-B/2017 );true;false;
Aquisição de Batas de Proteção e Batas Impermeáveis com punho.;Ajuste Direto Regime Geral;Aquisição de bens móveis;33698000-9;Principal;Produtos para fins clínicos;299000.0 € ;"Hospital Professor Doutor Fernando Fonseca, E. P. E. (503035416)";"DINAMICA TRADE UNIPESSOAL, LDA (510782736)";"299.000,00 €";25-01-2021;20-01-2021;30 dias;"Portugal, Lisboa, Amadora";"Artigo 2º, n.º 1 do DL . nº 10-A/2020, de 13.03";;;;;;;Não aplicável.;Não aplicável.;false;;false;;;"Decreto-Lei n.º 10-A/2020, de 13.03";true;false;
Serviços de recolha e tratamento de resíduos hospitalares;Ajuste Direto Regime Geral;Aquisição de serviços;90524100-7;Principal;Serviços de recolha de resíduos hospitalares;298907.19 € ;"Hospital Professor Doutor Fernando Fonseca, E. P. E. (503035416)";"Ambimed – Gestão Ambiental, Lda. (503593427)";"298.907,19 €";20-01-2016;13-01-2016;334 dias;"Portugal, Lisboa, Amadora";"Artigo 20.º, n.º 1, alínea a) do Código dos Contratos Públicos";;;;;;;Não aplicável.;Não aplicável.;false;;false;;;Código dos Contratos Públicos (DL 18/2008);false;false;
SEGUROS ;Ajuste Direto Regime Geral;Aquisição de serviços;66510000-8;Principal;Serviços de seguros;296695.94 € ;"Hospital Professor Doutor Fernando Fonseca, E. P. E. (503035416)";"Fidelidade – Companhia de Seguros, S.A. (500918880)";"296.695,94 €";22-09-2017;26-01-2017;120 dias;"Portugal, Lisboa, Amadora";"Artigo 24.º, n.º 1, alínea c) do Código dos Contratos Públicos";;;;;;;Não aplicável.;Não aplicável.;false;;false;;;Código dos Contratos Públicos (DL 18/2008);false;false;
1035/2024 - Convite à apresentação de propostas ao abrigo do(s) acordo(s)-quadro 2022/13 (Vacinas e tuberculinas) para aquisição da vacina contra a gripe;Ao abrigo de acordo-quadro (art.º 259.º);Aquisição de bens móveis;33651660-2;Principal;Vacinas antigripe;294800.0 € ;"Unidade Local de Saúde de Amadora/Sintra, E. P. E. (503035416)";"SANOFI- PRODUTOS FARMACÊUTICOS,LDA. (500134960)";"294.800,00 €";19-07-2024;18-07-2024;165 dias;"Portugal, Lisboa, Amadora";Artigo 259.º do Código dos Contratos Públicos;;;;;;;5839055;CP 2022/13 - Vacinas e tuberculinas;true;https://community.vortal.biz/PRODPublic/Tendering/OpportunityDetail/Index?noticeUID=PT1.NTC.2941010;false;;;"Código dos Contratos Públicos (DL111-B/2017) e Lei n.º 30/2021, de 21.05";false;false;
Serviços de Recolha e Tratamento de Resíduos Hospitalares;Concurso público;Aquisição de serviços;90524400-0;Principal;"Recolha, transporte e eliminação de resíduos hospitalares";294518.0 € ;"Hospital Professor Doutor Fernando Fonseca, E. P. E. (503035416)";"Ambimed - Gestão Ambiental, Lda (503593427)";"294.518,00 €";19-07-2016;02-02-2016;365 dias;"Portugal, Lisboa, Amadora";"Artigo 20.º, n.º 1, alínea b) do Código dos Contratos Públicos";;;;;;;Não aplicável.;Não aplicável.;false;;false;;;Código dos Contratos Públicos (DL 18/2008);false;false;
Convite à apresentação de propostas ao abrigo do(s) acordo(s)-quadro 2022/13 (vacinas e tuberculinas) para aquisição de vacinas.;Ao abrigo de acordo-quadro (art.º 259.º);Aquisição de bens móveis;33600000-6;Principal;Produtos farmacêuticos;294389.3 € ;"HOSPITAL PROFESSOR DOUTOR FERNANDO FONSECA, EPE (503035416)";"MERCK SHARP & DOHME, LDA. (500191360)";"294.389,30 €";25-03-2024;21-03-2024;337 dias;"Portugal, Lisboa, Amadora";Artigo 259.º do Código dos Contratos Públicos;;;;;;;5839055;CP 2022/13 - Vacinas e tuberculinas;true;https://community.vortal.biz/PRODPublic/Tendering/OpportunityDetail/Index?noticeUID=PT1.NTC.2765990;false;;;"Código dos Contratos Públicos (DL111-B/2017) e Lei n.º 30/2021, de 21.05";false;false;
Aquisição de BENRALIZUMAB SC 30MG1ML SOL INJ CAN ao Lab. Astrazeneca para a ULSASI para o ano de 2024;Ajuste Direto Regime Geral;Aquisição de bens móveis;33600000-6;Principal;Produtos farmacêuticos;293907.2 € ;"HOSPITAL PROFESSOR DOUTOR FERNANDO FONSECA, EPE (503035416)";"AstraZeneca - Produtos Farmacêuticos, Lda. (502942240)";"293.907,20 €";12-03-2024;12-03-2024;337 dias;"Portugal, Lisboa, Amadora";"Artigo 24.º, n.º 1, alínea e), subalínea iii) do Código dos Contratos Públicos";;;;;;;Não aplicável.;Não aplicável.;false;https://community.vortal.biz/PRODPublic/Tendering/OpportunityDetail/Index?noticeUID=PT1.NTC.2736974;false;;;"Código dos Contratos Públicos (DL111-B/2017) e Lei n.º 30/2021, de 21.05";false;false;
Serviços de Higiene e Limpeza e Recolha Intra-hospitalar de Residuos ;Ajuste Direto Regime Geral;Aquisição de serviços;90910000-9;Principal;Serviços de limpeza;292611.2 € ;Hospital Prof. Doutor Fernando Fonseca E.P.E. (503035416);"Washproof – Serviços de Limpeza, Lda (508427053)";"292.611,20 €";06-07-2016;28-11-2014;122 dias;"Portugal, Lisboa, Amadora";"Artigo 27.º, n.º 1, alínea a) do Código dos Contratos Públicos";;;;;;;Não aplicável.;Não aplicável.;false;;false;;;Código dos Contratos Públicos (DL 18/2008);false;false;
"Prestação de serviços de vigilância e segurança aos Centros de Saúde de Sintra, integrados na Unidade Local de Saúde de Amadora/";Ajuste Direto Regime Geral;Aquisição de serviços;79714000-2;Principal;Serviços de vigilância;291054.0 € ;"Unidade Local de Saúde de Amadora/Sintra, E. P. E. (503035416)";"PRESTIBEL - Empresa de Segurança, SA (501326456)";"291.054,00 €";03-07-2024;03-07-2024;91 dias;"Portugal, Lisboa, Amadora";"Artigo 24.º, n.º 1, alínea c) do Código dos Contratos Públicos";;;;;;;Não aplicável.;Não aplicável.;false;;false;;;Código dos Contratos Públicos ( DL 111-B/2017 );true;false;
Aquisição de serviços de manutenção aos equipamentos de imagiologia diagnostico e suporte de vida para o ano de 2019 ;Ajuste Direto Regime Geral;Aquisição de serviços;50421200-4;Principal;Serviços de reparação e manutenção de equipamentos de raios X;289077.51 € ;"Hospital Professor Doutor Fernando Fonseca, E. P. E. (503035416)";General Electric Healthcare (500357129);"289.077,51 €";04-03-2019;07-01-2019;365 dias;"Portugal, Lisboa, Amadora";"Artigo 24.º, n.º 1, alínea e), subalínea iii) do Código dos Contratos Públicos";;;;;;;Não aplicável.;Não aplicável.;false;;false;;;Código dos Contratos Públicos ( DL 111-B/2017 );true;false;
Seguros;Ajuste Direto Regime Geral;Aquisição de serviços;66510000-8;Principal;Serviços de seguros;287345.72 € ;Hospital Prof. Doutor Fernando Fonseca E.P.E. (503035416);"Fidelidade – Companhia de Seguros, S.A. (500918880)";"287.345,72 €";22-09-2017;12-05-2017;120 dias;"Portugal, Lisboa, Amadora";"Artigo 24.º, n.º 1, alínea c) do Código dos Contratos Públicos";;;;;;;Não aplicável.;Não aplicável.;false;;false;;;Código dos Contratos Públicos (DL 18/2008);false;false;
"P259-2021-127 - Convite ao abrigo do(s) acordo(s)-quadro 2019/40 (Medicamentos antirretrovíricos para o tratamento da infeção por VIH), 2019/55 (Medicamentos Diversos), 2020/1 (Medicamentos do Aparelh";Ao abrigo de acordo-quadro (art.º 259.º);Aquisição de bens móveis;33600000-6;Principal;Produtos farmacêuticos;287312.4 € ;"HOSPITAL PROFESSOR DOUTOR FERNANDO FONSECA, EPE (503035416)";GILEAD SCIENCES LDA. (503604704);"287.312,40 €";20-09-2022;23-02-2022;311 dias;"Portugal, Lisboa, Amadora";Artigo 259.º do Código dos Contratos Públicos;;;;;;;5032541;CP 2021/6 - Medicamentos do foro oncológico e imunomoduladores;true;https://community.vortal.biz/PRODPublic/Tendering/OpportunityDetail/Index?noticeUID=PT1.NTC.1778864;false;;;"Código dos Contratos Públicos (DL111-B/2017) e Lei n.º 30/2021, de 21.05";false;false;
Aquisição de Serviços de Manutenção para equipamentos de Imagiologia da General Eletric 2018;Ajuste Direto Regime Geral;Aquisição de serviços;50000000-5;Principal;Serviços de reparação e manutenção;286698.26 € ;"Hospital Professor Doutor Fernando Fonseca, E. P. E. (503035416)";"General Electric Helathcare Portugal, Sociedade Unipessoal, Lda. (500357129)";"286.698,26 €";10-01-2019;21-09-2018;365 dias;"Portugal, Lisboa, Amadora";"Artigo 24.º, n.º 1, alínea e), subalínea ii) do Código dos Contratos Públicos";;;;;;;Não aplicável.;Não aplicável.;false;;false;;;Código dos Contratos Públicos ( DL 111-B/2017 );true;false;
Concurso público com publicação no jornal oficial da união europeia para aquisição de sistemas para ventilação e anestesia;Concurso público;Aquisição de bens móveis;33100000-1;Principal;Equipamento médico;286491.0 € ;"HOSPITAL PROFESSOR DOUTOR FERNANDO FONSECA, EPE (503035416)";"MEDICINALIA - CORMEDICA,LDA. (500684324)";"286.491,00 €";02-11-2023;30-10-2023;213 dias;Portugal;"Artigo 20.º, n.º 1, alínea a) do Código dos Contratos Públicos";;;;;;;Não aplicável.;Não aplicável.;true;https://community.vortal.biz/PRODPublic/Tendering/OpportunityDetail/Index?noticeUID=PT1.NTC.2390361;false;;;"Código dos Contratos Públicos (DL111-B/2017) e Lei n.º 30/2021, de 21.05";false;false;
"Convite à apresentação de propostas ao abrigo do(s) acordo(s)-quadro 2021/47, 2021/61, 2022/40, 2023/305, 2023/481, 2023/491 e 2023/492";Ao abrigo de acordo-quadro (art.º 259.º);Aquisição de bens móveis;33600000-6;Principal;Produtos farmacêuticos;286040.65 € ;"HOSPITAL PROFESSOR DOUTOR FERNANDO FONSECA, EPE (503035416)";LILLY PORTUGAL - PRODUTOS FARMACEUTICOS (500165602);"286.040,65 €";08-04-2024;04-04-2024;334 dias;"Portugal, Lisboa, Amadora";Artigo 259.º do Código dos Contratos Públicos;;;;;;;6677696;491/2023 - Concurso público internacional para formação do acordo quadro de medicamentos do foro oncológico e imunomoduladores;true;https://community.vortal.biz/PRODPublic/Tendering/OpportunityDetail/Index?noticeUID=PT1.NTC.2740051;false;;;"Código dos Contratos Públicos (DL111-B/2017) e Lei n.º 30/2021, de 21.05";false;false;
